Sheet: statistics
A1: conf. series | B1: 25
A2: no. of conf. | B2: =COUNTA(IJCAI!RC[-1]:R[998]C[-1])+COUNTA(CVPR!RC[-1]:R[998]C[-1])+COUNTA(RecSys!RC[-1]:R[998]C[-1])+COUNTA(SP!RC[-1]:R[998]C[-1])+COUNTA(AAAI!RC[-1]:R[998]C[-1])+COUNTA(ICDE!RC[-1]:R[998]C[-1])+COUNTA(UIST!RC[-1]:R[998]C[-1])+COUNTA(ICSE!RC[-1]:R[998]C[-1])+COUNTA(PLDI!RC[-1]:R[998]C[-1])+COUNTA(ASPLOS!RC[-1]:R[998]C[-1])+COUNTA(EDBT!RC[-1]:R[998]C[-1])+COUNTA(PKDD!RC[-1]:R[998]C[-1])+COUNTA(VLDB!RC[-1]:R[998]C[-1])+COUNTA(CCS!RC[-1]:R[998]C[-1])+COUNTA(USENIX!RC[-1]:R[998]C[-1])+COUNTA(NDSS!RC[-1]:R[998]C[-1])+COUNTA(EuroCrypt!RC[-1]:R[998]C[-1])+COUNTA(DSN!RC[-1]:R[998]C[-1])+COUNTA(FOCS!RC[-1]:R[998]C[-1])+COUNTA(HPCA!RC[-1]:R[998]C[-1])+COUNTA(ICCV!RC[-1]:R[998]C[-1])+COUNTA(ISCA!RC[-1]:R[998]C[-1])+COUNTA(NIPS!RC[-1]:R[998]C[-1])+COUNTA(PERCOM!RC[-1]:R[998]C[-1])+COUNTA(PODC!RC[-1]:R[998]C[-1]) -> 717
A3: no. entries | B3: =CVPR!R[30]C+NIPS!R[32]C+ICCV!R[17]C+IJCAI!R[27]C+AAAI!R[32]C+ISCA!R[46]C+HPCA!R[25]C+FOCS!R[30]C+PERCOM!R[16]C+PODC!R[38]C+VLDB!R[34]C+RecSys!R[12]C+EDBT!R[21]C+DSN!R[19]C+PKDD!R[22]C+ICSE!R[40]C+PLDI!R[37]C+ASPLOS!R[24]C+ICDE!R[35]C+UIST!R[32]C+CCS!R[27]C+SP!R[40]C+USENIX!R[29]C+NDSS!R[26]C+EuroCrypt!R[38]C -> 0
A4: no attribures | B4: 15
A5: type of events | B5: conf , sym
A6: No. subfields | B6: 5

Sheet: CVPR
A1: Title | B1: Event[Start date] | C1: Event[Acronym] | D1: Event[Series] | E1: Event[Start date] | F1: Event[End date] | G1: Event[Submitted papers] | H1: Event[Accepted papers] | I1: Event[Submission Rate] | J1: Event[City] | K1: Event[State] | L1: Event[Country] | M1: Event[Field] | N1: Event[Type] | O1: Event[Homepage]
A2: IEEE Conference on Computer Vision and Pattern Recognition | B2: 2018 | C2: CVPR 2018 | D2: CVPR | E2: 2018-06-18T00:00:00.000 | F2: 2018-06-22T00:00:00.000 | J2: Salt Lake | K2: Utah | L2: USA | M2: Computer Vision | N2: Conference | O2: cvpr2018.thecvf.com/
A3: IEEE Conference on Computer Vision and Pattern Recognition | B3: 2017 | C3: CVPR 2017 | D3: CVPR | E3: 2017-07-21T00:00:00.000 | F3: 2017-07-27T00:00:00.000 | G3: 2620 | H3: 783 | I3: =RC[-1]/RC[-2] -> 0.29885496183206106 | J3: Honolulu | L3: USA | M3: Computer Vision | N3: Conference | O3: cvpr2017.thecvf.com/
A4: IEEE Conference on Computer Vision and Pattern Recognition | B4: 2016 | C4: CVPR 2016 | D4: CVPR | E4: 2016-06-27T00:00:00.000 | F4: 2016-06-30T00:00:00.000 | G4: 2145 | H4: 643 | I4: =RC[-1]/RC[-2] -> 0.29976689976689974 | J4: Las Vegas | L4: USA | M4: Computer Vision | N4: Conference | O4: cvpr2016.thecvf.com/
A5: IEEE Conference on Computer Vision and Pattern Recognition | B5: 2015 | C5: CVPR 2015 | D5: CVPR | E5: 2015-06-07T00:00:00.000 | F5: 2015-06-12T00:00:00.000 | G5: 2123 | H5: 602 | I5: =RC[-1]/RC[-2] -> 0.28356099858690531 | J5: Boston | L5: USA | M5: Computer Vision | N5: Conference | O5: www.pamitc.org/cvpr15/
A6: IEEE Conference on Computer Vision and Pattern Recognition | B6: 2014 | C6: CVPR 2014 | D6: CVPR | E6: 2014-06-23T00:00:00.000 | F6: 2014-06-28T00:00:00.000 | G6: 1807 | H6: 540 | I6: =RC[-1]/RC[-2] -> 0.29883785279468733 | J6: Columbus | L6: USA | M6: Computer Vision | N6: Conference | O6: www.pamitc.org/cvpr14/
A7: IEEE Conference on Computer Vision and Pattern Recognition | B7: 2013 | C7: CVPR 2013 | D7: CVPR | E7: 2013-06-23T00:00:00.000 | F7: 2013-06-28T00:00:00.000 | G7: 1798 | H7: 472 | I7: =RC[-1]/RC[-2] -> 0.26251390433815353 | J7: Portland | L7: USA | M7: Computer Vision | N7: Conference | O7: www.pamitc.org/cvpr13/
A8: IEEE Conference on Computer Vision and Pattern Recognition | B8: 2012 | C8: CVPR 2012 | D8: CVPR | E8: 2012-06-16T00:00:00.000 | F8: 2012-06-21T00:00:00.000 | G8: 1933 | H8: 466 | I8: =RC[-1]/RC[-2] -> 0.24107604759441284 | J8: Providence | L8: USA | M8: Computer Vision | N8: Conference
A9: IEEE Conference on Computer Vision and Pattern Recognition | B9: 2011 | C9: CVPR 2011 | D9: CVPR | E9: 2011-06-20T00:00:00.000 | F9: 2011-06-25T00:00:00.000 | G9: 1677 | H9: 438 | I9: =RC[-1]/RC[-2] -> 0.26118067978533094 | J9: Colorado Springs | L9: USA | M9: Computer Vision | N9: Conference
A10: IEEE Conference on Computer Vision and Pattern Recognition | B10: 2010 | C10: CVPR 2010 | D10: CVPR | E10: 2010-06-13T00:00:00.000 | F10: 2010-06-18T00:00:00.000 | G10: 1724 | H10: 461 | I10: =RC[-1]/RC[-2] -> 0.26740139211136893 | J10: San Francisco | K10: California | L10: USA | M10: Computer Vision | N10: Conference
A11: IEEE Computer Society Conference on Computer Vision and Pattern Recognition | B11: 2009 | C11: CVPR 2009 | D11: CVPR | E11: 2009-06-20T00:00:00.000 | F11: 2009-06-25T00:00:00.000 | G11: 1464 | H11: 383 | I11: =RC[-1]/RC[-2] -> 0.26161202185792348 | J11: Miami | K11: Florida | L11: USA | M11: Computer Vision | N11: Conference
A12: IEEE Computer Society Conference on Computer Vision and Pattern Recognition | B12: 2008 | C12: CVPR 2008 | D12: CVPR | E12: 2008-06-24T00:00:00.000 | F12: 2008-06-26T00:00:00.000 | G12: 1593 | H12: 508 | I12: =RC[-1]/RC[-2] -> 0.31889516635279347 | J12: Anchorage | K12: Alaska | L12: USA | M12: Computer Vision | N12: Conference
A13: IEEE Computer Society Conference on Computer Vision and Pattern Recognition | B13: 2007 | C13: CVPR 2007 | D13: CVPR | E13: 2007-06-18T00:00:00.000 | F13: 2007-06-23T00:00:00.000 | G13: 1250 | H13: 353 | I13: =RC[-1]/RC[-2] -> 0.28239999999999998 | J13: Minneapolis | K13: Minnesota | L13: USA | M13: Computer Vision | N13: Conference
A14: IEEE Computer Society Conference on Computer Vision and Pattern Recognition | B14: 2006 | C14: CVPR 2006 | D14: CVPR | E14: 2006-06-17T00:00:00.000 | F14: 2006-06-22T00:00:00.000 | G14: 1131 | H14: 318 | I14: =RC[-1]/RC[-2] -> 0.28116710875331563 | J14: New York | K14: New York | L14: USA | M14: Computer Vision | N14: Conference
A15: IEEE Computer Society Conference on Computer Vision and Pattern Recognition | B15: 2005 | C15: CVPR 2005 | D15: CVPR | E15: 2005-06-20T00:00:00.000 | F15: 2005-06-26T00:00:00.000 | G15: 1160 | H15: 324 | I15: =RC[-1]/RC[-2] -> 0.27931034482758621 | J15: San Diego | K15: California | L15: USA | M15: Computer Vision | N15: Conference
A16: IEEE Computer Society Conference on Computer Vision and Pattern Recognition | B16: 2004 | C16: CVPR 2004 | D16: CVPR | E16: 2004-06-27T00:00:00.000 | F16: 2004-07-02T00:00:00.000 | G16: 873 | H16: 260 | I16: =RC[-1]/RC[-2] -> 0.29782359679266895 | J16: Washington | L16: USA | M16: Computer Vision | N16: Conference
A17: IEEE Computer Society Conference on Computer Vision and Pattern Recognition | B17: 2003 | C17: CVPR 2003 | D17: CVPR | E17: 2003-06-16T00:00:00.000 | F17: 2003-06-22T00:00:00.000 | G17: 905 | H17: 209 | I17: =RC[-1]/RC[-2] -> 0.23093922651933702 | J17: Madison | L17: USA | M17: Computer Vision | N17: Conference
A18: IEEE Computer Society Conference on Computer Vision and Pattern Recognition | B18: 2001 | C18: CVPR 2001 | D18: CVPR | E18: 2001-12-08T00:00:00.000 | F18: 2001-12-14T00:00:00.000 | G18: 920 | H18: 273 | I18: =RC[-1]/RC[-2] -> 0.29673913043478262 | J18: Kauai | L18: USA | M18: Computer Vision | N18: Conference
A19: Conference on Computer Vision and Pattern Recognition | B19: 2000 | C19: CVPR 2000 | D19: CVPR | E19: 2000-06-13T00:00:00.000 | F19: 2000-06-15T00:00:00.000 | G19: 466 | H19: 220 | I19: =RC[-1]/RC[-2] -> 0.47210300429184548 | J19: Hilton Head | K19: South Carolina | L19: USA | M19: Computer Vision | N19: Conference
A20: Conference on Computer Vision and Pattern Recognition | B20: 1999 | C20: CVPR 1999 | D20: CVPR | E20: 1999-06-23T00:00:00.000 | F20: 1999-06-25T00:00:00.000 | G20: 503 | H20: 192 | I20: =RC[-1]/RC[-2] -> 0.38170974155069581 | J20: Ft. Collins | L20: USA | M20: Computer Vision | N20: Conference
A21: Conference on Computer Vision and Pattern Recognition | B21: 1998 | C21: CVPR 1998 | D21: CVPR | E21: 1998-06-23T00:00:00.000 | F21: 1998-06-25T00:00:00.000 | G21: 453 | H21: 139 | I21: =RC[-1]/RC[-2] -> 0.30684326710816778 | J21: Santa Barbara | L21: USA | M21: Computer Vision | N21: Conference
A22: Conference on Computer Vision and Pattern Recognition | B22: 1997 | C22: CVPR 1997 | D22: CVPR | E22: 1997-06-17T00:00:00.000 | F22: 1997-06-19T00:00:00.000 | G22: 544 | H22: 173 | I22: =RC[-1]/RC[-2] -> 0.31801470588235292 | J22: San Juan | L22: Puerto Rico | M22: Computer Vision | N22: Conference
A23: Conference on Computer Vision and Pattern Recognition | B23: 1996 | C23: CVPR 1996 | D23: CVPR | E23: 1996-06-18T00:00:00.000 | F23: 1996-06-20T00:00:00.000 | G23: 551 | H23: 137 | I23: =RC[-1]/RC[-2] -> 0.24863883847549909 | J23: San Francisco | K23: California | L23: USA | M23: Computer Vision | N23: Conference
A24: Conference on Computer Vision and Pattern Recognition | B24: 1994 | C24: CVPR 1994 | D24: CVPR | E24: 1994-06-21T00:00:00.000 | F24: 1994-06-23T00:00:00.000 | G24: 472 | H24: 164 | I24: =RC[-1]/RC[-2] -> 0.34745762711864409 | J24: Seattle | L24: USA | M24: Computer Vision | N24: Conference
A25: Conference on Computer Vision and Pattern Recognition | B25: 1993 | C25: CVPR 1993 | D25: CVPR | E25: 1993-06-15T00:00:00.000 | F25: 1993-06-17T00:00:00.000 | G25: 431 | H25: 186 | I25: =RC[-1]/RC[-2] -> 0.43155452436194897 | J25: New York | K25: New York | L25: USA | M25: Computer Vision | N25: Conference
A26: IEEE Computer Society Conference on Computer Vision and Pattern Recognition | B26: 1992 | C26: CVPR 1992 | D26: CVPR | E26: 1992-06-15T00:00:00.000 | F26: 1993-06-18T00:00:00.000 | G26: 357 | H26: 159 | I26: =RC[-1]/RC[-2] -> 0.44537815126050423 | J26: Champaign | K26: Illinois | L26: USA | M26: Computer Vision | N26: Conference
A27: IEEE Computer Society Conference on Computer Vision and Pattern Recognition | B27: 1991 | C27: CVPR 1991 | D27: CVPR | E27: 1991-06-03T00:00:00.000 | F27: 1991-06-06T00:00:00.000 | G27: 491 | H27: 143 | I27: =RC[-1]/RC[-2] -> 0.29124236252545826 | J27: Lahaina | K27: Hawaii | L27: USA | M27: Computer Vision | N27: Conference
A28: IEEE Computer Society Conference on Computer Vision and Pattern Recognition | B28: 1989 | C28: CVPR 1989 | D28: CVPR | E28: 1989-06-04T00:00:00.000 | F28: 1989-06-08T00:00:00.000 | G28: 327 | H28: 95 | I28: =RC[-1]/RC[-2] -> 0.29051987767584098 | J28: San Diego | K28: California | L28: USA | M28: Computer Vision | N28: Conference
A29: IEEE Computer Society Conference on Computer Vision and Pattern Recognition | B29: 1988 | C29: CVPR 1988 | D29: CVPR | E29: 1988-06-05T00:00:00.000 | F29: 1988-06-09T00:00:00.000 | G29: 300 | H29: 140 | I29: =RC[-1]/RC[-2] -> 0.46666666666666667 | J29: Ann Arbor | K29: Michigan | L29: USA | M29: Computer Vision | N29: Conference
A30: IEEE Computer Society Conference on Computer Vision and Pattern Recognition | B30: 1986 | C30: CVPR 1986 | D30: CVPR | G30: 200 | H30: 111 | I30: =RC[-1]/RC[-2] -> 0.55500000000000005 | J30: Miami | L30: USA | M30: Computer Vision | N30: Conference
A31: IEEE Computer Society Conference on Computer Vision and Pattern Recognition | B31: 1985 | C31: CVPR 1995 | D31: CVPR | G31: 240 | H31: 124 | I31: =RC[-1]/RC[-2] -> 0.51666666666666672 | J31: San Francisco | K31: California | L31: USA | M31: Computer Vision | N31: Conference

Sheet: NIPS
A1: Title | B1: Event[Start date] | C1: Event[Acronym] | D1: Event[Series] | E1: Event[Start date] | F1: Event[End date] | G1: Event[Submitted papers] | H1: Event[Accepted papers] | I1: Event[Submission Rate] | J1: Event[City] | K1: Event[State] | L1: Event[Country] | M1: Event[Field] | N1: Event[Type] | O1: Event[Homepage]
A2: Advances in Neural Information Processing Systems | B2: 2018 | C2: NIPS 2018 | D2: NIPS | E2: 2018-12-03T00:00:00.000 | F2: 2018-12-08T00:00:00.000 | J2: Montreal | K2: Quebec | L2: Canada | M2: Neural Information Processing Systems | N2: Conference | O2: nips.cc/
A3: Advances in Neural Information Processing Systems | B3: 2017 | C3: NIPS 2017 | D3: NIPS | E3: 2017-12-04T00:00:00.000 | F3: 2017-12-09T00:00:00.000 | G3: 3240 | H3: 679 | I3: =RC[-1]/RC[-2] -> 0.20956790123456789 | J3: Long Beach | K3: California | L3: USA | M3: Neural Information Processing Systems | N3: Conference | O3: nips.cc/Conferences/2017
A4: Advances in Neural Information Processing Systems | B4: 2016 | C4: NIPS 2016 | D4: NIPS | E4: 2016-12-05T00:00:00.000 | F4: 2016-12-10T00:00:00.000 | G4: 2406 | H4: 568 | I4: =RC[-1]/RC[-2] -> 0.23607647547797173 | J4: Barcelona | L4: Spain | M4: Neural Information Processing Systems | N4: Conference | O4: nips.cc/Conferences/2016
A5: Advances in Neural Information Processing Systems | B5: 2015 | C5: NIPS 2015 | D5: NIPS | E5: 2015-12-07T00:00:00.000 | F5: 2015-12-12T00:00:00.000 | G5: 1838 | H5: 403 | I5: =RC[-1]/RC[-2] -> 0.2192600652883569 | J5: Montreal | K5: Quebec | L5: Canada | M5: Neural Information Processing Systems | N5: Conference | O5: nips.cc/Conferences/2015
A6: Advances in Neural Information Processing Systems | B6: 2014 | C6: NIPS 2014 | D6: NIPS | E6: 2014-12-08T00:00:00.000 | F6: 2014-12-13T00:00:00.000 | G6: 1678 | H6: 414 | I6: =RC[-1]/RC[-2] -> 0.2467222884386174 | J6: Montreal | K6: Quebec | L6: Canada | M6: Neural Information Processing Systems | N6: Conference | O6: nips.cc/Conferences/2014
A7: Advances in Neural Information Processing Systems | B7: 2013 | C7: NIPS 2013 | D7: NIPS | E7: 2013-12-05T00:00:00.000 | F7: 2013-12-10T00:00:00.000 | G7: 1420 | H7: 360 | I7: =RC[-1]/RC[-2] -> 0.25352112676056338 | J7: Lake Tahoe | K7: Nevada | L7: USA | M7: Neural Information Processing Systems | N7: Conference | O7: nips.cc/Conferences/2013
A8: Advances in Neural Information Processing Systems | B8: 2012 | C8: NIPS 2012 | D8: NIPS | E8: 2012-12-03T00:00:00.000 | F8: 2012-12-08T00:00:00.000 | G8: 1467 | H8: 370 | I8: =RC[-1]/RC[-2] -> 0.25221540558963873 | J8: Lake Tahoe | K8: Nevada | L8: USA | M8: Neural Information Processing Systems | N8: Conference | O8: nips.cc/Conferences/2012
A9: Advances in Neural Information Processing Systems | B9: 2011 | C9: NIPS 2011 | D9: NIPS | E9: 2011-12-12T00:00:00.000 | F9: 2011-12-17T00:00:00.000 | G9: 1400 | H9: 305 | I9: =RC[-1]/RC[-2] -> 0.21785714285714286 | J9: Granada | L9: Spain | M9: Neural Information Processing Systems | N9: Conference | O9: nips.cc/Conferences/2011
A10: Advances in Neural Information Processing Systems | B10: 2010 | C10: NIPS 2010 | D10: NIPS | E10: 2010-12-06T00:00:00.000 | F10: 2010-12-11T00:00:00.000 | G10: 1219 | H10: 293 | I10: =RC[-1]/RC[-2] -> 0.24036095159967186 | J10: Vancouver | K10: British Columbia | L10: Canada | M10: Neural Information Processing Systems | N10: Conference | O10: nips.cc/Conferences/2010
A11: Advances in Neural Information Processing Systems | B11: 2009 | C11: NIPS 2009 | D11: NIPS | E11: 2009-12-07T00:00:00.000 | F11: 2009-12-10T00:00:00.000 | G11: 1105 | H11: 263 | I11: =RC[-1]/RC[-2] -> 0.23800904977375564 | J11: Vancouver | K11: British Columbia | L11: Canada | M11: Neural Information Processing Systems | N11: Conference | O11: nips.cc/Conferences/2009
A12: Advances in Neural Information Processing Systems | B12: 2008 | C12: NIPS 2008 | D12: NIPS | E12: 2008-12-08T00:00:00.000 | F12: 2008-12-13T00:00:00.000 | G12: 1022 | H12: 250 | I12: =RC[-1]/RC[-2] -> 0.2446183953033268 | J12: Vancouver | K12: British Columbia | L12: Canada | M12: Neural Information Processing Systems | N12: Conference | O12: nips.cc/Conferences/2008
A13: Advances in Neural Information Processing Systems | B13: 2007 | C13: NIPS 2007 | D13: NIPS | E13: 2007-12-03T00:00:00.000 | F13: 2007-12-06T00:00:00.000 | J13: Vancouver | K13: British Columbia | L13: Canada | M13: Neural Information Processing Systems | N13: Conference | O13: nips.cc/Conferences/2007
A14: Advances in Neural Information Processing Systems | B14: 2006 | C14: NIPS 2006 | D14: NIPS | E14: 2006-12-04T00:00:00.000 | F14: 2006-12-07T00:00:00.000 | G14: 833 | H14: 204 | I14: =RC[-1]/RC[-2] -> 0.24489795918367346 | J14: Vancouver | K14: British Columbia | L14: Canada | M14: Neural Information Processing Systems | N14: Conference | O14: nips.cc/Conferences/2006
A15: Advances in Neural Information Processing Systems | B15: 2005 | C15: NIPS 2005 | D15: NIPS | E15: 2005-12-05T00:00:00.000 | F15: 2005-12-08T00:00:00.000 | G15: 822 | H15: 207 | I15: =RC[-1]/RC[-2] -> 0.2518248175182482 | J15: Vancouver | K15: British Columbia | L15: Canada | M15: Neural Information Processing Systems | N15: Conference | O15: dblp2.uni-trier.de/db/conf/nips/nips2005.html
A16: Advances in Neural Information Processing Systems | B16: 2004 | C16: NIPS 2004 | D16: NIPS | E16: 2004-12-13T00:00:00.000 | F16: 2004-12-18T00:00:00.000 | J16: Vancouver | K16: British Columbia | L16: Canada | M16: Neural Information Processing Systems | N16: Conference | O16: dblp2.uni-trier.de/db/conf/nips/nips2004.html
A17: Advances in Neural Information Processing Systems | B17: 2003 | C17: NIPS 2003 | D17: NIPS | E17: 2003-12-08T00:00:00.000 | F17: 2003-12-13T00:00:00.000 | G17: 717 | H17: 198 | I17: =RC[-1]/RC[-2] -> 0.27615062761506276 | J17: Vancouver | K17: British Columbia | L17: Canada | M17: Neural Information Processing Systems | N17: Conference | O17: dblp2.uni-trier.de/db/conf/nips/nips2003.html
A18: Advances in Neural Information Processing Systems | B18: 2002 | C18: NIPS 2002 | D18: NIPS | E18: 2002-12-09T00:00:00.000 | F18: 2002-12-14T00:00:00.000 | G18: 710 | H18: 221 | I18: =RC[-1]/RC[-2] -> 0.31126760563380279 | J18: Vancouver | K18: British Columbia | L18: Canada | M18: Neural Information Processing Systems | N18: Conference | O18: dblp2.uni-trier.de/db/conf/nips/nips2002.html
A19: Advances in Neural Information Processing Systems | B19: 2001 | C19: NIPS 2001 | D19: NIPS | E19: 2001-12-03T00:00:00.000 | F19: 2001-12-08T00:00:00.000 | G19: 650 | H19: 196 | I19: =RC[-1]/RC[-2] -> 0.30153846153846153 | J19: Vancouver | K19: British Columbia | L19: Canada | M19: Neural Information Processing Systems | N19: Conference | O19: dblp2.uni-trier.de/db/conf/nips/nips2001.html
A20: Advances in Neural Information Processing Systems | B20: 2000 | C20: NIPS 2000 | D20: NIPS | J20: Denver | K20: Colorado | L20: USA | M20: Neural Information Processing Systems | N20: Conference | O20: dblp2.uni-trier.de/db/conf/nips/nips2000.html
A21: Advances in Neural Information Processing Systems | B21: 1999 | C21: NIPS 1999 | D21: NIPS | E21: 1999-11-29T00:00:00.000 | F21: 1999-12-04T00:00:00.000 | J21: Denver | K21: Colorado | L21: USA | M21: Neural Information Processing Systems | N21: Conference | O21: dblp2.uni-trier.de/db/conf/nips/nips1999.html
A22: Advances in Neural Information Processing Systems | B22: 1998 | C22: NIPS 1998 | D22: NIPS | E22: 1998-11-30T00:00:00.000 | F22: 1998-12-05T00:00:00.000 | J22: Denver | K22: Colorado | L22: USA | M22: Neural Information Processing Systems | N22: Conference | O22: dblp2.uni-trier.de/db/conf/nips/nips1998.html
A23: Advances in Neural Information Processing Systems | B23: 1997 | C23: NIPS 1997 | D23: NIPS | J23: Denver | K23: Colorado | L23: USA | M23: Neural Information Processing Systems | N23: Conference | O23: dblp2.uni-trier.de/db/conf/nips/nips1997.html
A24: Advances in Neural Information Processing Systems | B24: 1996 | C24: NIPS 1996 | D24: NIPS | E24: 1996-12-02T00:00:00.000 | F24: 1996-12-05T00:00:00.000 | J24: Denver | K24: Colorado | L24: USA | M24: Neural Information Processing Systems | N24: Conference | O24: dblp2.uni-trier.de/db/conf/nips/nips1996.html
A25: Advances in Neural Information Processing Systems | B25: 1995 | C25: NIPS 1995 | D25: NIPS | E25: 1995-11-27T00:00:00.000 | F25: 1995-12-02T00:00:00.000 | J25: Denver | K25: Colorado | L25: USA | M25: Neural Information Processing Systems | N25: Conference | O25: dblp2.uni-trier.de/db/conf/nips/nips1995.html
A26: Advances in Neural Information Processing Systems | B26: 1994 | C26: NIPS 1994 | D26: NIPS | J26: Denver | K26: Colorado | L26: USA | M26: Neural Information Processing Systems | N26: Conference | O26: dblp2.uni-trier.de/db/conf/nips/nips1994.html
A27: Advances in Neural Information Processing Systems | B27: 1993 | C27: NIPS 1993 | D27: NIPS | J27: Denver | K27: Colorado | L27: USA | M27: Neural Information Processing Systems | N27: Conference | O27: dblp2.uni-trier.de/db/conf/nips/nips1993.html
A28: Advances in Neural Information Processing Systems | B28: 1992 | C28: NIPS 1992 | D28: NIPS | E28: 1992-11-30T00:00:00.000 | F28: 1992-12-03T00:00:00.000 | J28: Denver | K28: Colorado | L28: USA | M28: Neural Information Processing Systems | N28: Conference | O28: dblp2.uni-trier.de/db/conf/nips/nips1992.html
A29: Advances in Neural Information Processing Systems | B29: 1991 | C29: NIPS 1991 | D29: NIPS | E29: 1991-12-02T00:00:00.000 | F29: 1991-12-05T00:00:00.000 | J29: Denver | K29: Colorado | L29: USA | M29: Neural Information Processing Systems | N29: Conference | O29: dblp2.uni-trier.de/db/conf/nips/nips1991.html
A30: Advances in Neural Information Processing Systems | B30: 1990 | C30: NIPS 1990 | D30: NIPS | E30: 1990-11-26T00:00:00.000 | F30: 1990-11-29T00:00:00.000 | J30: Denver | K30: Colorado | L30: USA | M30: Neural Information Processing Systems | N30: Conference | O30: dblp2.uni-trier.de/db/conf/nips/nips1990.html
A31: Advances in Neural Information Processing Systems | B31: 1989 | C31: NIPS 1989 | D31: NIPS | E31: 1989-11-27T00:00:00.000 | F31: 1989-11-30T00:00:00.000 | J31: Denver | K31: Colorado | L31: USA | M31: Neural Information Processing Systems | N31: Conference | O31: dblp2.uni-trier.de/db/conf/nips/nips1989.html
A32: Advances in Neural Information Processing Systems | B32: 1988 | C32: NIPS 1988 | D32: NIPS | J32: Denver | K32: Colorado | L32: USA | M32: Neural Information Processing Systems | N32: Conference | O32: dblp2.uni-trier.de/db/conf/nips/nips1988.html
A33: Neural Information Processing Systems | B33: 1987 | C33: NIPS 1987 | D33: NIPS | J33: Denver | K33: Colorado | L33: USA | M33: Neural Information Processing Systems | N33: Conference | O33: dblp2.uni-trier.de/db/conf/nips/nips1997.html

Sheet: ICCV
A1: Title | B1: Event[Start date] | C1: Event[Acronym] | D1: Event[Series] | E1: Event[Start date] | F1: Event[End date] | G1: Event[Submitted papers] | H1: Event[Accepted papers] | I1: Event[Submission Rate] | J1: Event[City] | K1: Event[State] | L1: Event[Country] | M1: Event[Field] | N1: Event[Type] | O1: Event[Homepage]
A2: International Conference on Computer Vision | B2: 2019 | C2: ICCV 2019 | D2: ICCV | E2: 2019-10-20T00:00:00.000 | F2: 2019-10-26T00:00:00.000 | J2: Seoul | L2: Korea | M2: Computer Vision | N2: Conference
A3: International Conference on Computer Vision | B3: 2017 | C3: ICCV 2017 | D3: ICCV | E3: 2017-10-22T00:00:00.000 | F3: 2017-10-29T00:00:00.000 | G3: 2143 | H3: 621 | I3: =RC[-1]/RC[-2] -> 0.28978068128791412 | J3: Venice | L3: Italy | M3: Computer Vision | N3: Conference | O3: iccv2017.thecvf.com/
A4: International Conference on Computer Vision | B4: 2015 | C4: ICCV 2015 | D4: ICCV | E4: 2015-12-07T00:00:00.000 | F4: 2015-12-13T00:00:00.000 | G4: 1698 | H4: 525 | I4: =RC[-1]/RC[-2] -> 0.30918727915194344 | J4: Santiago | L4: Chile | M4: Computer Vision | N4: Conference | O4: pamitc.org/iccv15/
A5: International Conference on Computer Vision | B5: 2013 | C5: ICCV 2013 | D5: ICCV | E5: 2013-12-01T00:00:00.000 | F5: 2013-12-08T00:00:00.000 | G5: 1629 | H5: 454 | I5: =RC[-1]/RC[-2] -> 0.27869858809085329 | J5: Sydney | L5: Australia | M5: Computer Vision | N5: Conference | O5: www.iccv2013.org/
A6: International Conference on Computer Vision | B6: 2011 | C6: ICCV 2011 | D6: ICCV | E6: 2011-11-06T00:00:00.000 | F6: 2011-11-13T00:00:00.000 | G6: 1433 | H6: 339 | I6: =RC[-1]/RC[-2] -> 0.23656664340544312 | J6: Barcelona | L6: Spain | M6: Computer Vision | N6: Conference | O6: dblp2.uni-trier.de/db/conf/iccv/iccv2001.html
A7: International Conference on Computer Vision | B7: 2009 | C7: ICCV 2009 | D7: ICCV | E7: 2009-09-27T00:00:00.000 | F7: 2009-10-04T00:00:00.000 | G7: 1327 | H7: 308 | I7: =RC[-1]/RC[-2] -> 0.2321024868123587 | J7: Kyoto | L7: Japan | M7: Computer Vision | N7: Conference | O7: www.iccv2009.org
A8: International Conference on Computer Vision | B8: 2007 | C8: ICCV 2007 | D8: ICCV | E8: 2007-10-14T00:00:00.000 | F8: 2007-10-20T00:00:00.000 | G8: 1190 | H8: 281 | I8: =RC[-1]/RC[-2] -> 0.2361344537815126 | J8: Rio de Janeiro | L8: Brazil | M8: Computer Vision | N8: Conference | O8: iccv2007.rutgers.edu/
A9: International Conference on Computer Vision | B9: 2005 | C9: ICCV 2005 | D9: ICCV | E9: 2005-10-17T00:00:00.000 | F9: 2005-10-20T00:00:00.000 | G9: 1230 | H9: 244 | I9: =RC[-1]/RC[-2] -> 0.19837398373983739 | J9: Beijing | L9: China | M9: Computer Vision | N9: Conference | O9: dblp.uni-trier.de/db/conf/iccv/iccv2005-2.html
A10: International Conference on Computer Vision | B10: 2003 | C10: ICCV 2003 | D10: ICCV | E10: 2003-10-14T00:00:00.000 | F10: 2003-10-17T00:00:00.000 | G10: 966 | H10: 199 | I10: =RC[-1]/RC[-2] -> 0.20600414078674947 | J10: Nice | L10: France | M10: Computer Vision | N10: Conference | O10: lear.inrialpes.fr/people/triggs/events/iccv03/
A11: International Conference on Computer Vision | B11: 2001 | C11: ICCV 2001 | D11: ICCV | E11: 2001-07-07T00:00:00.000 | F11: 2001-07-14T00:00:00.000 | G11: 596 | H11: 205 | I11: =RC[-1]/RC[-2] -> 0.34395973154362414 | J11: Vancouver | L11: Canada | M11: Computer Vision | N11: Conference | O11: dblp.uni-trier.de/db/conf/iccv/iccv2001-2.html
A12: International Conference on Computer Vision | B12: 1999 | C12: ICCV 1999 | D12: ICCV | E12: 1999-09-20T00:00:00.000 | F12: 1999-09-25T00:00:00.000 | G12: 575 | H12: 178 | I12: =RC[-1]/RC[-2] -> 0.30956521739130433 | J12: Kerkyra | K12: Corfu | L12: Greece | M12: Computer Vision | N12: Conference | O12: www.cs.toronto.edu/iccv99/
A13: International Conference on Computer Vision | B13: 1998 | C13: ICCV 1998 | D13: ICCV | E13: 1998-01-04T00:00:00.000 | F13: 1988-01-08T00:00:00.000 | G13: 550 | H13: 167 | I13: =RC[-1]/RC[-2] -> 0.30363636363636365 | J13: Bombay | L13: India | M13: Computer Vision | N13: Conference | O13: www.umiacs.umd.edu/users/lsd/iccv/
A14: International Conference on Computer Vision | B14: 1995 | C14: ICCV 1995 | D14: ICCV | E14: 1995-06-20T00:00:00.000 | F14: 1995-06-30T00:00:00.000 | G14: 600 | H14: 150 | I14: =RC[-1]/RC[-2] -> 0.25 | J14: Boston | L14: USA | M14: Computer Vision | N14: Conference | O14: dblp2.uni-trier.de/db/conf/iccv/iccv1995.html
A15: International Conference on Computer Vision | B15: 1993 | C15: ICCV 1993 | D15: ICCV | E15: 1993-05-11T00:00:00.000 | F15: 1993-05-14T00:00:00.000 | G15: 380 | H15: 101 | I15: =RC[-1]/RC[-2] -> 0.26578947368421052 | J15: Berlin | L15: Germany | M15: Computer Vision | N15: Conference | O15: dblp2.uni-trier.de/db/conf/iccv/iccv1993.html
A16: International Conference on Computer Vision | B16: 1990 | C16: ICCV 1990 | D16: ICCV | E16: 1990-12-04T00:00:00.000 | F16: 1990-12-07T00:00:00.000 | G16: 420 | H16: 102 | I16: =RC[-1]/RC[-2] -> 0.24285714285714285 | J16: Osaka | L16: Japan | M16: Computer Vision | N16: Conference | O16: dblp2.uni-trier.de/db/conf/iccv/iccv1990.html
A17: International Conference on Computer Vision | B17: 1988 | C17: ICCV 1988 | D17: ICCV | E17: 1988-12-05T00:00:00.000 | F17: 1988-12-08T00:00:00.000 | G17: 306 | H17: 89 | I17: =RC[-1]/RC[-2] -> 0.2908496732026144 | J17: Tampa | K17: Florida | L17: USA | M17: Computer Vision | N17: Conference | O17: dblp2.uni-trier.de/db/conf/iccv/iccv1988.html
A18: International Conference on Computer Vision | B18: 1987 | C18: ICCV 1987 | D18: ICCV | E18: 1987-07-08T00:00:00.000 | F18: 1987-07-11T00:00:00.000 | G18: 300 | H18: 60 | I18: =RC[-1]/RC[-2] -> 0.2 | J18: London | L18: UK | M18: Computer Vision | N18: Conference

Sheet: IJCAI
A1: Title | B1: Event[Start date] | C1: Event[Acronym] | D1: Event[Series] | E1: Event[Start date] | F1: Event[End date] | G1: Event[Submitted papers] | H1: Event[Accepted papers] | I1: Event[Submission Rate] | J1: Event[City] | K1: Event[State] | L1: Event[Country] | M1: Event[Field] | N1: Event[Type] | O1: Event[Homepage]
A2: 27th International Joint Conference on Artificial Intelligence | B2: 2018 | C2: IJCAI 2018 | D2: IJCAI | E2: 2018-07-13T00:00:00.000 | F2: 2018-07-19T00:00:00.000 | J2: Stockholm | L2: Sweden | M2: Artificial Intelligence | N2: Conference | O2: www.ijcai-18.org/
A3: 26th International Joint Conference on Artificial Intelligence | B3: 2017 | C3: IJCAI 2017 | D3: IJCAI | E3: 2017-08-19T00:00:00.000 | F3: 2017-08-25T00:00:00.000 | G3: 2540 | H3: 661 | I3: =RC[-1]/RC[-2] -> 0.26023622047244094 | J3: Melbourne | K3: VIC | L3: Australia | M3: Artificial Intelligence | N3: Conference | O3: ijcai-17.org/
A4: 25th International Joint Conference on Artificial Intelligence | B4: 2016 | C4: IJCAI 2016 | D4: IJCAI | E4: 2016-07-09T00:00:00.000 | F4: 2016-07-15T00:00:00.000 | G4: 2294 | H4: 551 | I4: =RC[-1]/RC[-2] -> 0.24019180470793375 | J4: New York | K4: New York | L4: USA | M4: Artificial Intelligence | N4: Conference | O4: ijcai-16.org/
A5: 24th International Joint Conference on Artificial Intelligence | B5: 2015 | C5: IJCAI 2015 | D5: IJCAI | E5: 2015-07-25T00:00:00.000 | F5: 2015-07-31T00:00:00.000 | G5: 1996 | H5: 572 | I5: =RC[-1]/RC[-2] -> 0.28657314629258518 | J5: Buenos Aires | L5: Argentina | M5: Artificial Intelligence | N5: Conference | O5: www.ijcai.org/proceedings/2015
A6: 23rd International Joint Conference on Artificial Intelligence | B6: 2013 | C6: IJCAI 2013 | D6: IJCAI | E6: 2013-08-03T00:00:00.000 | F6: 2013-08-09T00:00:00.000 | G6: 1473 | H6: 413 | I6: =RC[-1]/RC[-2] -> 0.28038017651052272 | J6: Beijing | L6: China | M6: Artificial Intelligence | N6: Conference | O6: www.aaai.org/Press/Proceedings/ijcai13.php
A7: 22nd International Joint Conference on Artificial Intelligence | B7: 2011 | C7: IJCAI 2011 | D7: IJCAI | E7: 2011-07-16T00:00:00.000 | F7: 2011-07-22T00:00:00.000 | G7: 1325 | H7: 400 | I7: =RC[-1]/RC[-2] -> 0.30188679245283018 | J7: Barcelona | K7: Catalonia | L7: Spain | M7: Artificial Intelligence | N7: Conference | O7: ijcai-11.iiia.csic.es/
A8: 21th International Joint Conference on Artificial Intelligence | B8: 2009 | C8: IJCAI 2009 | D8: IJCAI | E8: 2009-07-11T00:00:00.000 | F8: 2009-07-17T00:00:00.000 | G8: 1291 | H8: 331 | I8: =RC[-1]/RC[-2] -> 0.25639039504260264 | J8: Pasadena | K8: California | L8: USA | M8: Artificial Intelligence | N8: Conference | O8: www.ijcai.org/past/ijcai-09/
A9: 20th International Joint Conference on Artificial Intelligence | B9: 2007 | C9: IJCAI 2007 | D9: IJCAI | E9: 2007-01-06T00:00:00.000 | F9: 2007-01-12T00:00:00.000 | G9: 1365 | H9: 470 | I9: =RC[-1]/RC[-2] -> 0.34432234432234432 | J9: Hyderabad | L9: India | M9: Artificial Intelligence | N9: Conference | O9: www.ijcai.org/proceedings/2007
A10: 19th International Joint Conference on Artificial Intelligence | B10: 2005 | C10: IJCAI 2005 | D10: IJCAI | E10: 2005-07-30T00:00:00.000 | F10: 2005-08-05T00:00:00.000 | G10: 1329 | H10: 240 | I10: =RC[-1]/RC[-2] -> 0.18058690744920994 | J10: Edinburgh | K10: Scotland | L10: UK | M10: Artificial Intelligence | N10: Conference | O10: www.ijcai.org/past/ijcai-05/
A11: 18th International Joint Conference on Artificial Intelligence | B11: 2003 | C11: IJCAI 2003 | D11: IJCAI | E11: 2003-08-09T00:00:00.000 | F11: 2003-08-18T00:00:00.000 | G11: 913 | H11: 189 | I11: =RC[-1]/RC[-2] -> 0.20700985761226726 | J11: Acapulco | L11: Mexico | M11: Artificial Intelligence | N11: Conference | O11: www.ijcai.org/proceedings/2003
A12: 17th International Joint Conference on Artificial Intelligence | B12: 2001 | C12: IJCAI 2001 | D12: IJCAI | E12: 2001-08-04T00:00:00.000 | F12: 2001-08-10T00:00:00.000 | G12: 796 | H12: 197 | I12: =RC[-1]/RC[-2] -> 0.24748743718592964 | J12: Seattle | L12: USA | M12: Artificial Intelligence | N12: Conference | O12: www.ijcai.org/past/ijcai-01/
A13: 16th International Joint Conference on Artificial Intelligence | B13: 1999 | C13: IJCAI 1999 | D13: IJCAI | E13: 1999-07-31T00:00:00.000 | F13: 1999-08-06T00:00:00.000 | G13: 750 | H13: 194 | I13: =RC[-1]/RC[-2] -> 0.25866666666666666 | J13: Stockholm | L13: Sweden | M13: Artificial Intelligence | N13: Conference | O13: www.ijcai.org/past/ijcai-99/
A14: 15th International Joint Conference on Artificial Intelligence | B14: 1997 | C14: IJCAI 1997 | D14: IJCAI | E14: 1997-08-23T00:00:00.000 | F14: 1997-08-29T00:00:00.000 | G14: 882 | H14: 216 | I14: =RC[-1]/RC[-2] -> 0.24489795918367346 | J14: Nagoya | L14: Japan | M14: Artificial Intelligence | N14: Conference | O14: www.ijcai.org/past/ijcai-97/
A15: 14th International Joint Conference on Artificial Intelligence | B15: 1995 | C15: IJCAI 1995 | D15: IJCAI | E15: 1995-08-20T00:00:00.000 | F15: 1995-08-25T00:00:00.000 | G15: 1112 | H15: 249 | I15: =RC[-1]/RC[-2] -> 0.22392086330935251 | J15: Montréal | K15: Québec | L15: Canada | M15: Artificial Intelligence | N15: Conference | O15: www.ijcai.org/past/ijcai-95/
A16: 13th International Joint Conference on Artificial Intelligence | B16: 1993 | C16: IJCAI 1993 | D16: IJCAI | E16: 1993-08-28T00:00:00.000 | F16: 1993-09-03T00:00:00.000 | J16: Chambéry | L16: France | M16: Artificial Intelligence | N16: Conference | O16: dblp.org/db/conf/ijcai/ijcai93
A17: 12th International Joint Conference on Artificial Intelligence | B17: 1991 | C17: IJCAI 1991 | D17: IJCAI | E17: 1991-08-24T00:00:00.000 | F17: 1991-08-30T00:00:00.000 | J17: Sydney | K17: New South Wales | L17: Australia | M17: Artificial Intelligence | N17: Conference | O17: dblp.org/db/conf/ijcai/ijcai91
A18: 11th International Joint Conference on Artificial Intelligence | B18: 1989 | C18: IJCAI 1989 | D18: IJCAI | E18: 1989-08-01T00:00:00.000 | J18: Detroit | K18: Michigan | L18: USA | M18: Artificial Intelligence | N18: Conference | O18: dblp.org/db/conf/ijcai/ijcai89
A19: 10th International Joint Conference on Artificial Intelligence | B19: 1987 | C19: IJCAI 1987 | D19: IJCAI | E19: 1987-08-23T00:00:00.000 | F19: 1987-08-28T00:00:00.000 | J19: Milan | L19: Italy | M19: Artificial Intelligence | N19: Conference | O19: dblp.org/db/conf/ijcai/ijcai87
A20: 9th International Joint Conference on Artificial Intelligence | B20: 1985 | C20: IJCAI 1985 | D20: IJCAI | E20: 1985-08-01T00:00:00.000 | J20: Los Angeles | K20: California | L20: USA | M20: Artificial Intelligence | N20: Conference | O20: dblp.org/db/conf/ijcai/ijcai85
A21: 8th International Joint Conference on Artificial Intelligence | B21: 1983 | C21: IJCAI 1983 | D21: IJCAI | E21: 1983-08-01T00:00:00.000 | J21: Karlsruhe | L21: Germany | M21: Artificial Intelligence | N21: Conference | O21: dblp.org/db/conf/ijcai/ijcai83
A22: 7th International Joint Conference on Artificial Intelligence | B22: 1981 | C22: IJCAI 1981 | D22: IJCAI | E22: 1981-08-24T00:00:00.000 | F22: 1981-08-29T00:00:00.000 | J22: Vancouver | K22: British Columbia | L22: Canada | M22: Artificial Intelligence | N22: Conference | O22: dblp.org/db/conf/ijcai/ijcai81
A23: 6th International Joint Conference on Artificial Intelligence | B23: 1979 | C23: IJCAI 1979 | D23: IJCAI | E23: 1979-08-20T00:00:00.000 | F23: 1979-08-24T00:00:00.000 | J23: Tokyo | L23: Japan | M23: Artificial Intelligence | N23: Conference | O23: dblp.org/db/conf/ijcai/ijcai79
A24: 5th International Joint Conference on Artificial Intelligence | B24: 1977 | C24: IJCAI 1977 | D24: IJCAI | E24: 1977-08-22T00:00:00.000 | F24: 1977-08-25T00:00:00.000 | J24: Cambridge | K24: MA | L24: USA | M24: Artificial Intelligence | N24: Conference | O24: dblp.org/db/conf/ijcai/ijcai77
A25: 4th International Joint Conference on Artificial Intelligence | B25: 1975 | C25: IJCAI 1975 | D25: IJCAI | E25: 1975-09-03T00:00:00.000 | F25: 1975-09-08T00:00:00.000 | J25: Tbilisi | L25: Georgia | M25: Artificial Intelligence | N25: Conference | O25: dblp.org/db/conf/ijcai/ijcai75
A26: 3rd International Joint Conference on Artificial Intelligence | B26: 1973 | C26: IJCAI 1973 | D26: IJCAI | E26: 1973-08-20T00:00:00.000 | F26: 1973-08-23T00:00:00.000 | J26: Standford | K26: California | L26: USA | M26: Artificial Intelligence | N26: Conference | O26: dblp.org/db/conf/ijcai/ijcai73
A27: 2nd International Joint Conference on Artificial Intelligence | B27: 1971 | C27: IJCAI 1971 | D27: IJCAI | E27: 1971-09-01T00:00:00.000 | F27: 1971-09-03T00:00:00.000 | J27: London | L27: UK | M27: Artificial Intelligence | N27: Conference | O27: dblp.org/db/conf/ijcai/ijcai71
A28: 1st International Joint Conference on Artificial Intelligence | B28: 1969 | C28: IJCAI 1969 | D28: IJCAI | E28: 1969-05-07T00:00:00.000 | F28: 1969-05-09T00:00:00.000 | J28: Washington | K28: DC | L28: USA | M28: Artificial Intelligence | N28: Conference | O28: dblp.org/db/conf/ijcai/ijcai69

Sheet: AAAI
A1: Title | B1: Event[Start date] | C1: Event[Acronym] | D1: Event[Series] | E1: Event[Start date] | F1: Event[End date] | G1: Event[Submitted papers] | H1: Event[Accepted papers] | I1: Event[Submission Rate] | J1: Event[City] | K1: Event[State] | L1: Event[Country] | M1: Event[Field] | N1: Event[Type] | O1: Event[Homepage]
A2: 32nd Annual National Conference on Artificial Intelligence | B2: 2018 | C2: AAAI | D2: AAAI2018 | E2: 2018-02-02T00:00:00.000 | F2: 2018-02-07T00:00:00.000 | J2: New Orleans | K2: Louisiana | L2: USA | M2: Artificial Intelligence | N2: Conference | O2: aaai.org/Conferences/AAAI-18/
A3: 31st Annual National Conference on Artificial Intelligence | B3: 2017 | C3: AAAI | D3: AAAI2017 | E3: 2017-02-04T00:00:00.000 | F3: 2017-02-09T00:00:00.000 | G3: 2590 | H3: 638 | I3: =RC[-1]/RC[-2] -> 0.24633204633204633 | J3: San Francisco | K3: California | L3: USA | M3: Artificial Intelligence | N3: Conference | O3: aaai.org/Conferences/AAAI/aaai17.php
A4: 30th Annual National Conference on Artificial Intelligence | B4: 2016 | C4: AAAI | D4: AAAI2016 | E4: 2016-02-12T00:00:00.000 | F4: 2016-02-17T00:00:00.000 | G4: 2132 | H4: 549 | I4: =RC[-1]/RC[-2] -> 0.25750469043151969 | J4: Phoenix | K4: Arizona | L4: USA | M4: Artificial Intelligence | N4: Conference | O4: aaai.org/Conferences/AAAI/aaai16.php
A5: 29th Annual National Conference on Artificial Intelligence | B5: 2015 | C5: AAAI | D5: AAAI2015 | E5: 2015-01-25T00:00:00.000 | F5: 2015-01-30T00:00:00.000 | G5: 1991 | H5: 531 | I5: =RC[-1]/RC[-2] -> 0.26670015067805125 | J5: Austin | K5: Texas | L5: USA | M5: Artificial Intelligence | N5: Conference | O5: aaai.org/Conferences/AAAI/aaai15.php
A6: 28th Annual National Conference on Artificial Intelligence | B6: 2014 | C6: AAAI | D6: AAAI2014 | E6: 2014-07-27T00:00:00.000 | F6: 2014-07-31T00:00:00.000 | G6: 1406 | H6: 398 | I6: =RC[-1]/RC[-2] -> 0.28307254623044098 | J6: Québec | K6: Québec | L6: Canada | M6: Artificial Intelligence | N6: Conference | O6: aaai.org/Conferences/AAAI/aaai14.php
A7: 27th Annual National Conference on Artificial Intelligence | B7: 2013 | C7: AAAI | D7: AAAI2013 | E7: 2013-07-14T00:00:00.000 | F7: 2013-07-18T00:00:00.000 | G7: 827 | H7: 203 | I7: =RC[-1]/RC[-2] -> 0.24546553808948005 | J7: Bellevue | K7: Washington | L7: USA | M7: Artificial Intelligence | N7: Conference | O7: aaai.org/Conferences/AAAI/aaai13.php
A8: 26th Annual National Conference on Artificial Intelligence | B8: 2012 | C8: AAAI | D8: AAAI2012 | E8: 2012-07-22T00:00:00.000 | F8: 2012-07-26T00:00:00.000 | G8: 1129 | H8: 294 | I8: =RC[-1]/RC[-2] -> 0.2604074402125775 | J8: Toronto | K8: Ontario | L8: Canada | M8: Artificial Intelligence | N8: Conference | O8: aaai.org/Conferences/AAAI/aaai12.php
A9: 25th Annual National Conference on Artificial Intelligence | B9: 2011 | C9: AAAI | D9: AAAI2011 | E9: 2011-08-07T00:00:00.000 | F9: 2011-08-11T00:00:00.000 | G9: 975 | H9: 242 | I9: =RC[-1]/RC[-2] -> 0.24820512820512822 | J9: San Francisco | K9: California | L9: USA | M9: Artificial Intelligence | N9: Conference | O9: aaai.org/Conferences/AAAI/aaai11.php
A10: 24th Annual National Conference on Artificial Intelligence | B10: 2010 | C10: AAAI | D10: AAAI2010 | E10: 2010-07-11T00:00:00.000 | F10: 2010-07-15T00:00:00.000 | G10: 982 | H10: 264 | I10: =RC[-1]/RC[-2] -> 0.26883910386965376 | J10: Atlanta | K10: Georgia | L10: USA | M10: Artificial Intelligence | N10: Conference | O10: aaai.org/Conferences/AAAI/aaai10.php
A11: 23rd Annual National Conference on Artificial Intelligence | B11: 2008 | C11: AAAI | D11: AAAI2008 | E11: 2008-07-13T00:00:00.000 | F11: 2008-07-17T00:00:00.000 | G11: 937 | H11: 227 | I11: =RC[-1]/RC[-2] -> 0.24226254002134473 | J11: Chicago | K11: Illinois | L11: USA | M11: Artificial Intelligence | N11: Conference | O11: aaai.org/Conferences/AAAI/aaai08.php
A12: 22nd Annual National Conference on Artificial Intelligence | B12: 2007 | C12: AAAI | D12: AAAI2007 | E12: 2007-07-22T00:00:00.000 | F12: 2007-07-26T00:00:00.000 | G12: 921 | H12: 253 | I12: =RC[-1]/RC[-2] -> 0.27470141150922911 | J12: Vancouver | K12: British Columbia | L12: Canada | M12: Artificial Intelligence | N12: Conference | O12: aaai.org/Conferences/AAAI/aaai07.php
A13: 21st Annual National Conference on Artificial Intelligence | B13: 2006 | C13: AAAI | D13: AAAI2006 | E13: 2006-07-16T00:00:00.000 | F13: 2006-07-20T00:00:00.000 | G13: 774 | H13: 236 | I13: =RC[-1]/RC[-2] -> 0.30490956072351422 | J13: Boston | K13: Massachusetts | L13: USA | M13: Artificial Intelligence | N13: Conference | O13: aaai.org/Conferences/AAAI/aaai06.php
A14: 20th Annual National Conference on Artificial Intelligence | B14: 2005 | C14: AAAI | D14: AAAI2005 | E14: 2005-07-09T00:00:00.000 | F14: 2005-07-13T00:00:00.000 | G14: 803 | H14: 229 | I14: =RC[-1]/RC[-2] -> 0.2851805728518057 | J14: Pittsburgh | K14: Pennsylvania | L14: USA | M14: Artificial Intelligence | N14: Conference | O14: aaai.org/Conferences/AAAI/aaai05.php
A15: 19th Annual National Conference on Artificial Intelligence | B15: 2004 | C15: AAAI | D15: AAAI2004 | E15: 2004-07-25T00:00:00.000 | F15: 2004-07-29T00:00:00.000 | G15: 453 | H15: 121 | I15: =RC[-1]/RC[-2] -> 0.2671081677704194 | J15: San Jose | K15: California | L15: USA | M15: Artificial Intelligence | N15: Conference | O15: aaai.org/Conferences/AAAI/aaai04.php
A16: 18th Annual National Conference on Artificial Intelligence | B16: 2002 | C16: AAAI | D16: AAAI2002 | E16: 2002-07-28T00:00:00.000 | F16: 2002-08-01T00:00:00.000 | G16: 469 | H16: 121 | I16: =RC[-1]/RC[-2] -> 0.25799573560767591 | J16: Edmonton | K16: Alberta | L16: Canada | M16: Artificial Intelligence | N16: Conference | O16: aaai.org/Conferences/AAAI/aaai02.php
A17: 17th Annual National Conference on Artificial Intelligence | B17: 2000 | C17: AAAI | D17: AAAI2000 | E17: 2000-07-30T00:00:00.000 | F17: 2000-08-03T00:00:00.000 | G17: 431 | H17: 143 | I17: =RC[-1]/RC[-2] -> 0.33178654292343385 | J17: Austin | K17: Texas | L17: USA | M17: Artificial Intelligence | N17: Conference | O17: aaai.org/Conferences/AAAI/aaai00.php
A18: 16th Annual National Conference on Artificial Intelligence | B18: 1999 | C18: AAAI | D18: AAAI1999 | E18: 1999-07-18T00:00:00.000 | F18: 1999-07-22T00:00:00.000 | G18: 400 | H18: 109 | I18: =RC[-1]/RC[-2] -> 0.27250000000000002 | J18: Orlando | K18: Florida | L18: USA | M18: Artificial Intelligence | N18: Conference | O18: aaai.org/Conferences/AAAI/aaai99.php
A19: 15th Annual National Conference on Artificial Intelligence | B19: 1998 | C19: AAAI | D19: AAAI1998 | E19: 1998-07-26T00:00:00.000 | F19: 1998-07-30T00:00:00.000 | G19: 475 | H19: 144 | I19: =RC[-1]/RC[-2] -> 0.30315789473684213 | J19: Madison | K19: Wisconsin | L19: USA | M19: Artificial Intelligence | N19: Conference | O19: aaai.org/Conferences/AAAI/aaai98.php
A20: 14th Annual National Conference on Artificial Intelligence | B20: 1997 | C20: AAAI | D20: AAAI1997 | E20: 1997-07-27T00:00:00.000 | F20: 1997-07-31T00:00:00.000 | G20: 323 | H20: 117 | I20: =RC[-1]/RC[-2] -> 0.36222910216718268 | J20: Providence | K20: Rhode Island | L20: USA | M20: Artificial Intelligence | N20: Conference | O20: aaai.org/Conferences/AAAI/aaai97.php
A21: 13th Annual National Conference on Artificial Intelligence | B21: 1996 | C21: AAAI | D21: AAAI1996 | E21: 1996-08-04T00:00:00.000 | F21: 1996-08-08T00:00:00.000 | G21: 643 | H21: 197 | I21: =RC[-1]/RC[-2] -> 0.30637636080870917 | J21: Portland | K21: Oregon | L21: USA | M21: Artificial Intelligence | N21: Conference | O21: aaai.org/Conferences/AAAI/aaai96.php
A22: 12th Annual National Conference on Artificial Intelligence | B22: 1994 | C22: AAAI | D22: AAAI1994 | E22: 1994-07-31T00:00:00.000 | F22: 1994-08-04T00:00:00.000 | G22: 780 | H22: 222 | I22: =RC[-1]/RC[-2] -> 0.2846153846153846 | J22: Seattle | K22: Washington | L22: USA | M22: Artificial Intelligence | N22: Conference | O22: aaai.org/Conferences/AAAI/aaai94.php
A23: 11th Annual National Conference on Artificial Intelligence | B23: 1993 | C23: AAAI | D23: AAAI1993 | E23: 1993-07-11T00:00:00.000 | F23: 1993-07-15T00:00:00.000 | G23: 524 | H23: 126 | I23: =RC[-1]/RC[-2] -> 0.24045801526717558 | J23: Washington | L23: USA | M23: Artificial Intelligence | N23: Conference | O23: aaai.org/Conferences/AAAI/aaai93.php
A24: 10th Annual National Conference on Artificial Intelligence | B24: 1992 | C24: AAAI | D24: AAAI1992 | E24: 1992-07-12T00:00:00.000 | F24: 1992-07-16T00:00:00.000 | G24: 636 | H24: 133 | I24: =RC[-1]/RC[-2] -> 0.20911949685534592 | J24: San Jose | K24: California | L24: USA | M24: Artificial Intelligence | N24: Conference | O24: aaai.org/Conferences/AAAI/aaai92.php
A25: 9th Annual National Conference on Artificial Intelligence | B25: 1991 | C25: AAAI | D25: AAAI1991 | E25: 1991-07-14T00:00:00.000 | F25: 1991-07-19T00:00:00.000 | G25: 603 | H25: 142 | I25: =RC[-1]/RC[-2] -> 0.23548922056384744 | J25: Anaheim | K25: California | L25: USA | M25: Artificial Intelligence | N25: Conference | O25: aaai.org/Conferences/AAAI/aaai91.php
A26: 8th Annual National Conference on Artificial Intelligence | B26: 1990 | C26: AAAI | D26: AAAI1990 | E26: 1990-07-29T00:00:00.000 | F26: 1990-08-03T00:00:00.000 | G26: 892 | H26: 161 | I26: =RC[-1]/RC[-2] -> 0.18049327354260089 | J26: Boston | K26: Massachusetts | L26: USA | M26: Artificial Intelligence | N26: Conference | O26: aaai.org/Conferences/AAAI/aaai90.php
A27: 7th Annual National Conference on Artificial Intelligence | B27: 1988 | C27: AAAI | D27: AAAI1988 | E27: 1988-08-21T00:00:00.000 | F27: 1988-08-26T00:00:00.000 | G27: 850 | H27: 148 | I27: =RC[-1]/RC[-2] -> 0.17411764705882352 | J27: Paul | K27: Minnesota | L27: USA | M27: Artificial Intelligence | N27: Conference | O27: aaai.org/Conferences/AAAI/aaai88.php
A28: 6th Annual National Conference on Artificial Intelligence | B28: 1987 | C28: AAAI | D28: AAAI1987 | E28: 1987-07-13T00:00:00.000 | F28: 1987-07-17T00:00:00.000 | G28: 715 | H28: 149 | I28: =RC[-1]/RC[-2] -> 0.20839160839160839 | J28: Seattle | K28: Washington | L28: USA | M28: Artificial Intelligence | N28: Conference | O28: aaai.org/Conferences/AAAI/aaai87.php
A29: 5th Annual National Conference on Artificial Intelligence | B29: 1986 | C29: AAAI | D29: AAAI1986 | E29: 1986-08-11T00:00:00.000 | F29: 1986-08-15T00:00:00.000 | G29: 817 | H29: 187 | I29: =RC[-1]/RC[-2] -> 0.22888616891064872 | J29: Philadelphia | L29: USA | M29: Artificial Intelligence | N29: Conference | O29: aaai.org/Conferences/AAAI/aaai86.php
A30: 4th Annual National Conference on Artificial Intelligence | B30: 1984 | C30: AAAI | D30: AAAI1984 | E30: 1984-08-06T00:00:00.000 | F30: 1984-08-10T00:00:00.000 | J30: Austin | K30: Texas | L30: USA | M30: Artificial Intelligence | N30: Conference | O30: aaai.org/Conferences/AAAI/aaai84.php
A31: 3rd Annual National Conference on Artificial Intelligence | B31: 1983 | C31: AAAI | D31: AAAI1983 | E31: 1983-08-22T00:00:00.000 | F31: 1983-08-26T00:00:00.000 | J31: Washington | L31: USA | M31: Artificial Intelligence | N31: Conference | O31: aaai.org/Conferences/AAAI/aaai83.php
A32: 2nd Annual National Conference on Artificial Intelligence | B32: 1982 | C32: AAAI | D32: AAAI1982 | E32: 1982-08-18T00:00:00.000 | F32: 1982-08-22T00:00:00.000 | J32: Pittsburgh | L32: USA | M32: Artificial Intelligence | N32: Conference | O32: aaai.org/Conferences/AAAI/aaai82.php
A33: 1st Annual National Conference on Artificial Intelligence | B33: 1980 | C33: AAAI | D33: AAAI1980 | E33: 1980-08-18T00:00:00.000 | F33: 1980-08-21T00:00:00.000 | J33: Stanford | K33: California | L33: USA | M33: Artificial Intelligence | N33: Conference | O33: aaai.org/Conferences/AAAI/aaai80.php

Sheet: ISCA
A1: Title | B1: Event[Start date] | C1: Event[Acronym] | D1: Event[Series] | E1: Event[Start date] | F1: Event[End date] | G1: Event[Submitted papers] | H1: Event[Accepted papers] | I1: Event[Submission Rate] | J1: Event[City] | K1: Event[State] | L1: Event[Country] | M1: Event[Field] | N1: Event[Type] | O1: Event[Homepage]
A2: 45th International Symposium on Computer Architecture | B2: 2018 | C2: ISCA 2018 | D2: ISCA | E2: 2018-06-02T00:00:00.000 | F2: 2018-06-06T00:00:00.000 | J2: Los Angeles | K2: California | L2: USA | M2: Computer Architecture | N2: Symposium | O2: iscaconf.org/isca2018/
A3: 44th International Symposium on Computer Architecture | B3: 2017 | C3: ISCA 2017 | D3: ISCA | E3: 2017-06-24T00:00:00.000 | F3: 2017-06-28T00:00:00.000 | G3: 322 | H3: 54 | I3: =RC[-1]/RC[-2] -> 0.16770186335403728 | J3: Toronto | K3: Ontario | L3: Canada | M3: Computer Architecture | N3: Symposium | O3: isca17.ece.utoronto.ca/doku.php
A4: 43rd International Symposium on Computer Architecture | B4: 2016 | C4: ISCA 2016 | D4: ISCA | E4: 2016-06-18T00:00:00.000 | F4: 2016-06-22T00:00:00.000 | G4: 288 | H4: 54 | I4: =RC[-1]/RC[-2] -> 0.1875 | J4: Seoul | L4: Korea | M4: Computer Architecture | N4: Symposium | O4: isca2016.eecs.umich.edu/
A5: 42nd International Symposium on Computer Architecture | B5: 2015 | C5: ISCA 2015 | D5: ISCA | E5: 2015-06-13T00:00:00.000 | F5: 2015-06-17T00:00:00.000 | G5: 305 | H5: 58 | I5: =RC[-1]/RC[-2] -> 0.1901639344262295 | J5: Portlan | K5: Oregon | L5: USA | M5: Computer Architecture | N5: Symposium | O5: www.ece.cmu.edu/calcm/isca2015/
A6: 41st International Symposium on Computer Architecture | B6: 2014 | C6: ISCA 2014 | D6: ISCA | E6: 2014-06-14T00:00:00.000 | F6: 2014-06-18T00:00:00.000 | G6: 285 | H6: 46 | I6: =RC[-1]/RC[-2] -> 0.16140350877192983 | J6: Minneapolis | K6: Minnesota | L6: USA | M6: Computer Architecture | N6: Symposium | O6: cag.engr.uconn.edu/isca2014/
A7: 40th International Symposium on Computer Architecture | B7: 2013 | C7: ISCA 2013 | D7: ISCA | E7: 2013-06-23T00:00:00.000 | F7: 2013-06-27T00:00:00.000 | G7: 288 | H7: 56 | I7: =RC[-1]/RC[-2] -> 0.19444444444444445 | J7: Tel-Aviv | L7: Israel | M7: Computer Architecture | N7: Symposium | O7: isca2013.eew.technion.ac.il/
A8: 39th International Symposium on Computer Architecture | B8: 2012 | C8: ISCA 2012 | D8: ISCA | E8: 2012-06-09T00:00:00.000 | F8: 2012-06-13T00:00:00.000 | G8: 262 | H8: 47 | I8: =RC[-1]/RC[-2] -> 0.17938931297709923 | J8: Portland | K8: Oregon | L8: USA | M8: Computer Architecture | N8: Symposium | O8: www.cad.zju.edu.cn/ENGLISH/about/Callpapers/217.html
A9: 38th International Symposium on Computer Architecture | B9: 2011 | C9: ISCA 2011 | D9: ISCA | E9: 2011-06-04T00:00:00.000 | F9: 2011-06-08T00:00:00.000 | G9: 208 | H9: 40 | I9: =RC[-1]/RC[-2] -> 0.19230769230769232 | J9: San Jose | K9: California | L9: USA | M9: Computer Architecture | N9: Symposium | O9: dblp2.uni-trier.de/db/conf/isca/isca2011.html
A10: 37th International Symposium on Computer Architecture | B10: 2010 | C10: ISCA 2010 | D10: ISCA | E10: 2010-06-19T00:00:00.000 | F10: 2010-06-23T00:00:00.000 | G10: 245 | H10: 44 | I10: =RC[-1]/RC[-2] -> 0.17959183673469387 | J10: Saint-Malo | L10: France | M10: Computer Architecture | N10: Symposium | O10: isca2010.inria.fr/
A11: 36th International Symposium on Computer Architecture | B11: 2009 | C11: ISCA 2009 | D11: ISCA | E11: 2009-06-20T00:00:00.000 | F11: 2009-06-24T00:00:00.000 | G11: 210 | H11: 43 | I11: =RC[-1]/RC[-2] -> 0.20476190476190476 | J11: Austin | K11: Texas | L11: USA | M11: Computer Architecture | N11: Symposium | O11: isca09.cs.columbia.edu/
A12: 35th International Symposium on Computer Architecture | B12: 2008 | C12: ISCA 2008 | D12: ISCA | E12: 2008-06-21T00:00:00.000 | F12: 2008-06-25T00:00:00.000 | G12: 259 | H12: 37 | I12: =RC[-1]/RC[-2] -> 0.14285714285714285 | J12: Beijing | L12: China | M12: Computer Architecture | N12: Symposium | O12: dblp2.uni-trier.de/db/conf/isca/isca2008.html
A13: 34th International Symposium on Computer Architecture | B13: 2007 | C13: ISCA 2007 | D13: ISCA | E13: 2007-06-09T00:00:00.000 | F13: 2007-06-13T00:00:00.000 | G13: 204 | H13: 46 | I13: =RC[-1]/RC[-2] -> 0.22549019607843138 | J13: San Diego | K13: California | L13: USA | M13: Computer Architecture | N13: Symposium | O13: cseweb.ucsd.edu/conferences/isca2007/
A14: 33rd International Symposium on Computer Architecture | B14: 2006 | C14: ISCA 2006 | D14: ISCA | E14: 2006-06-17T00:00:00.000 | F14: 2006-06-21T00:00:00.000 | G14: 234 | H14: 31 | I14: =RC[-1]/RC[-2] -> 0.13247863247863248 | J14: Boston | L14: USA | M14: Computer Architecture | N14: Symposium | O14: dblp2.uni-trier.de/db/conf/isca/isca2006.html
A15: 32nd International Symposium on Computer Architecture | B15: 2005 | C15: ISCA 2005 | D15: ISCA | E15: 2005-06-04T00:00:00.000 | F15: 2005-06-08T00:00:00.000 | G15: 194 | H15: 45 | I15: =RC[-1]/RC[-2] -> 0.23195876288659795 | J15: Madison | K15: Wisconsin | L15: USA | M15: Computer Architecture | N15: Symposium
A16: 31st International Symposium on Computer Architecture | B16: 2004 | C16: ISCA 2004 | D16: ISCA | E16: 2004-06-19T00:00:00.000 | F16: 2004-06-23T00:00:00.000 | G16: 217 | H16: 31 | I16: =RC[-1]/RC[-2] -> 0.14285714285714285 | J16: Munich | L16: Germany | M16: Computer Architecture | N16: Symposium
A17: 30th International Symposium on Computer Architecture | B17: 2003 | C17: ISCA 2003 | D17: ISCA | E17: 2003-06-09T00:00:00.000 | F17: 2003-06-11T00:00:00.000 | G17: 184 | H17: 36 | I17: =RC[-1]/RC[-2] -> 0.19565217391304349 | J17: San Diego | K17: California | L17: USA | M17: Computer Architecture | N17: Symposium
A18: 29th International Symposium on Computer Architecture | B18: 2002 | C18: ISCA 2002 | D18: ISCA | E18: 2002-05-25T00:00:00.000 | F18: 2002-05-29T00:00:00.000 | G18: 180 | H18: 27 | I18: =RC[-1]/RC[-2] -> 0.15 | J18: Anchorage | K18: Alaska | L18: USA | M18: Computer Architecture | N18: Symposium
A19: 28th International Symposium on Computer Architecture | B19: 2001 | C19: ISCA 2001 | D19: ISCA | E19: 2001-06-30T00:00:00.000 | F19: 2001-07-04T00:00:00.000 | G19: 163 | H19: 24 | I19: =RC[-1]/RC[-2] -> 0.14723926380368099 | J19: Göteborg | L19: Sweden | M19: Computer Architecture | N19: Symposium
A20: 27th International Symposium on Computer Architecture | B20: 2000 | C20: ISCA 2000 | D20: ISCA | E20: 2000-06-10T00:00:00.000 | F20: 2000-06-14T00:00:00.000 | G20: 163 | H20: 29 | I20: =RC[-1]/RC[-2] -> 0.17791411042944785 | J20: Vancouver | L20: Canada | M20: Computer Architecture | N20: Symposium
A21: 26th International Symposium on Computer Architecture | B21: 1999 | C21: ISCA 1999 | D21: ISCA | E21: 1999-05-02T00:00:00.000 | F21: 1999-05-04T00:00:00.000 | G21: 135 | H21: 26 | I21: =RC[-1]/RC[-2] -> 0.19259259259259259 | J21: Atlanta | K21: Georgia | L21: USA | M21: Computer Architecture | N21: Symposium
A22: 25th International Symposium on Computer Architecture | B22: 1998 | C22: ISCA 1998 | D22: ISCA | E22: 1998-06-27T00:00:00.000 | F22: 1998-07-01T00:00:00.000 | J22: Barcelona | L22: Sapin | M22: Computer Architecture | N22: Symposium
A23: 24th International Symposium on Computer Architecture | B23: 1997 | C23: ISCA 1997 | D23: ISCA | E23: 1997-06-02T00:00:00.000 | F23: 1997-06-04T00:00:00.000 | J23: Denver | K23: Colorado | L23: USA | M23: Computer Architecture | N23: Symposium
A24: 23rd International Symposium on Computer Architecture | B24: 1996 | C24: ISCA 1996 | D24: ISCA | E24: 1996-05-22T00:00:00.000 | F24: 1996-05-24T00:00:00.000 | J24: Philadephia | L24: USA | M24: Computer Architecture | N24: Symposium
A25: 22nd International Symposium on Computer Architecture | B25: 1995 | C25: ISCA 1995 | D25: ISCA | E25: 1995-06-22T00:00:00.000 | F25: 1995-06-24T00:00:00.000 | J25: Santa Margherita Ligure | L25: Italy | M25: Computer Architecture | N25: Symposium
A26: 21st International Symposium on Computer Architecture | B26: 1994 | C26: ISCA 1994 | D26: ISCA | E26: 1994-04-01T00:00:00.000 | J26: Chicago | L26: USA | M26: Computer Architecture | N26: Symposium
A27: 20th International Symposium on Computer Architecture | B27: 1993 | C27: ISCA 1993 | D27: ISCA | E27: 1993-05-01T00:00:00.000 | J27: San Diego | K27: California | L27: USA | M27: Computer Architecture | N27: Symposium
A28: 19th International Symposium on Computer Architecture | B28: 1992 | C28: ISCA 1992 | D28: ISCA | E28: 1992-05-01T00:00:00.000 | J28: Gold Coast | K28: Queensland | L28: Australia | M28: Computer Architecture | N28: Symposium
A29: 18th International Symposium on Computer Architecture | B29: 1991 | C29: ISCA 1991 | D29: ISCA | E29: 1991-05-27T00:00:00.000 | F29: 1991-05-30T00:00:00.000 | J29: Toronto | L29: Canada | M29: Computer Architecture | N29: Symposium
A30: 17th International Symposium on Computer Architecture | B30: 1990 | C30: ISCA 1990 | D30: ISCA | E30: 1990-06-01T00:00:00.000 | J30: Seattle | L30: USA | M30: Computer Architecture | N30: Symposium
A31: 16th International Symposium on Computer Architecture | B31: 1989 | C31: ISCA 1989 | D31: ISCA | E31: 1989-06-01T00:00:00.000 | J31: Jerusalem | L31: Israel | M31: Computer Architecture | N31: Symposium
A32: 15th International Symposium on Computer Architecture | B32: 1988 | C32: ISCA 1988 | D32: ISCA | E32: 1988-05-01T00:00:00.000 | J32: Honolulu | K32: Hawaii | L32: USA | M32: Computer Architecture | N32: Symposium
A33: 14th International Symposium on Computer Architecture | B33: 1987 | C33: ISCA 1987 | D33: ISCA | E33: 1987-06-01T00:00:00.000 | J33: Pittsburgh | L33: USA | M33: Computer Architecture | N33: Symposium
A34: 13th International Symposium on Computer Architecture | B34: 1986 | C34: ISCA 1986 | D34: ISCA | E34: 1986-06-01T00:00:00.000 | J34: Tokyo | L34: Japan | M34: Computer Architecture | N34: Symposium
A35: 12th International Symposium on Computer Architecture | B35: 1985 | C35: ISCA 1985 | D35: ISCA | E35: 1985-06-01T00:00:00.000 | J35: Boston | L35: USA | M35: Computer Architecture | N35: Symposium
A36: 11th International Symposium on Computer Architecture | B36: 1984 | C36: ISCA 1984 | D36: ISCA | E36: 1984-06-01T00:00:00.000 | J36: Ann Arbor | L36: USA | M36: Computer Architecture | N36: Symposium
A37: 10th International Symposium on Computer Architecture | B37: 1983 | C37: ISCA 1983 | D37: ISCA | J37: Stockholm | L37: Sweden | M37: Computer Architecture | N37: Symposium
A38: 9th International Symposium on Computer Architecture | B38: 1982 | C38: ISCA 1982 | D38: ISCA | E38: 1982-04-26T00:00:00.000 | F38: 1982-04-29T00:00:00.000 | J38: Austin | L38: USA | M38: Computer Architecture | N38: Symposium
A39: 8th International Symposium on Computer Architecture | B39: 1981 | C39: ISCA 1981 | D39: ISCA | E39: 1981-05-01T00:00:00.000 | M39: Computer Architecture | N39: Symposium
A40: 7th International Symposium on Computer Architecture | B40: 1980 | C40: ISCA 1980 | D40: ISCA | E40: 1980-05-01T00:00:00.000 | M40: Computer Architecture | N40: Symposium
A41: 6th International Symposium on Computer Architecture | B41: 1979 | C41: ISCA 1979 | D41: ISCA | E41: 1979-04-01T00:00:00.000 | M41: Computer Architecture | N41: Symposium
A42: 5th International Symposium on Computer Architecture | B42: 1978 | C42: ISCA 1978 | D42: ISCA | E42: 1978-04-01T00:00:00.000 | M42: Computer Architecture | N42: Symposium
A43: 4th International Symposium on Computer Architecture | B43: 1977 | C43: ISCA 1977 | D43: ISCA | E43: 1977-03-01T00:00:00.000 | M43: Computer Architecture | N43: Symposium
A44: 3rd International Symposium on Computer Architecture | B44: 1976 | C44: ISCA 1976 | D44: ISCA | E44: 1976-01-01T00:00:00.000 | M44: Computer Architecture | N44: Symposium
A45: 2nd International Symposium on Computer Architecture | B45: 1974 | C45: ISCA 1974 | D45: ISCA | E45: 1974-12-01T00:00:00.000 | M45: Computer Architecture | N45: Symposium
A46: 1st International Symposium on Computer Architecture | B46: 1973 | C46: ISCA 1973 | D46: ISCA | E46: 1973-12-01T00:00:00.000 | M46: Computer Architecture | N46: Symposium

Sheet: HPCA
A1: Title | B1: Event[Start date] | C1: Event[Acronym] | D1: Event[Series] | E1: Event[Start date] | F1: Event[End date] | G1: Event[Submitted papers] | H1: Event[Accepted papers] | I1: Event[Submission Rate] | J1: Event[City] | K1: Event[State] | L1: Event[Country] | M1: Event[Field] | N1: Event[Type] | O1: Event[Homepage]
A2: 24th High-Performance Computer Architecture | B2: 2018 | C2: HPCA 2018 | D2: HPCA | E2: 2018-02-24T00:00:00.000 | F2: 2018-02-28T00:00:00.000 | J2: Vienna | L2: Austria | M2: High Performance Computer Architecture | N2: Conference | O2: hpca2018.ece.ucsb.edu/
A3: 23rd High-Performance Computer Architecture | B3: 2017 | C3: HPCA 2017 | D3: HPCA | E3: 2017-02-04T00:00:00.000 | F3: 2017-02-08T00:00:00.000 | G3: 224 | H3: 50 | I3: =RC[-1]/RC[-2] -> 0.22321428571428573 | J3: Austin | K3: Texas | L3: USA | M3: High Performance Computer Architecture | N3: Conference | O3: hpca2017.org/
A4: 22nd High-Performance Computer Architecture | B4: 2016 | C4: HPCA 2016 | D4: HPCA | E4: 2016-03-12T00:00:00.000 | F4: 2016-03-16T00:00:00.000 | G4: 240 | H4: 53 | I4: =RC[-1]/RC[-2] -> 0.22083333333333333 | J4: Barcelona | L4: Spain | M4: High Performance Computer Architecture | N4: Conference | O4: hpca22.ac.upc.edu/
A5: 21st High-Performance Computer Architecture | B5: 2015 | C5: HPCA 2015 | D5: HPCA | E5: 2015-02-07T00:00:00.000 | F5: 2015-02-11T00:00:00.000 | G5: 231 | H5: 51 | I5: =RC[-1]/RC[-2] -> 0.22077922077922077 | J5: Burlingame | K5: California | L5: USA | M5: High Performance Computer Architecture | N5: Conference | O5: darksilicon.org/hpca/
A6: 20th High-Performance Computer Architecture | B6: 2014 | C6: HPCA 2014 | D6: HPCA | E6: 2014-02-15T00:00:00.000 | F6: 2014-02-19T00:00:00.000 | G6: 215 | H6: 55 | I6: =RC[-1]/RC[-2] -> 0.2558139534883721 | J6: Orlando | K6: Florida | L6: USA | M6: High Performance Computer Architecture | N6: Conference | O6: hpca20.ece.ufl.edu/
A7: 19th High-Performance Computer Architecture | B7: 2013 | C7: HPCA 2013 | D7: HPCA | E7: 2013-02-23T00:00:00.000 | F7: 2013-02-27T00:00:00.000 | G7: 249 | H7: 51 | I7: =RC[-1]/RC[-2] -> 0.20481927710843373 | J7: Shenzhen | L7: China | M7: High Performance Computer Architecture | N7: Conference | O7: www.cs.utah.edu/~lizhang/HPCA19/
A8: 18th High-Performance Computer Architecture | B8: 2012 | C8: HPCA 2012 | D8: HPCA | E8: 2012-02-25T00:00:00.000 | F8: 2012-02-29T00:00:00.000 | G8: 213 | H8: 36 | I8: =RC[-1]/RC[-2] -> 0.16901408450704225 | J8: New Orleans | L8: USA | M8: High Performance Computer Architecture | N8: Conference | O8: www.ece.lsu.edu/hpca-18/
A9: 17th High-Performance Computer Architecture | B9: 2011 | C9: HPCA 2011 | D9: HPCA | E9: 2011-02-12T00:00:00.000 | F9: 2011-02-16T00:00:00.000 | G9: 227 | H9: 42 | I9: =RC[-1]/RC[-2] -> 0.18502202643171806 | J9: San Antonio | K9: Texas | L9: USA | M9: High Performance Computer Architecture | N9: Conference | O9: dblp.uni-trier.de/db/conf/hpca/hpca2011.html
A10: 16th High-Performance Computer Architecture | B10: 2010 | C10: HPCA 2010 | D10: HPCA | E10: 2010-01-09T00:00:00.000 | F10: 2010-01-14T00:00:00.000 | G10: 175 | H10: 32 | I10: =RC[-1]/RC[-2] -> 0.18285714285714286 | J10: Bangalore | L10: India | M10: High Performance Computer Architecture | N10: Conference | O10: www.cse.psu.edu/hpcl/hpca16.html
A11: 15th High-Performance Computer Architecture | B11: 2009 | C11: HPCA 2009 | D11: HPCA | E11: 2009-02-14T00:00:00.000 | F11: 2009-02-18T00:00:00.000 | G11: 184 | H11: 35 | I11: =RC[-1]/RC[-2] -> 0.19021739130434784 | J11: Raleigh | K11: North Carolina | L11: USA | M11: High Performance Computer Architecture | N11: Conference | O11: www.comparch.ncsu.edu/hpca/
A12: 14th High-Performance Computer Architecture | B12: 2008 | C12: HPCA 2008 | D12: HPCA | E12: 2008-02-16T00:00:00.000 | F12: 2008-02-20T00:00:00.000 | G12: 161 | H12: 31 | I12: =RC[-1]/RC[-2] -> 0.19254658385093168 | J12: Salt Lake | L12: USA | M12: High Performance Computer Architecture | N12: Conference | O12: dblp2.uni-trier.de/db/conf/hpca/hpca2008
A13: 13th High-Performance Computer Architecture | B13: 2007 | C13: HPCA 2007 | D13: HPCA | E13: 2007-02-10T00:00:00.000 | F13: 2007-02-14T00:00:00.000 | G13: 174 | H13: 28 | I13: =RC[-1]/RC[-2] -> 0.16091954022988506 | J13: Phoenix | K13: Arizona | L13: USA | M13: High Performance Computer Architecture | N13: Conference | O13: hpcaconf.org/hpca13/index.html
A14: 12th High-Performance Computer Architecture | B14: 2006 | C14: HPCA 2006 | D14: HPCA | E14: 2006-02-11T00:00:00.000 | F14: 2006-02-15T00:00:00.000 | G14: 172 | H14: 22 | I14: =RC[-1]/RC[-2] -> 0.12790697674418605 | J14: Austin | K14: Texas | L14: USA | M14: High Performance Computer Architecture | N14: Conference | O14: hpcaconf.org/hpca12/index.html
A15: 11th High-Performance Computer Architecture | B15: 2005 | C15: HPCA 2005 | D15: HPCA | E15: 2005-02-12T00:00:00.000 | F15: 2005-02-16T00:00:00.000 | G15: 181 | H15: 28 | I15: =RC[-1]/RC[-2] -> 0.15469613259668508 | J15: San Francisco | K15: California | L15: USA | M15: High Performance Computer Architecture | N15: Conference | O15: hpcaconf.org/hpca11/index.html
A16: 10th High-Performance Computer Architecture | B16: 2004 | C16: HPCA 2004 | D16: HPCA | E16: 2004-02-14T00:00:00.000 | F16: 2004-02-18T00:00:00.000 | G16: 153 | H16: 27 | I16: =RC[-1]/RC[-2] -> 0.17647058823529413 | J16: Madrid | L16: Spain | M16: High Performance Computer Architecture | N16: Conference | O16: hpcaconf.org/hpca10/index.html
A17: 9th High-Performance Computer Architecture | B17: 2003 | C17: HPCA 2003 | D17: HPCA | E17: 2003-02-08T00:00:00.000 | F17: 2003-02-12T00:00:00.000 | G17: 141 | H17: 31 | I17: =RC[-1]/RC[-2] -> 0.21985815602836881 | J17: Anaheim | K17: California | L17: USA | M17: High Performance Computer Architecture | N17: Conference | O17: hpcaconf.org/hpca9/index.html
A18: 8th High-Performance Computer Architecture | B18: 2002 | C18: HPCA 2002 | D18: HPCA | E18: 2002-02-02T00:00:00.000 | F18: 2002-02-06T00:00:00.000 | G18: 130 | H18: 26 | I18: =RC[-1]/RC[-2] -> 0.2 | J18: Boston | L18: USA | M18: High Performance Computer Architecture | N18: Conference | O18: hpcaconf.org/hpca8/index.html
A19: 7th High-Performance Computer Architecture | B19: 2001 | C19: HPCA 2001 | D19: HPCA | E19: 2001-01-20T00:00:00.000 | F19: 2001-01-24T00:00:00.000 | G19: 110 | H19: 26 | I19: =RC[-1]/RC[-2] -> 0.23636363636363636 | J19: Nuevo Leone | L19: Mexico | M19: High Performance Computer Architecture | N19: Conference | O19: dblp.uni-trier.de/db/conf/hpca/hpca2001.html
A20: 6th High-Performance Computer Architecture | B20: 2000 | C20: HPCA 2000 | D20: HPCA | E20: 2000-01-08T00:00:00.000 | F20: 2000-01-12T00:00:00.000 | G20: 163 | H20: 35 | I20: =RC[-1]/RC[-2] -> 0.21472392638036811 | J20: Toulouse | L20: France | M20: High Performance Computer Architecture | N20: Conference | O20: dblp.uni-trier.de/db/conf/hpca/hpca2000.html
A21: 5th High-Performance Computer Architecture | B21: 1999 | C21: HPCA 1999 | D21: HPCA | E21: 1999-01-09T00:00:00.000 | F21: 1999-01-12T00:00:00.000 | G21: 117 | H21: 37 | I21: =RC[-1]/RC[-2] -> 0.31623931623931623 | J21: Orlando | K21: Florida | L21: USA | M21: High Performance Computer Architecture | N21: Conference | O21: dblp.uni-trier.de/db/conf/hpca/hpca1999.html
A22: 4th High-Performance Computer Architecture | B22: 1998 | C22: HPCA 1998 | D22: HPCA | E22: 1998-01-31T00:00:00.000 | F22: 1998-02-04T00:00:00.000 | G22: 141 | H22: 26 | I22: =RC[-1]/RC[-2] -> 0.18439716312056736 | J22: Las Vegas | K22: Nevada | L22: USA | M22: High Performance Computer Architecture | N22: Conference | O22: dblp.uni-trier.de/db/conf/hpca/hpca1998.html
A23: 3rd High-Performance Computer Architecture | B23: 1997 | C23: HPCA 1997 | D23: HPCA | E23: 1997-02-01T00:00:00.000 | F23: 1997-02-05T00:00:00.000 | G23: 152 | H23: 30 | I23: =RC[-1]/RC[-2] -> 0.19736842105263158 | J23: San Antonio | K23: Texas | L23: USA | M23: High Performance Computer Architecture | N23: Conference | O23: dblp.uni-trier.de/db/conf/hpca/hpca1997.html
A24: 2nd High-Performance Computer Architecture | B24: 1996 | C24: HPCA 1996 | D24: HPCA | E24: 1996-02-03T00:00:00.000 | F24: 1996-02-07T00:00:00.000 | G24: 131 | H24: 29 | I24: =RC[-1]/RC[-2] -> 0.22137404580152673 | J24: San Jose | K24: California | L24: USA | M24: High Performance Computer Architecture | N24: Conference | O24: dblp.uni-trier.de/db/conf/hpca/hpca1996.html
A25: 1st High-Performance Computer Architecture | B25: 1995 | C25: HPCA 1995 | D25: HPCA | E25: 1995-01-22T00:00:00.000 | F25: 1995-01-25T00:00:00.000 | G25: 190 | H25: 36 | I25: =RC[-1]/RC[-2] -> 0.18947368421052632 | J25: Raleigh | K25: North Carolina | L25: USA | M25: High Performance Computer Architecture | N25: Conference | O25: dblp.uni-trier.de/db/conf/hpca/hpca1995.html

Sheet: FOCS
A1: Title | B1: Event[Start date] | C1: Event[Acronym] | D1: Event[Series] | E1: Event[Start date] | F1: Event[End date] | G1: Event[Submitted papers] | H1: Event[Accepted papers] | I1: Event[Submission Rate] | J1: Event[City] | K1: Event[State] | L1: Event[Country] | M1: Event[Field] | N1: Event[Type] | O1: Event[Homepage]
A2: Annual Symposium on Foundations of Computer Science | B2: 2018 | C2: FOCS 2018 | D2: FOCS | E2: 2018-10-07T00:00:00.000 | F2: 2018-10-09T00:00:00.000 | J2: Paris | L2: France | M2: Foundations of Computer Science | N2: Conference | O2: ieee-focs.org/
A3: Annual Symposium on Foundations of Computer Science | B3: 2017 | C3: FOCS 2017 | D3: FOCS | E3: 2017-10-15T00:00:00.000 | F3: 2017-10-17T00:00:00.000 | G3: 323 | H3: 90 | I3: =RC[-1]/RC[-2] -> 0.27863777089783281 | J3: Berkeley | K3: California | L3: USA | M3: Foundations of Computer Science | N3: Conference
A4: Annual Symposium on Foundations of Computer Science | B4: 2016 | C4: FOCS 2016 | D4: FOCS | E4: 2016-10-09T00:00:00.000 | F4: 2016-10-11T00:00:00.000 | G4: 307 | H4: 85 | I4: =RC[-1]/RC[-2] -> 0.27687296416938112 | J4: New Brunswick | K4: New Jersey | L4: USA | M4: Foundations of Computer Science | N4: Conference | O4: www.wisdom.weizmann.ac.il/~dinuri/focs16/CFP.html
A5: Annual Symposium on Foundations of Computer Science | B5: 2015 | C5: FOCS 2015 | D5: FOCS | E5: 2015-10-18T00:00:00.000 | F5: 2015-10-20T00:00:00.000 | G5: 314 | H5: 86 | I5: =RC[-1]/RC[-2] -> 0.27388535031847133 | J5: Berkeley | K5: California | L5: USA | M5: Foundations of Computer Science | N5: Conference | O5: focs15.simons.berkeley.edu/
A6: Annual Symposium on Foundations of Computer Science | B6: 2014 | C6: FOCS 2014 | D6: FOCS | E6: 2014-10-18T00:00:00.000 | F6: 2014-10-21T00:00:00.000 | G6: 273 | H6: 68 | I6: =RC[-1]/RC[-2] -> 0.24908424908424909 | J6: Philadelphia | L6: USA | M6: Foundations of Computer Science | N6: Conference | O6: www.boazbarak.org/focs14/
A7: Annual Symposium on Foundations of Computer Science | B7: 2013 | C7: FOCS 2013 | D7: FOCS | E7: 2013-10-27T00:00:00.000 | F7: 2013-10-30T00:00:00.000 | G7: 281 | H7: 79 | I7: =RC[-1]/RC[-2] -> 0.28113879003558717 | J7: Berkeley | K7: California | L7: USA | M7: Foundations of Computer Science | N7: Conference | O7: simons.berkeley.edu/focs2013/
A8: Annual Symposium on Foundations of Computer Science | B8: 2012 | C8: FOCS 2012 | D8: FOCS | E8: 2012-10-20T00:00:00.000 | F8: 2012-10-23T00:00:00.000 | G8: 248 | H8: 79 | I8: =RC[-1]/RC[-2] -> 0.31854838709677419 | J8: New Brunswick | K8: New Jersey | L8: USA | M8: Foundations of Computer Science | N8: Conference | O8: theory.stanford.edu/~tim/focs12/
A9: Annual Symposium on Foundations of Computer Science | B9: 2011 | C9: FOCS 2011 | D9: FOCS | E9: 2011-10-22T00:00:00.000 | F9: 2011-10-25T00:00:00.000 | G9: 292 | H9: 85 | I9: =RC[-1]/RC[-2] -> 0.2910958904109589 | J9: Palm Springs | K9: California | L9: USA | M9: Foundations of Computer Science | N9: Conference | O9: web.cs.ucla.edu/~rafail/FOCS11/
A10: Annual Symposium on Foundations of Computer Science | B10: 2010 | C10: FOCS 2010 | D10: FOCS | E10: 2010-10-23T00:00:00.000 | F10: 2010-10-26T00:00:00.000 | G10: 270 | H10: 81 | I10: =RC[-1]/RC[-2] -> 0.3 | J10: Las Vegas | L10: USA | M10: Foundations of Computer Science | N10: Conference | O10: theory.stanford.edu/focs2010/
A11: Annual Symposium on Foundations of Computer Science | B11: 2009 | C11: FOCS 2009 | D11: FOCS | E11: 2009-10-24T00:00:00.000 | F11: 2009-10-27T00:00:00.000 | G11: 249 | H11: 75 | I11: =RC[-1]/RC[-2] -> 0.30120481927710846 | J11: Atlanta | L11: USA | M11: Foundations of Computer Science | N11: Conference | O11: www.cc.gatech.edu/focs2009/
A12: Annual Symposium on Foundations of Computer Science | B12: 2008 | C12: FOCS 2008 | D12: FOCS | E12: 2008-10-25T00:00:00.000 | F12: 2008-10-28T00:00:00.000 | G12: 276 | H12: 79 | I12: =RC[-1]/RC[-2] -> 0.28623188405797101 | J12: Philadelphia | L12: USA | M12: Foundations of Computer Science | N12: Conference | O12: www.cs.cmu.edu/~FOCS2008/
A13: Annual Symposium on Foundations of Computer Science | B13: 2007 | C13: FOCS 2007 | D13: FOCS | E13: 2007-10-20T00:00:00.000 | F13: 2007-10-23T00:00:00.000 | G13: 302 | H13: 66 | I13: =RC[-1]/RC[-2] -> 0.2185430463576159 | J13: Providence | L13: USA | M13: Foundations of Computer Science | N13: Conference | O13: focs2007.org/
A14: Annual Symposium on Foundations of Computer Science | B14: 2006 | C14: FOCS 2006 | D14: FOCS | E14: 2006-10-22T00:00:00.000 | F14: 2006-10-24T00:00:00.000 | G14: 240 | H14: 71 | I14: =RC[-1]/RC[-2] -> 0.29583333333333334 | J14: Berkeley | K14: California | L14: USA | M14: Foundations of Computer Science | N14: Conference | O14: ieee-focs.org/focs2006/
A15: Annual Symposium on Foundations of Computer Science | B15: 2005 | C15: FOCS 2005 | D15: FOCS | E15: 2005-10-22T00:00:00.000 | F15: 2005-10-25T00:00:00.000 | G15: 272 | H15: 62 | I15: =RC[-1]/RC[-2] -> 0.22794117647058823 | J15: Pittsburgh | L15: USA | M15: Foundations of Computer Science | N15: Conference | O15: ieee-focs.org/focs2005/
A16: Annual Symposium on Foundations of Computer Science | B16: 2004 | C16: FOCS 2004 | D16: FOCS | E16: 2004-10-17T00:00:00.000 | F16: 2004-10-19T00:00:00.000 | G16: 272 | H16: 64 | I16: =RC[-1]/RC[-2] -> 0.23529411764705882 | J16: Rome | L16: Italy | M16: Foundations of Computer Science | N16: Conference | O16: ieee-focs.org/focs2004/local.html
A17: Annual Symposium on Foundations of Computer Science | B17: 2003 | C17: FOCS 2003 | D17: FOCS | E17: 2003-10-11T00:00:00.000 | F17: 2003-10-14T00:00:00.000 | G17: 254 | H17: 62 | I17: =RC[-1]/RC[-2] -> 0.24409448818897639 | J17: Cambridge | L17: USA | M17: Foundations of Computer Science | N17: Conference | O17: ieee-focs.org/focs2003/cfp.html
A18: Annual Symposium on Foundations of Computer Science | B18: 2002 | C18: FOCS 2002 | D18: FOCS | E18: 2002-11-16T00:00:00.000 | F18: 2002-11-19T00:00:00.000 | G18: 279 | H18: 77 | I18: =RC[-1]/RC[-2] -> 0.27598566308243727 | J18: Vancouver | L18: Canada | M18: Foundations of Computer Science | N18: Conference | O18: ieee-focs.org/focs2002/
A19: Annual Symposium on Foundations of Computer Science | B19: 2001 | C19: FOCS 2001 | D19: FOCS | E19: 2001-10-14T00:00:00.000 | F19: 2001-10-17T00:00:00.000 | G19: 2014 | H19: 63 | I19: =RC[-1]/RC[-2] -> 3.128103277060576E-2 | J19: Las Vegas | L19: USA | M19: Foundations of Computer Science | N19: Conference | O19: ieee-focs.org/focs2001/
A20: Annual Symposium on Foundations of Computer Science | B20: 2000 | C20: FOCS 2000 | D20: FOCS | E20: 2000-11-12T00:00:00.000 | F20: 2000-11-14T00:00:00.000 | G20: 206 | H20: 66 | I20: =RC[-1]/RC[-2] -> 0.32038834951456313 | J20: Redondo Beach | K20: California | L20: USA | M20: Foundations of Computer Science | N20: Conference | O20: ieee-focs.org/focs2000/
A21: Annual Symposium on Foundations of Computer Science | B21: 1999 | C21: FOCS 1999 | D21: FOCS | E21: 1999-10-17T00:00:00.000 | F21: 1999-10-19T00:00:00.000 | G21: 218 | H21: 67 | I21: =RC[-1]/RC[-2] -> 0.30733944954128439 | J21: New York | L21: USA | M21: Foundations of Computer Science | N21: Conference | O21: ieee-focs.org/focs1999/
A22: Annual Symposium on Foundations of Computer Science | B22: 1998 | C22: FOCS 1998 | D22: FOCS | E22: 1998-11-08T00:00:00.000 | F22: 1998-11-11T00:00:00.000 | G22: 204 | H22: 76 | I22: =RC[-1]/RC[-2] -> 0.37254901960784315 | J22: Palo Alto | K22: California | L22: USA | M22: Foundations of Computer Science | N22: Conference | O22: ieee-focs.org/focs1998/
A23: Annual Symposium on Foundations of Computer Science | B23: 1997 | C23: FOCS 1997 | D23: FOCS | E23: 1997-10-19T00:00:00.000 | F23: 1997-10-22T00:00:00.000 | J23: Miami Beach | K23: Florida | L23: USA | M23: Foundations of Computer Science | N23: Conference | O23: ieee-focs.org/focs1997/
A24: Annual Symposium on Foundations of Computer Science | B24: 1996 | C24: FOCS 1996 | D24: FOCS | E24: 1996-10-14T00:00:00.000 | F24: 1996-10-16T00:00:00.000 | G24: 174 | H24: 63 | I24: =RC[-1]/RC[-2] -> 0.36206896551724138 | J24: Burlington | L24: USA | M24: Foundations of Computer Science | N24: Conference | O24: ieee-focs.org/focs1996/
A25: Annual Symposium on Foundations of Computer Science | B25: 1995 | C25: FOCS 1995 | D25: FOCS | E25: 1995-10-23T00:00:00.000 | F25: 1995-10-25T00:00:00.000 | G25: 196 | H25: 70 | I25: =RC[-1]/RC[-2] -> 0.35714285714285715 | J25: Milwaukee | L25: USA | M25: Foundations of Computer Science | N25: Conference
A26: Annual Symposium on Foundations of Computer Science | B26: 1994 | C26: FOCS 1994 | D26: FOCS | E26: 1994-11-20T00:00:00.000 | F26: 1994-11-22T00:00:00.000 | J26: Santa Fe | L26: USA | M26: Foundations of Computer Science | N26: Conference
A27: Annual Symposium on Foundations of Computer Science | B27: 1993 | C27: FOCS 1993 | D27: FOCS | E27: 1993-11-03T00:00:00.000 | F27: 1993-11-05T00:00:00.000 | J27: Palo Alto | K27: California | L27: USA | M27: Foundations of Computer Science | N27: Conference
A28: Annual Symposium on Foundations of Computer Science | B28: 1992 | C28: FOCS 1992 | D28: FOCS | E28: 1992-10-24T00:00:00.000 | F28: 1992-10-27T00:00:00.000 | J28: Pittsburgh | L28: USA | M28: Foundations of Computer Science | N28: Conference
A29: Annual Symposium on Foundations of Computer Science | B29: 1991 | C29: FOCS 1991 | D29: FOCS | E29: 1991-10-01T00:00:00.000 | F29: 1991-10-04T00:00:00.000 | J29: San Juan | K29: Puerto Rico | L29: USA | M29: Foundations of Computer Science | N29: Conference
A30: Annual Symposium on Foundations of Computer Science | B30: 1990 | C30: FOCS 1990 | D30: FOCS | E30: 1990-10-22T00:00:00.000 | F30: 1990-10-24T00:00:00.000 | J30: St. Louis | K30: Missouri | L30: USA | M30: Foundations of Computer Science | N30: Conference
A31: Annual Symposium on Foundations of Computer Science | B31: 1989 | C31: FOCS 1989 | D31: FOCS | E31: 1989-10-30T00:00:00.000 | F31: 1989-11-01T00:00:00.000 | J31: Durham | L31: USA | M31: Foundations of Computer Science | N31: Conference

Sheet: PERCOM
A1: Title | B1: Event[Start date] | C1: Event[Acronym] | D1: Event[Series] | E1: Event[Start date] | F1: Event[End date] | G1: Event[Submitted papers] | H1: Event[Accepted papers] | I1: Event[Submission Rate] | J1: Event[City] | K1: Event[State] | L1: Event[Country] | M1: Event[Field] | N1: Event[Type] | O1: Event[Homepage]
A2: International Conference on Pervasive Computing and Communications | B2: 2018 | C2: PERCOM 2018 | D2: PERCOM | E2: 2018-03-19T00:00:00.000 | F2: 2018-03-23T00:00:00.000 | J2: Athens | L2: Greece | M2: Pervasive Computing | N2: Conference | O2: www.percom.org/
A3: International Conference on Pervasive Computing and Communications | B3: 2017 | C3: PERCOM 2017 | D3: PERCOM | E3: 2017-03-13T00:00:00.000 | F3: 2017-03-17T00:00:00.000 | G3: 194 | H3: 32 | I3: =RC[-1]/RC[-2] -> 0.16494845360824742 | J3: Kona | K3: Hawaii | L3: USA | M3: Pervasive Computing | N3: Conference | O3: www.percom.org/Previous/ST2017/
A4: International Conference on Pervasive Computing and Communications | B4: 2016 | C4: PERCOM 2016 | D4: PERCOM | E4: 2016-03-14T00:00:00.000 | F4: 2016-03-18T00:00:00.000 | G4: 168 | H4: 25 | I4: =RC[-1]/RC[-2] -> 0.14880952380952381 | J4: Sydney | L4: Australia | M4: Pervasive Computing | N4: Conference | O4: www.percom.org/Previous/ST2016/
A5: International Conference on Pervasive Computing and Communications | B5: 2015 | C5: PERCOM 2015 | D5: PERCOM | E5: 2015-03-23T00:00:00.000 | F5: 2015-03-27T00:00:00.000 | G5: 196 | H5: 29 | I5: =RC[-1]/RC[-2] -> 0.14795918367346939 | J5: St. Louis | L5: USA | M5: Pervasive Computing | N5: Conference | O5: www.percom.org/Previous/ST2015/
A6: International Conference on Pervasive Computing and Communications | B6: 2014 | C6: PERCOM 2014 | D6: PERCOM | E6: 2014-03-24T00:00:00.000 | F6: 2014-03-28T00:00:00.000 | G6: 175 | H6: 25 | I6: =RC[-1]/RC[-2] -> 0.14285714285714285 | J6: Budapest | L6: Hungary | M6: Pervasive Computing | N6: Conference | O6: www.percom.org/Previous/ST2014/
A7: International Conference on Pervasive Computing and Communications | B7: 2013 | C7: PERCOM 2013 | D7: PERCOM | E7: 2013-03-18T00:00:00.000 | F7: 2013-03-22T00:00:00.000 | G7: 174 | H7: 27 | I7: =RC[-1]/RC[-2] -> 0.15517241379310345 | J7: San Diego | K7: California | L7: USA | M7: Pervasive Computing | N7: Conference | O7: www.percom.org/Previous/ST2013/
A8: International Conference on Pervasive Computing and Communications | B8: 2012 | C8: PERCOM 2012 | D8: PERCOM | E8: 2012-03-19T00:00:00.000 | F8: 2012-03-23T00:00:00.000 | G8: 150 | H8: 28 | I8: =RC[-1]/RC[-2] -> 0.18666666666666668 | J8: Lugano | L8: Switzerland | M8: Pervasive Computing | N8: Conference | O8: www.percom.org/Previous/ST2012/
A9: International Conference on Pervasive Computing and Communications | B9: 2011 | C9: PERCOM 2011 | D9: PERCOM | E9: 2011-03-21T00:00:00.000 | F9: 2011-03-25T00:00:00.000 | G9: 154 | H9: 27 | I9: =RC[-1]/RC[-2] -> 0.17532467532467533 | J9: Seattle | L9: USA | M9: Pervasive Computing | N9: Conference | O9: www.percom.org/Previous/ST2011/
A10: International Conference on Pervasive Computing and Communications | B10: 2010 | C10: PERCOM 2010 | D10: PERCOM | E10: 2010-03-29T00:00:00.000 | F10: 2010-04-02T00:00:00.000 | G10: 227 | H10: 28 | I10: =RC[-1]/RC[-2] -> 0.12334801762114538 | J10: Mannheim | L10: Germany | M10: Pervasive Computing | N10: Conference | O10: www.percom.org/Previous/ST2010/
A11: International Conference on Pervasive Computing and Communications | B11: 2009 | C11: PERCOM 2009 | D11: PERCOM | E11: 2009-03-09T00:00:00.000 | F11: 2009-03-13T00:00:00.000 | G11: 199 | H11: 26 | I11: =RC[-1]/RC[-2] -> 0.1306532663316583 | J11: Galveston | K11: Texas | L11: USA | M11: Pervasive Computing | N11: Conference | O11: www.percom.org/Previous/ST2009/
A12: International Conference on Pervasive Computing and Communications | B12: 2008 | C12: PERCOM 2008 | D12: PERCOM | E12: 2008-03-17T00:00:00.000 | F12: 2008-03-21T00:00:00.000 | G12: 160 | H12: 19 | I12: =RC[-1]/RC[-2] -> 0.11874999999999999 | L12: Hong Kong | M12: Pervasive Computing | N12: Conference | O12: www.percom.org/Previous/ST2008/
A13: International Conference on Pervasive Computing and Communications | B13: 2007 | C13: PERCOM 2007 | D13: PERCOM | E13: 2007-03-19T00:00:00.000 | F13: 2007-03-23T00:00:00.000 | G13: 208 | H13: 20 | I13: =RC[-1]/RC[-2] -> 9.6153846153846159E-2 | J13: White Plains | K13: New York | L13: USA | M13: Pervasive Computing | N13: Conference | O13: www.percom.org/Previous/ST2007/
A14: International Conference on Pervasive Computing and Communications | B14: 2006 | C14: PERCOM 2006 | D14: PERCOM | E14: 2006-03-13T00:00:00.000 | F14: 2006-03-17T00:00:00.000 | G14: 280 | H14: 23 | I14: =RC[-1]/RC[-2] -> 8.2142857142857142E-2 | J14: Pisa | L14: Italy | M14: Pervasive Computing | N14: Conference | O14: www.percom.org/Previous/ST2006/
A15: International Conference on Pervasive Computing and Communications | B15: 2005 | C15: PERCOM 2005 | D15: PERCOM | E15: 2005-03-08T00:00:00.000 | F15: 2005-03-12T00:00:00.000 | G15: 233 | H15: 38 | I15: =RC[-1]/RC[-2] -> 0.1630901287553648 | J15: Kauai Island | L15: USA | M15: Pervasive Computing | N15: Conference | O15: www.percom.org/Previous/ST2005/
A16: International Conference on Pervasive Computing and Communications | B16: 2004 | C16: PERCOM 2004 | D16: PERCOM | E16: 2004-03-14T00:00:00.000 | F16: 2004-03-17T00:00:00.000 | G16: 193 | H16: 31 | I16: =RC[-1]/RC[-2] -> 0.16062176165803108 | J16: Orlando | K16: Florida | L16: USA | M16: Pervasive Computing | N16: Conference | O16: www.percom.org/Previous/ST2004/
A17: International Conference on Pervasive Computing and Communications | B17: 2003 | C17: PERCOM 2003 | D17: PERCOM | E17: 2003-03-23T00:00:00.000 | F17: 2003-03-26T00:00:00.000 | G17: 170 | H17: 53 | I17: =RC[-1]/RC[-2] -> 0.31176470588235294 | J17: Fort Worth | K17: Texas | L17: USA | M17: Pervasive Computing | N17: Conference | O17: www.percom.org/Previous/ST2003/

Sheet: PODC
A1: Title | B1: Event[Start date] | C1: Event[Acronym] | D1: Event[Series] | E1: Event[Start date] | F1: Event[End date] | G1: Event[Submitted papers] | H1: Event[Accepted papers] | I1: Event[Submission Rate] | J1: Event[City] | K1: Event[State] | L1: Event[Country] | M1: Event[Field] | N1: Event[Type] | O1: Event[Homepage]
A2: Symposium on Principles of Distributed Computing | B2: 2018 | C2: PODC 2018 | D2: PODC | E2: 2018-07-23T00:00:00.000 | F2: 2018-07-27T00:00:00.000 | J2: Egham | L2: UK | M2: Distributed Computing | N2: Symposium | O2: www.podc.org/
A3: Symposium on Principles of Distributed Computing | B3: 2017 | C3: PODC 2017 | D3: PODC | E3: 2017-07-25T00:00:00.000 | F3: 2017-07-27T00:00:00.000 | G3: 154 | H3: 38 | I3: =RC[-1]/RC[-2] -> 0.24675324675324675 | J3: Washington | L3: USA | M3: Distributed Computing | N3: Symposium | O3: www.podc.org/podc2017/
A4: Symposium on Principles of Distributed Computing | B4: 2016 | C4: PODC 2016 | D4: PODC | E4: 2016-07-25T00:00:00.000 | F4: 2016-07-29T00:00:00.000 | G4: 149 | H4: 40 | I4: =RC[-1]/RC[-2] -> 0.26845637583892618 | J4: Chicago | K4: Illinois | L4: USA | M4: Distributed Computing | N4: Symposium | O4: www.podc.org/podc2016/
A5: Symposium on Principles of Distributed Computing | B5: 2015 | C5: PODC 2015 | D5: PODC | E5: 2015-07-21T00:00:00.000 | F5: 2015-07-23T00:00:00.000 | G5: 191 | H5: 45 | I5: =RC[-1]/RC[-2] -> 0.2356020942408377 | J5: Donostia-San Sebastián | L5: Spain | M5: Distributed Computing | N5: Symposium | O5: www.podc.org/podc2015/
A6: Symposium on Principles of Distributed Computing | B6: 2014 | C6: PODC 2014 | D6: PODC | E6: 2014-07-15T00:00:00.000 | F6: 2014-07-18T00:00:00.000 | G6: 141 | H6: 39 | I6: =RC[-1]/RC[-2] -> 0.27659574468085107 | J6: Paris | L6: France | M6: Distributed Computing | N6: Symposium | O6: www.podc.org/podc2014/
A7: Symposium on Principles of Distributed Computing | B7: 2013 | C7: PODC 2013 | D7: PODC | E7: 2013-07-22T00:00:00.000 | F7: 2013-07-24T00:00:00.000 | G7: 145 | H7: 37 | I7: =RC[-1]/RC[-2] -> 0.25517241379310346 | J7: Montreal | K7: Quebec | L7: Canada | M7: Distributed Computing | N7: Symposium | O7: www.podc.org/podc2013/
A8: Symposium on Principles of Distributed Computing | B8: 2012 | C8: PODC 2012 | D8: PODC | E8: 2012-07-16T00:00:00.000 | F8: 2012-07-18T00:00:00.000 | G8: 142 | H8: 61 | I8: =RC[-1]/RC[-2] -> 0.42957746478873238 | J8: Madeira | L8: Portugal | M8: Distributed Computing | N8: Symposium | O8: www.podc.org/podc2012/
A9: Symposium on Principles of Distributed Computing | B9: 2011 | C9: PODC 2011 | D9: PODC | E9: 2011-06-06T00:00:00.000 | F9: 2011-06-08T00:00:00.000 | G9: 129 | H9: 34 | I9: =RC[-1]/RC[-2] -> 0.26356589147286824 | J9: San Jose | K9: California | L9: USA | M9: Distributed Computing | N9: Symposium | O9: www.podc.org/podc2011/
A10: Symposium on Principles of Distributed Computing | B10: 2010 | C10: PODC 2010 | D10: PODC | E10: 2010-07-25T00:00:00.000 | F10: 2010-10-28T00:00:00.000 | G10: 179 | H10: 39 | I10: =RC[-1]/RC[-2] -> 0.21787709497206703 | J10: Zurich | L10: Switzerland | M10: Distributed Computing | N10: Symposium | O10: www.podc.org/podc2010/
A11: Symposium on Principles of Distributed Computing | B11: 2009 | C11: PODC 2009 | D11: PODC | E11: 2009-08-10T00:00:00.000 | F11: 2009-08-12T00:00:00.000 | G11: 110 | H11: 27 | I11: =RC[-1]/RC[-2] -> 0.24545454545454545 | J11: Calgary | K11: Alberta | L11: Canada | M11: Distributed Computing | N11: Symposium | O11: www.podc.org/podc2009/
A12: Symposium on Principles of Distributed Computing | B12: 2008 | C12: PODC 2008 | D12: PODC | E12: 2008-08-18T00:00:00.000 | F12: 2008-08-21T00:00:00.000 | G12: 187 | H12: 84 | I12: =RC[-1]/RC[-2] -> 0.44919786096256686 | J12: Toronto | K12: Ontario | L12: Canada | M12: Distributed Computing | N12: Symposium | O12: www.podc.org/podc2008/
A13: Symposium on Principles of Distributed Computing | B13: 2007 | C13: PODC 2007 | D13: PODC | E13: 2007-08-12T00:00:00.000 | F13: 2007-08-15T00:00:00.000 | G13: 204 | H13: 32 | I13: =RC[-1]/RC[-2] -> 0.15686274509803921 | J13: Portland | K13: Oregon | L13: USA | M13: Distributed Computing | N13: Symposium | O13: www.podc.org/podc2007/
A14: Symposium on Principles of Distributed Computing | B14: 2006 | C14: PODC 2006 | D14: PODC | E14: 2006-07-23T00:00:00.000 | F14: 2006-07-26T00:00:00.000 | G14: 138 | H14: 33 | I14: =RC[-1]/RC[-2] -> 0.2391304347826087 | J14: Denver | K14: Colorado | L14: USA | M14: Distributed Computing | N14: Symposium | O14: www.podc.org/podc2006/
A15: Symposium on Principles of Distributed Computing | B15: 2005 | C15: PODC 2005 | D15: PODC | E15: 2005-07-17T00:00:00.000 | F15: 2005-07-20T00:00:00.000 | G15: 160 | H15: 22 | I15: =RC[-1]/RC[-2] -> 0.13750000000000001 | J15: Las Vegas | K15: Nevada | L15: USA | M15: Distributed Computing | N15: Symposium | O15: www.podc.org/podc2005/
A16: Symposium on Principles of Distributed Computing | B16: 2004 | C16: PODC 2004 | D16: PODC | E16: 2004-07-25T00:00:00.000 | F16: 2004-07-27T00:00:00.000 | G16: 314 | H16: 75 | I16: =RC[-1]/RC[-2] -> 0.23885350318471338 | J16: St. John's | K16: Newfoundland | L16: Canada | M16: Distributed Computing | N16: Symposium | O16: www.podc.org/podc2004/
A17: Symposium on Principles of Distributed Computing | B17: 2003 | C17: PODC 2003 | D17: PODC | E17: 2003-07-13T00:00:00.000 | F17: 2003-07-16T00:00:00.000 | G17: 226 | H17: 51 | I17: =RC[-1]/RC[-2] -> 0.22566371681415928 | J17: Boston | K17: Massachusetts | L17: USA | M17: Distributed Computing | N17: Symposium | O17: www.podc.org/podc2003/
A18: Symposium on Principles of Distributed Computing | B18: 2002 | C18: PODC 2002 | D18: PODC | E18: 2002-07-21T00:00:00.000 | F18: 2002-07-24T00:00:00.000 | G18: 149 | H18: 43 | I18: =RC[-1]/RC[-2] -> 0.28859060402684567 | J18: Monterey | K18: California | L18: USA | M18: Distributed Computing | N18: Symposium | O18: www.podc.org/podc2002/
A19: Symposium on Principles of Distributed Computing | B19: 2001 | C19: PODC 2001 | D19: PODC | E19: 2001-08-26T00:00:00.000 | F19: 2001-08-29T00:00:00.000 | G19: 118 | H19: 39 | I19: =RC[-1]/RC[-2] -> 0.33050847457627119 | J19: Newport | K19: Rhode Island | L19: USA | M19: Distributed Computing | N19: Symposium | O19: www.podc.org/podc2001/
A20: Symposium on Principles of Distributed Computing | B20: 2000 | C20: PODC 2000 | D20: PODC | E20: 2000-07-16T00:00:00.000 | F20: 2000-07-19T00:00:00.000 | G20: 117 | H20: 32 | I20: =RC[-1]/RC[-2] -> 0.27350427350427353 | J20: Portland | K20: Oregon | L20: USA | M20: Distributed Computing | N20: Symposium | O20: www.podc.org/podc2000/
A21: Symposium on Principles of Distributed Computing | B21: 1999 | C21: PODC 1999 | D21: PODC | E21: 1999-05-03T00:00:00.000 | F21: 1999-05-06T00:00:00.000 | J21: Atlanta | K21: Georgia | L21: USA | M21: Distributed Computing | N21: Symposium | O21: www.podc.org/podc99/
A22: Symposium on Principles of Distributed Computing | B22: 1998 | C22: PODC 1998 | D22: PODC | E22: 1998-06-28T00:00:00.000 | F22: 1998-07-02T00:00:00.000 | J22: Puerto Vallarta | L22: Mexico | M22: Distributed Computing | N22: Symposium | O22: www.podc.org/podc98/
A23: Symposium on Principles of Distributed Computing | B23: 1997 | C23: PODC 1997 | D23: PODC | E23: 1997-08-21T00:00:00.000 | F23: 1997-08-24T00:00:00.000 | G23: 149 | H23: 46 | I23: =RC[-1]/RC[-2] -> 0.3087248322147651 | J23: Santa Barbara | K23: California | L23: USA | M23: Distributed Computing | N23: Symposium | O23: www.podc.org/podc97/
A24: Symposium on Principles of Distributed Computing | B24: 1996 | C24: PODC 1996 | D24: PODC | E24: 1996-05-23T00:00:00.000 | F24: 1996-05-26T00:00:00.000 | G24: 117 | H24: 69 | I24: =RC[-1]/RC[-2] -> 0.58974358974358976 | J24: Philadelphia | L24: USA | M24: Distributed Computing | N24: Symposium | O24: www.podc.org/podc96/
A25: Symposium on Principles of Distributed Computing | B25: 1995 | C25: PODC 1995 | D25: PODC | E25: 1995-08-20T00:00:00.000 | F25: 1995-08-23T00:00:00.000 | G25: 132 | H25: 49 | I25: =RC[-1]/RC[-2] -> 0.37121212121212122 | J25: Ottawa | K25: Ontario | L25: Canada | M25: Distributed Computing | N25: Symposium | O25: www.podc.org/podc95/
A26: Symposium on Principles of Distributed Computing | B26: 1994 | C26: PODC 1994 | D26: PODC | E26: 1994-08-14T00:00:00.000 | F26: 1994-08-18T00:00:00.000 | G26: 133 | H26: 67 | I26: =RC[-1]/RC[-2] -> 0.50375939849624063 | J26: Los Angeles | K26: California | L26: USA | M26: Distributed Computing | N26: Symposium | O26: dblp2.uni-trier.de/db/conf/podc/podc94.html
A27: Symposium on Principles of Distributed Computing | B27: 1993 | C27: PODC 1993 | D27: PODC | E27: 1993-08-15T00:00:00.000 | F27: 1993-08-18T00:00:00.000 | J27: Ithaca | K27: New York | L27: USA | M27: Distributed Computing | N27: Symposium | O27: dblp2.uni-trier.de/db/conf/podc/podc93.html
A28: Symposium on Principles of Distributed Computing | B28: 1992 | C28: PODC 1992 | D28: PODC | E28: 1992-08-10T00:00:00.000 | F28: 1992-08-12T00:00:00.000 | J28: Vancouver | K28: British Columbia | L28: Canada | M28: Distributed Computing | N28: Symposium | O28: dblp2.uni-trier.de/db/conf/podc/podc92.html
A29: Symposium on Principles of Distributed Computing | B29: 1991 | C29: PODC 1991 | D29: PODC | E29: 1991-08-19T00:00:00.000 | F29: 1991-08-21T00:00:00.000 | J29: Montreal | K29: Quebec | L29: Canada | M29: Distributed Computing | N29: Symposium | O29: dblp2.uni-trier.de/db/conf/podc/podc91.html
A30: Symposium on Principles of Distributed Computing | B30: 1990 | C30: PODC 1990 | D30: PODC | E30: 1990-08-22T00:00:00.000 | F30: 1990-08-24T00:00:00.000 | J30: Quebec | K30: Quebec | L30: Canada | M30: Distributed Computing | N30: Symposium | O30: dblp2.uni-trier.de/db/conf/podc/podc90.html
A31: Symposium on Principles of Distributed Computing | B31: 1989 | C31: PODC 1989 | D31: PODC | E31: 1989-08-14T00:00:00.000 | F31: 1989-08-16T00:00:00.000 | J31: Edmonton | K31: Alberta | L31: Canada | M31: Distributed Computing | N31: Symposium | O31: dblp2.uni-trier.de/db/conf/podc/podc89.html
A32: Symposium on Principles of Distributed Computing | B32: 1988 | C32: PODC 1988 | D32: PODC | E32: 1988-08-15T00:00:00.000 | F32: 1988-08-17T00:00:00.000 | J32: Toronto | K32: Ontario | L32: Canada | M32: Distributed Computing | N32: Symposium | O32: dblp2.uni-trier.de/db/conf/podc/podc88.html
A33: Symposium on Principles of Distributed Computing | B33: 1987 | C33: PODC 1987 | D33: PODC | E33: 1987-08-10T00:00:00.000 | F33: 1987-08-12T00:00:00.000 | J33: Vancouver | K33: British Columbia | L33: Canada | M33: Distributed Computing | N33: Symposium | O33: dblp2.uni-trier.de/db/conf/podc/podc87.html
A34: Symposium on Principles of Distributed Computing | B34: 1986 | C34: PODC 1986 | D34: PODC | E34: 1986-08-11T00:00:00.000 | F34: 1986-08-13T00:00:00.000 | J34: Calgary | K34: Alberta | L34: Canada | M34: Distributed Computing | N34: Symposium | O34: dblp2.uni-trier.de/db/conf/podc/podc86.html
A35: Symposium on Principles of Distributed Computing | B35: 1985 | C35: PODC 1985 | D35: PODC | E35: 1985-08-05T00:00:00.000 | F35: 1985-08-07T00:00:00.000 | J35: Minaki | K35: Ontario | L35: Canada | M35: Distributed Computing | N35: Symposium | O35: dblp2.uni-trier.de/db/conf/podc/podc85.html
A36: Symposium on Principles of Distributed Computing | B36: 1984 | C36: PODC 1984 | D36: PODC | E36: 1984-08-27T00:00:00.000 | F36: 1984-08-29T00:00:00.000 | J36: Vancouver | K36: British Columbia | L36: Canada | M36: Distributed Computing | N36: Symposium | O36: dblp2.uni-trier.de/db/conf/podc/podc84.html
A37: Symposium on Principles of Distributed Computing | B37: 1983 | C37: PODC 1983 | D37: PODC | E37: 1983-08-17T00:00:00.000 | F37: 1984-08-19T00:00:00.000 | J37: Montreal | K37: Quebec | L37: Canada | M37: Distributed Computing | N37: Symposium | O37: dblp2.uni-trier.de/db/conf/podc/podc83.html
A38: Symposium on Principles of Distributed Computing | B38: 1982 | C38: PODC 1982 | D38: PODC | E38: 1982-08-18T00:00:00.000 | F38: 1982-08-20T00:00:00.000 | J38: Ottawa | K38: Ontario | L38: Canada | M38: Distributed Computing | N38: Symposium | O38: dblp2.uni-trier.de/db/conf/podc/podc82.html

Sheet: VLDB
A1: Title | B1: Event[Start date] | C1: Event[Acronym] | D1: Event[Series] | E1: Event[Start date] | F1: Event[End date] | G1: Event[Submitted papers] | H1: Event[Accepted papers] | I1: Event[Submission Rate] | J1: Event[City] | K1: Event[State] | L1: Event[Country] | M1: Event[Field] | N1: Event[Type] | O1: Event[Homepage]
A2: International Conference on Very Large Databases | B2: 2018 | C2: VLDB 2018 | D2: VLDB | E2: 2018-08-27T00:00:00.000 | F2: 2018-08-31T00:00:00.000 | J2: Rio De Janiero | L2: Brazil | M2: Database | N2: Conference | O2: http://vldb2018.lncc.br/
A3: International Conference on Very Large Databases | B3: 2017 | C3: VLDB 2017 | D3: VLDB | E3: 2017-08-28T00:00:00.000 | F3: 2017-09-01T00:00:00.000 | G3: =RC[1]/RC[2] -> 559.13978494623655 | H3: 104 | I3: 0.186 | J3: Munich | L3: Germany | M3: Database | N3: Conference | O3: www.vldb.org/2017/
A4: International Conference on Very Large Databases | B4: 2016 | C4: VLDB 2016 | D4: VLDB | E4: 2016-09-05T00:00:00.000 | F4: 2016-09-09T00:00:00.000 | G4: 527 | H4: 187 | I4: =RC[-1]/RC[-2] -> 0.35483870967741937 | J4: New Delhi | L4: India | M4: Database | N4: Conference | O4: vldb2016.persistent.com/
A5: International Conference on Very Large Databases | B5: 2015 | C5: VLDB 2015 | D5: VLDB | E5: 2015-08-31T00:00:00.000 | F5: 2015-09-04T00:00:00.000 | G5: 710 | H5: 151 | I5: =RC[-1]/RC[-2] -> 0.21267605633802816 | J5: Kohala Coast | K5: Hawaii | L5: USA | M5: Database | N5: Conference | O5: www.vldb.org/2015/
A6: International Conference on Very Large Databases | B6: 2014 | C6: VLDB 2014 | D6: VLDB | E6: 2014-09-01T00:00:00.000 | F6: 2014-09-05T00:00:00.000 | G6: 1305 | H6: 261 | I6: =RC[-1]/RC[-2] -> 0.2 | J6: Hangzhou | L6: China | M6: Database | N6: Conference | O6: www.vldb.org/2014/
A7: International Conference on Very Large Databases | B7: 2013 | C7: VLDB 2013 | D7: VLDB | E7: 2013-08-26T00:00:00.000 | F7: 2013-08-30T00:00:00.000 | G7: 559 | H7: 127 | I7: =RC[-1]/RC[-2] -> 0.22719141323792486 | J7: Riva del Garda | K7: Trento | L7: Italy | M7: Database | N7: Conference | O7: www.vldb.org/2013/
A8: International Conference on Very Large Databases | B8: 2012 | C8: VLDB 2012 | D8: VLDB | E8: 2012-08-27T00:00:00.000 | F8: 2012-08-31T00:00:00.000 | G8: 659 | H8: 134 | I8: =RC[-1]/RC[-2] -> 0.20333839150227617 | J8: Istanbul | L8: Turkey | M8: Database | N8: Conference | O8: www.vldb.org/archives/website/2012/
A9: International Conference on Very Large Databases | B9: 2011 | C9: VLDB 2011 | D9: VLDB | E9: 2011-08-29T00:00:00.000 | F9: 2011-09-03T00:00:00.000 | G9: 553 | H9: 100 | I9: =RC[-1]/RC[-2] -> 0.18083182640144665 | J9: Seattle | K9: Washington | L9: USA | M9: Database | N9: Conference | O9: www.vldb.org/2011/
A10: International Conference on Very Large Databases | B10: 2010 | C10: VLDB 2010 | D10: VLDB | E10: 2010-09-13T00:00:00.000 | F10: 2010-09-17T00:00:00.000 | G10: 478 | H10: 84 | I10: =RC[-1]/RC[-2] -> 0.17573221757322174 | J10: Singapore | L10: Singapore | M10: Database | N10: Conference | O10: vldb2010.org/
A11: International Conference on Very Large Databases | B11: 2009 | C11: VLDB 2009 | D11: VLDB | E11: 2009-08-24T00:00:00.000 | F11: 2009-08-28T00:00:00.000 | G11: 562 | H11: 97 | I11: =RC[-1]/RC[-2] -> 0.17259786476868327 | J11: Lyon | L11: France | M11: Database | N11: Conference | O11: vldb2009.org/
A12: International Conference on Very Large Databases | B12: 2008 | C12: VLDB 2008 | D12: VLDB | E12: 2008-08-24T00:00:00.000 | F12: 2008-08-30T00:00:00.000 | G12: 567 | H12: 95 | I12: =RC[-1]/RC[-2] -> 0.16754850088183421 | J12: Auckland | L12: New Zealand | M12: Database | N12: Conference | O12: www.vldb.org/archives/website/2008/
A13: International Conference on Very Large Databases | B13: 2007 | C13: VLDB 2007 | D13: VLDB | E13: 2007-09-23T00:00:00.000 | F13: 2007-09-27T00:00:00.000 | G13: 538 | H13: 91 | I13: =RC[-1]/RC[-2] -> 0.16914498141263939 | J13: Vienna | L13: Austria | M13: Database | N13: Conference | O13: www.vldb.org/archives/website/2007/
A14: International Conference on Very Large Databases | B14: 2006 | C14: VLDB 2006 | D14: VLDB | E14: 2006-09-12T00:00:00.000 | F14: 2006-09-15T00:00:00.000 | G14: 626 | H14: 83 | I14: =RC[-1]/RC[-2] -> 0.13258785942492013 | J14: Seoul | L14: Korea | M14: Database | N14: Conference | O14: www.vldb.org/archives/website/2006/
A15: International Conference on Very Large Databases | B15: 2005 | C15: VLDB 2005 | D15: VLDB | E15: 2005-08-30T00:00:00.000 | F15: 2005-09-02T00:00:00.000 | G15: 517 | H15: 85 | I15: =RC[-1]/RC[-2] -> 0.16441005802707931 | J15: Trondheim | L15: Norway | M15: Database | N15: Conference | O15: www.vldb.org/archives/website/2005/
A16: International Conference on Very Large Databases | B16: 2004 | C16: VLDB 2004 | D16: VLDB | E16: 2004-08-31T00:00:00.000 | F16: 2004-09-03T00:00:00.000 | G16: 504 | H16: 98 | I16: =RC[-1]/RC[-2] -> 0.19444444444444445 | J16: Toronto | K16: Ontario | L16: Canada | M16: Database | N16: Conference | O16: www.vldb.org/archives/website/2004/
A17: International Conference on Very Large Databases | B17: 2003 | C17: VLDB 2003 | D17: VLDB | E17: 2003-09-09T00:00:00.000 | F17: 2003-09-12T00:00:00.000 | G17: 457 | H17: 84 | I17: =RC[-1]/RC[-2] -> 0.1838074398249453 | J17: Berlin | L17: Germany | M17: Database | N17: Conference | O17: www.vldb.org/archives/website/2003/
A18: International Conference on Very Large Databases | B18: 2002 | C18: VLDB 2002 | D18: VLDB | E18: 2002-08-20T00:00:00.000 | F18: 2002-08-23T00:00:00.000 | G18: 468 | H18: 84 | I18: =RC[-1]/RC[-2] -> 0.17948717948717949 | J18: Hong Kong | L18: China | M18: Database | N18: Conference | O18: www.vldb.org/archives/website/2002/
A19: International Conference on Very Large Databases | B19: 2001 | C19: VLDB 2001 | D19: VLDB | E19: 2001-09-11T00:00:00.000 | F19: 2001-09-14T00:00:00.000 | G19: 339 | H19: 59 | I19: =RC[-1]/RC[-2] -> 0.17404129793510326 | J19: Roma | L19: Italy | M19: Database | N19: Conference | O19: www.vldb.org/archives/website/2001/
A20: International Conference on Very Large Databases | B20: 2000 | C20: VLDB 2000 | D20: VLDB | E20: 2000-09-10T00:00:00.000 | F20: 2000-09-14T00:00:00.000 | G20: 351 | H20: 53 | I20: =RC[-1]/RC[-2] -> 0.150997150997151 | J20: Cairo | L20: Egypt | M20: Database | N20: Conference | O20: www.vldb.org/archives/website/2000/
A21: International Conference on Very Large Databases | B21: 1999 | C21: VLDB 1999 | D21: VLDB | E21: 1999-09-07T00:00:00.000 | F21: 1999-09-10T00:00:00.000 | G21: 390 | H21: 57 | I21: =RC[-1]/RC[-2] -> 0.14615384615384616 | J21: Edinburgh | L21: Scotland | M21: Database | N21: Conference | O21: www.vldb.org/archives/website/1999/
A22: International Conference on Very Large Databases | B22: 1998 | C22: VLDB 1998 | D22: VLDB | E22: 1998-08-24T00:00:00.000 | F22: 1998-08-27T00:00:00.000 | G22: 327 | H22: 52 | I22: =RC[-1]/RC[-2] -> 0.15902140672782875 | J22: New York | L22: USA | M22: Database | N22: Conference | O22: www.vldb.org/archives/website/1998/
A23: International Conference on Very Large Databases | B23: 1997 | C23: VLDB 1997 | D23: VLDB | E23: 1997-08-25T00:00:00.000 | F23: 1997-08-29T00:00:00.000 | G23: 335 | H23: 51 | I23: =RC[-1]/RC[-2] -> 0.15223880597014924 | J23: Athens | L23: Greece | M23: Database | N23: Conference | O23: www.vldb.org/archives/website/1997/
A24: International Conference on Very Large Databases | B24: 1996 | C24: VLDB 1996 | D24: VLDB | E24: 1996-09-03T00:00:00.000 | F24: 1996-09-06T00:00:00.000 | G24: 340 | H24: 48 | I24: =RC[-1]/RC[-2] -> 0.14117647058823529 | J24: Bombay | L24: India | M24: Database | N24: Conference | O24: www.vldb.org/archives/website/1996/
A25: International Conference on Very Large Databases | B25: 1995 | C25: VLDB 1995 | D25: VLDB | E25: 1995-09-11T00:00:00.000 | F25: 1995-09-15T00:00:00.000 | G25: 297 | H25: 52 | I25: =RC[-1]/RC[-2] -> 0.17508417508417509 | J25: Zurich | L25: Switzerland | M25: Database | N25: Conference | O25: www.vldb.org/archives/website/1995/
A26: International Conference on Very Large Databases | B26: 1994 | C26: VLDB 1994 | D26: VLDB | E26: 1994-09-12T00:00:00.000 | F26: 1994-09-15T00:00:00.000 | G26: 293 | H26: 54 | I26: =RC[-1]/RC[-2] -> 0.18430034129692832 | J26: Santiago de Chile | L26: Chile | M26: Database | N26: Conference | O26: http://dblp.uni-trier.de/db/conf/vldb/vldb94.html
A27: International Conference on Very Large Databases | B27: 1993 | C27: VLDB 1993 | D27: VLDB | E27: 1993-08-24T00:00:00.000 | F27: 1993-08-27T00:00:00.000 | G27: 311 | H27: 54 | I27: =RC[-1]/RC[-2] -> 0.17363344051446947 | J27: Dublin | L27: Ireland | M27: Database | N27: Conference | O27: dblp.uni-trier.de/db/conf/vldb/vldb93.html
A28: International Conference on Very Large Databases | B28: 1992 | C28: VLDB 1992 | D28: VLDB | E28: 1992-08-23T00:00:00.000 | F28: 1992-08-27T00:00:00.000 | J28: Vancouver | K28: British Columbia | L28: Canada | M28: Database | N28: Conference | O28: dblp.uni-trier.de/db/conf/vldb/vldb92.html
A29: International Conference on Very Large Databases | B29: 1991 | C29: VLDB 1991 | D29: VLDB | E29: 1991-09-03T00:00:00.000 | F29: 1991-09-06T00:00:00.000 | J29: Barcelona | K29: Catalonia | L29: Spain | M29: Database | N29: Conference | O29: dblp.uni-trier.de/db/conf/vldb/vldb91.html
A30: International Conference on Very Large Databases | B30: 1990 | C30: VLDB 1990 | D30: VLDB | E30: 1990-08-13T00:00:00.000 | F30: 1990-08-16T00:00:00.000 | J30: Brisbane | K30: Queensland | L30: Australia | M30: Database | N30: Conference | O30: dblp.uni-trier.de/db/conf/vldb/vldb90.html
A31: International Conference on Very Large Databases | B31: 1989 | C31: VLDB 1989 | D31: VLDB | E31: 1989-08-22T00:00:00.000 | F31: 1989-08-25T00:00:00.000 | J31: Amsterdam | L31: The Netherlands | M31: Database | N31: Conference | O31: dblp.uni-trier.de/db/conf/vldb/vldb89.html
A32: International Conference on Very Large Databases | B32: 1988 | C32: VLDB 1988 | D32: VLDB | E32: 1988-08-29T00:00:00.000 | F32: 1988-09-01T00:00:00.000 | J32: Los Angeles | K32: California | L32: USA | M32: Database | N32: Conference | O32: dblp.uni-trier.de/db/conf/vldb/vldb88.html
A33: International Conference on Very Large Databases | B33: 1987 | C33: VLDB 1987 | D33: VLDB | E33: 1987-09-01T00:00:00.000 | F33: 1987-09-04T00:00:00.000 | J33: Brighton | L33: England | M33: Database | N33: Conference | O33: dblp.uni-trier.de/db/conf/vldb/vldb87.html
A34: International Conference on Very Large Databases | B34: 1986 | C34: VLDB 1986 | D34: VLDB | E34: 1986-08-25T00:00:00.000 | F34: 1986-08-28T00:00:00.000 | J34: Kyoto | L34: Japan | M34: Database | N34: Conference | O34: dblp.uni-trier.de/db/conf/vldb/vldb86.html
A35: International Conference on Very Large Databases | B35: 1985 | C35: VLDB 1985 | D35: VLDB | E35: 1985-08-21T00:00:00.000 | F35: 1985-08-23T00:00:00.000 | J35: Stockholm | L35: Sweden | M35: Database | N35: Conference | O35: dblp.uni-trier.de/db/conf/vldb/vldb85.html

Sheet: RecSys
A1: Title | B1: Event[Start date] | C1: Event[Acronym] | D1: Event[Series] | E1: Event[Start date] | F1: Event[End date] | G1: Event[Submitted papers] | H1: Event[Accepted papers] | I1: Event[Submission Rate] | J1: Event[City] | K1: Event[State] | L1: Event[Country] | M1: Event[Field] | N1: Event[Type] | O1: Event[Homepage]
A2: 12th Conference on Recommender Systems | B2: 2018 | C2: RecSys 2018 | D2: RecSys | E2: 2018-10-02T00:00:00.000 | F2: 2018-10-07T00:00:00.000 | J2: Vancouver | L2: Canada | M2: Recommender Systems | N2: Conference | O2: recsys.acm.org/recsys18/
A3: 11th Conference on Recommender Systems | B3: 2017 | C3: RecSys 2017 | D3: RecSys | E3: 2017-08-27T00:00:00.000 | F3: 2017-08-30T00:00:00.000 | G3: 125 | H3: 26 | I3: =RC[-1]/RC[-2] -> 0.20799999999999999 | J3: Como | L3: Italy | M3: Recommender Systems | N3: Conference | O3: recsys.acm.org/recsys17/
A4: 10th Conference on Recommender Systems | B4: 2016 | C4: RecSys 2016 | D4: RecSys | E4: 2016-09-15T00:00:00.000 | F4: 2016-09-19T00:00:00.000 | G4: 159 | H4: 29 | I4: =RC[-1]/RC[-2] -> 0.18238993710691823 | J4: Boston | L4: USA | M4: Recommender Systems | N4: Conference | O4: recsys.acm.org/recsys16/
A5: 9th Conference on Recommender Systems | B5: 2015 | C5: RecSys 2015 | D5: RecSys | E5: 2015-09-16T00:00:00.000 | F5: 2015-09-20T00:00:00.000 | G5: 131 | H5: 28 | I5: =RC[-1]/RC[-2] -> 0.21374045801526717 | J5: Vienna | L5: Austria | M5: Recommender Systems | N5: Conference | O5: recsys.acm.org/recsys15/
A6: 8th Conference on Recommender Systems | B6: 2014 | C6: RecSys 2014 | D6: RecSys | E6: 2014-10-06T00:00:00.000 | F6: 2014-10-10T00:00:00.000 | G6: 152 | H6: 35 | I6: =RC[-1]/RC[-2] -> 0.23026315789473684 | J6: Foster | K6: California | L6: USA | M6: Recommender Systems | N6: Conference | O6: recsys.acm.org/recsys14/
A7: 7th Conference on Recommender Systems | B7: 2013 | C7: RecSys 2013 | D7: RecSys | E7: 2013-10-12T00:00:00.000 | F7: 2013-10-16T00:00:00.000 | G7: 136 | H7: 32 | I7: =RC[-1]/RC[-2] -> 0.23529411764705882 | J7: Hong Kong | L7: China | M7: Recommender Systems | N7: Conference | O7: recsys.acm.org/recsys13/
A8: 6th Conference on Recommender Systems | B8: 2012 | C8: RecSys 2012 | D8: RecSys | E8: 2012-09-09T00:00:00.000 | F8: 2012-09-13T00:00:00.000 | G8: 119 | H8: 24 | I8: =RC[-1]/RC[-2] -> 0.20168067226890757 | J8: Dublin | L8: Ireland | M8: Recommender Systems | N8: Conference | O8: recsys.acm.org/recsys12/
A9: 5th Conference on Recommender Systems | B9: 2011 | C9: RecSys 2011 | D9: RecSys | E9: 2011-10-23T00:00:00.000 | F9: 2011-10-27T00:00:00.000 | G9: 110 | H9: 22 | I9: =RC[-1]/RC[-2] -> 0.2 | J9: Chicago | L9: USA | M9: Recommender Systems | N9: Conference | O9: recsys.acm.org/recsys11/
A10: 4th Conference on Recommender Systems | B10: 2010 | C10: RecSys 2010 | D10: RecSys | E10: 2010-09-26T00:00:00.000 | F10: 2010-09-30T00:00:00.000 | G10: 129 | H10: 25 | I10: =RC[-1]/RC[-2] -> 0.19379844961240311 | J10: Barcelona | L10: Spain | M10: Recommender Systems | N10: Conference | O10: recsys.acm.org/recsys10/
A11: 3rd Conference on Recommender Systems | B11: 2009 | C11: RecSys 2009 | D11: RecSys | E11: 2009-10-23T00:00:00.000 | F11: 2009-10-25T00:00:00.000 | G11: 187 | H11: 80 | I11: =RC[-1]/RC[-2] -> 0.42780748663101603 | J11: New York | K11: New York | L11: USA | M11: Recommender Systems | N11: Conference | O11: recsys.acm.org/recsys09/
A12: 2nd Conference on Recommender Systems | B12: 2008 | C12: RecSys 2008 | D12: RecSys | E12: 2008-10-23T00:00:00.000 | F12: 2008-10-25T00:00:00.000 | G12: 121 | H12: 38 | I12: =RC[-1]/RC[-2] -> 0.31404958677685951 | J12: Lausanne | L12: Switzerland | M12: Recommender Systems | N12: Conference | O12: recsys.acm.org/recsys08/
A13: 1st Conference on Recommender Systems | B13: 2007 | C13: RecSys 2007 | D13: RecSys | E13: 2007-10-19T00:00:00.000 | F13: 2007-10-20T00:00:00.000 | G13: 35 | H13: 16 | I13: =RC[-1]/RC[-2] -> 0.45714285714285713 | J13: Minneapolis | L13: USA | M13: Recommender Systems | N13: Conference | O13: recsys.acm.org/recsys07/

Sheet: EDBT
A1: Title | B1: Event[Start date] | C1: Event[Acronym] | D1: Event[Series] | E1: Event[Start date] | F1: Event[End date] | G1: Event[Submitted papers] | H1: Event[Accepted papers] | I1: Event[Acceptance Rate] | J1: Event[City] | K1: Event[State] | L1: Event[Country] | M1: Event[Field] | N1: Event[Type] | O1: Event[Homepage]
A2: 21th International Conference on Extending Database Technology | B2: 2018 | C2: EDBT 2018 | D2: EDBT | E2: 2018-03-26T00:00:00.000 | F2: 2018-03-29T00:00:00.000 | J2: Vienna | L2: Austria | M2: Databases | N2: Conference | O2: edbticdt2018.at/
A3: 20th International Conference on Extending Database Technology | B3: 2017 | C3: EDBT 2017 | D3: EDBT | E3: 2017-03-21T00:00:00.000 | F3: 2017-03-24T00:00:00.000 | G3: 168 | H3: 37 | I3: =RC[-1]/RC[-2] -> 0.22023809523809523 | J3: Venice | L3: Italy | M3: Databases | N3: Conference | O3: edbticdt2017.unive.it/
A4: 19th International Conference on Extending Database Technology | B4: 2016 | C4: EDBT 2016 | D4: EDBT | E4: 2016-03-15T00:00:00.000 | F4: 2016-03-16T00:00:00.000 | G4: 282 | H4: 102 | I4: =RC[-1]/RC[-2] -> 0.36170212765957449 | J4: Bordeaux | L4: France | M4: Databases | N4: Conference | O4: edbticdt2016.labri.fr/
A5: 18th International Conference on Extending Database Technology | B5: 2015 | C5: EDBT 2015 | D5: EDBT | E5: 2015-03-23T00:00:00.000 | F5: 2015-03-27T00:00:00.000 | G5: 228 | H5: 74 | I5: =RC[-1]/RC[-2] -> 0.32456140350877194 | J5: Brussels | L5: Belgium | M5: Databases | N5: Conference
A6: 17th International Conference on Extending Database Technology | B6: 2014 | C6: EDBT 2014 | D6: EDBT | E6: 2014-03-24T00:00:00.000 | F6: 2014-03-28T00:00:00.000 | G6: 266 | H6: 52 | I6: =RC[-1]/RC[-2] -> 0.19548872180451127 | J6: Athens | L6: Greece | M6: Databases | N6: Conference | O6: www.edbticdt2014.gr/
A7: 16th International Conference on Extending Database Technology | B7: 2013 | C7: EDBT 2013 | D7: EDBT | E7: 2013-03-18T00:00:00.000 | F7: 2013-03-22T00:00:00.000 | G7: 235 | H7: 48 | I7: =RC[-1]/RC[-2] -> 0.20425531914893616 | J7: Genoa | L7: Italy | M7: Databases | N7: Conference | O7: edbticdt2013.disi.unige.it/
A8: 15th International Conference on Extending Database Technology | B8: 2012 | C8: EDBT 2012 | D8: EDBT | E8: 2012-03-27T00:00:00.000 | F8: 2012-03-30T00:00:00.000 | G8: 193 | H8: 43 | I8: =RC[-1]/RC[-2] -> 0.22279792746113988 | J8: Berlin | L8: Germany | M8: Databases | N8: Conference | O8: edbticdt2012.dima.tu-berlin.de/
A9: 14th International Conference on Extending Database Technology | B9: 2011 | C9: EDBT 2011 | D9: EDBT | E9: 2011-03-21T00:00:00.000 | F9: 2011-03-24T00:00:00.000 | G9: 148 | H9: 41 | I9: =RC[-1]/RC[-2] -> 0.27702702702702703 | J9: Uppsala | L9: Sweden | M9: Databases | N9: Conference | O9: edbticdt2011.it.uu.se/
A10: 13th International Conference on Extending Database Technology | B10: 2010 | C10: EDBT 2010 | D10: EDBT | E10: 2010-03-22T00:00:00.000 | F10: 2010-03-26T00:00:00.000 | G10: 307 | H10: 54 | I10: =RC[-1]/RC[-2] -> 0.1758957654723127 | J10: Lausanne | L10: Switzerland | M10: Databases | N10: Conference
A11: 12th International Conference on Extending Database Technology | B11: 2009 | C11: EDBT 2009 | D11: EDBT | E11: 2009-03-24T00:00:00.000 | F11: 2009-03-26T00:00:00.000 | G11: 447 | H11: 110 | I11: =RC[-1]/RC[-2] -> 0.24608501118568232 | J11: Saint-Petersburg | L11: Russia | M11: Databases | N11: Conference | O11: www.math.spbu.ru/edbticdt/index.html
A12: 11th International Conference on Extending Database Technology | B12: 2008 | C12: EDBT 2008 | D12: EDBT | E12: 2008-03-25T00:00:00.000 | F12: 2008-03-29T00:00:00.000 | G12: 327 | H12: 59 | I12: =RC[-1]/RC[-2] -> 0.18042813455657492 | J12: Nantes | L12: France | M12: Databases | N12: Conference | O12: dblp.uni-trier.de/db/conf/edbt/edbt2008.html
A13: 10th International Conference on Extending Database Technology | B13: 2006 | C13: EDBT 2006 | D13: EDBT | E13: 2006-03-26T00:00:00.000 | F13: 2006-03-31T00:00:00.000 | G13: 352 | H13: 60 | I13: =RC[-1]/RC[-2] -> 0.17045454545454544 | J13: Munich | L13: Germany | M13: Databases | N13: Conference | O13: dblp.uni-trier.de/db/conf/edbt/edbt2006.html
A14: 9th International Conference on Extending Database Technology | B14: 2004 | C14: EDBT 2004 | D14: EDBT | E14: 2004-03-14T00:00:00.000 | F14: 2004-03-18T00:00:00.000 | G14: 294 | H14: 42 | I14: =RC[-1]/RC[-2] -> 0.14285714285714285 | J14: Heraklion | L14: Greece | M14: Databases | N14: Conference | O14: dblp.uni-trier.de/db/conf/edbt/edbt2004.html
A15: 8th International Conference on Extending Database Technology | B15: 2002 | C15: EDBT 2002 | D15: EDBT | E15: 2002-03-25T00:00:00.000 | F15: 2002-03-27T00:00:00.000 | G15: 207 | H15: 36 | I15: =RC[-1]/RC[-2] -> 0.17391304347826086 | J15: Prague | L15: Czech Republic | M15: Databases | N15: Conference | O15: dblp.uni-trier.de/db/conf/edbt/edbt2002.html
A16: 7th International Conference on Extending Database Technology | B16: 2000 | C16: EDBT 2000 | D16: EDBT | E16: 2000-03-27T00:00:00.000 | F16: 2000-03-31T00:00:00.000 | G16: 187 | H16: 30 | I16: =RC[-1]/RC[-2] -> 0.16042780748663102 | J16: Konstanz | L16: Germany | M16: Databases | N16: Conference | O16: www.edbt.org/conf/edbt/2000/welcome.php.html
A17: 6th International Conference on Extending Database Technology | B17: 1998 | C17: EDBT 1998 | D17: EDBT | E17: 1998-03-23T00:00:00.000 | F17: 1998-03-27T00:00:00.000 | G17: 191 | H17: 32 | I17: =RC[-1]/RC[-2] -> 0.16753926701570682 | J17: Valencia | L17: Spain | M17: Databases | N17: Conference | O17: dblp.uni-trier.de/db/conf/edbt/edbt98.html
A18: 5th International Conference on Extending Database Technology | B18: 1996 | C18: EDBT 1996 | D18: EDBT | E18: 1996-03-25T00:00:00.000 | F18: 1996-03-29T00:00:00.000 | G18: 178 | H18: 31 | I18: =RC[-1]/RC[-2] -> 0.17415730337078653 | J18: Avignon | L18: France | M18: Databases | N18: Conference | O18: dblp.uni-trier.de/db/conf/edbt/edbt96.html
A19: 4th International Conference on Extending Database Technology | B19: 1994 | C19: EDBT 1994 | D19: EDBT | E19: 1994-03-28T00:00:00.000 | F19: 1994-03-31T00:00:00.000 | G19: 180 | H19: 31 | I19: =RC[-1]/RC[-2] -> 0.17222222222222222 | J19: Cambridge | L19: UK | M19: Databases | N19: Conference | O19: dblp.uni-trier.de/db/conf/edbt/edbt94.html
A20: 3rd International Conference on Extending Database Technology | B20: 1992 | C20: EDBT 1992 | D20: EDBT | E20: 1992-03-23T00:00:00.000 | F20: 1992-03-27T00:00:00.000 | G20: 220 | H20: 33 | I20: =RC[-1]/RC[-2] -> 0.15 | J20: Vienna | L20: Austria | M20: Databases | N20: Conference | O20: dblp.uni-trier.de/db/conf/edbt/edbt92.html
A21: 2nd International Conference on Extending Database Technology | B21: 1990 | C21: EDBT 1990 | D21: EDBT | E21: 1990-03-26T00:00:00.000 | F21: 1990-03-30T00:00:00.000 | G21: 178 | H21: 27 | I21: =RC[-1]/RC[-2] -> 0.15168539325842698 | J21: Venice | L21: Italy | M21: Databases | N21: Conference | O21: dblp.uni-trier.de/db/conf/edbt/edbt90.html
A22: 1st International Conference on Extending Database Technology | B22: 1988 | C22: EDBT 1988 | D22: EDBT | E22: 1988-03-14T00:00:00.000 | F22: 1988-03-18T00:00:00.000 | H22: 29 | J22: Venice | L22: Italy | M22: Databases | N22: Conference | O22: dblp.uni-trier.de/db/conf/edbt/edbt88.html

Sheet: DSN
A1: Title | B1: Event[Start date] | C1: Event[Acronym] | D1: Event[Series] | E1: Event[Start date] | F1: Event[End date] | G1: Event[Submitted papers] | H1: Event[Accepted papers] | I1: Event[Submission Rate] | J1: Event[City] | K1: Event[State] | L1: Event[Country] | M1: Event[Field] | N1: Event[Type] | O1: Event[Homepage]
A2: International Conference on Dependable Systems and Networks | B2: 2018 | C2: DSN 2018 | D2: DSN | E2: 2018-06-25T00:00:00.000 | F2: 2018-06-28T00:00:00.000 | J2: Luxembourg | L2: Luxembourg | M2: Dependable Systems | N2: Conference | O2: dsn2018.uni.lu/
A3: International Conference on Dependable Systems and Networks | B3: 2017 | C3: DSN 2017 | D3: DSN | E3: 2017-06-26T00:00:00.000 | F3: 2017-06-29T00:00:00.000 | G3: 220 | H3: 54 | I3: =RC[-1]/RC[-2] -> 0.24545454545454545 | J3: Denver | L3: USA | M3: Dependable Systems | N3: Conference | O3: http://dsn2017.github.io/
A4: International Conference on Dependable Systems and Networks | B4: 2016 | C4: DSN 2016 | D4: DSN | E4: 2016-06-28T00:00:00.000 | F4: 2016-07-01T00:00:00.000 | G4: 259 | H4: 58 | I4: =RC[-1]/RC[-2] -> 0.22393822393822393 | J4: Toulouse | L4: France | M4: Dependable Systems | N4: Conference | O4: https://dsn-2016.sciencesconf.org/
A5: International Conference on Dependable Systems and Networks | B5: 2015 | C5: DSN 2015 | D5: DSN | E5: 2015-06-22T00:00:00.000 | F5: 2015-06-25T00:00:00.000 | G5: 227 | H5: 50 | I5: =RC[-1]/RC[-2] -> 0.22026431718061673 | J5: Rio de Janeiro | L5: Brazil | M5: Dependable Systems | N5: Conference | O5: http://2015.dsn.org/
A6: International Conference on Dependable Systems and Networks | B6: 2014 | C6: DSN 2014 | D6: DSN | E6: 2014-06-23T00:00:00.000 | F6: 2014-06-26T00:00:00.000 | G6: 185 | H6: 56 | I6: =RC[-1]/RC[-2] -> 0.30270270270270272 | J6: Atlanta | L6: USA | M6: Dependable Systems | N6: Conference | O6: http://dsn2014.ece.gatech.edu/
A7: International Conference on Dependable Systems and Networks | B7: 2013 | C7: DSN 2013 | D7: DSN | E7: 2013-06-24T00:00:00.000 | F7: 2013-06-27T00:00:00.000 | G7: 107 | H7: 21 | I7: =RC[-1]/RC[-2] -> 0.19626168224299065 | J7: Budapest | L7: Hungary | M7: Dependable Systems | N7: Conference | O7: http://2013.dsn.org/
A8: International Conference on Dependable Systems and Networks | B8: 2012 | C8: DSN 2012 | D8: DSN | E8: 2012-06-25T00:00:00.000 | F8: 2012-06-28T00:00:00.000 | G8: 236 | H8: 51 | I8: =RC[-1]/RC[-2] -> 0.21610169491525424 | J8: Boston | L8: USA | M8: Dependable Systems | N8: Conference | O8: http://2012.dsn.org/
A9: International Conference on Dependable Systems and Networks | B9: 2011 | C9: DSN 2011 | D9: DSN | E9: 2011-06-27T00:00:00.000 | F9: 2011-06-30T00:00:00.000 | G9: 148 | H9: 26 | I9: =RC[-1]/RC[-2] -> 0.17567567567567569 | J9: Hong Kong | L9: China | M9: Dependable Systems | N9: Conference | O9: http://2011.dsn.org/
A10: International Conference on Dependable Systems and Networks | B10: 2010 | C10: DSN 2010 | D10: DSN | E10: 2010-06-28T00:00:00.000 | F10: 2010-07-01T00:00:00.000 | G10: 174 | H10: 40 | I10: =RC[-1]/RC[-2] -> 0.22988505747126436 | J10: Chicago | L10: USA | M10: Dependable Systems | N10: Conference | O10: http://2010.dsn.org/
A11: International Conference on Dependable Systems and Networks | B11: 2009 | C11: DSN 2009 | D11: DSN | E11: 2009-06-29T00:00:00.000 | F11: 2009-07-02T00:00:00.000 | G11: 260 | H11: 63 | I11: =RC[-1]/RC[-2] -> 0.24230769230769231 | J11: Estoril/Lisbon | L11: Portugal | M11: Dependable Systems | N11: Conference | O11: http://2009.dsn.org/
A12: International Conference on Dependable Systems and Networks | B12: 2008 | C12: DSN 2008 | D12: DSN | E12: 2008-06-24T00:00:00.000 | F12: 2008-06-27T00:00:00.000 | G12: 174 | H12: 40 | I12: =RC[-1]/RC[-2] -> 0.22988505747126436 | J12: Anchorage | L12: USA | M12: Dependable Systems | N12: Conference | O12: http://2008.dsn.org/
A13: International Conference on Dependable Systems and Networks | B13: 2007 | C13: DSN 2007 | D13: DSN | E13: 2007-06-25T00:00:00.000 | F13: 2007-06-28T00:00:00.000 | G13: 212 | H13: 48 | I13: =RC[-1]/RC[-2] -> 0.22641509433962265 | J13: Edinburgh | L13: UK | M13: Dependable Systems | N13: Conference | O13: http://2007.dsn.org/
A14: International Conference on Dependable Systems and Networks | B14: 2006 | C14: DSN 2006 | D14: DSN | E14: 2006-06-25T00:00:00.000 | F14: 2006-06-28T00:00:00.000 | G14: 187 | H14: 34 | I14: =RC[-1]/RC[-2] -> 0.18181818181818182 | J14: Philadelphia | L14: USA | M14: Dependable Systems | N14: Conference | O14: http://2006.dsn.org/
A15: International Conference on Dependable Systems and Networks | B15: 2005 | C15: DSN 2005 | D15: DSN | E15: 2005-06-28T00:00:00.000 | F15: 2005-07-01T00:00:00.000 | G15: 319 | H15: 78 | I15: =RC[-1]/RC[-2] -> 0.2445141065830721 | J15: Yokohama | L15: Japan | M15: Dependable Systems | N15: Conference | O15: http://2005.dsn.org/
A16: International Conference on Dependable Systems and Networks | B16: 2004 | C16: DSN 2004 | D16: DSN | E16: 2004-06-28T00:00:00.000 | F16: 2004-07-01T00:00:00.000 | G16: 377 | H16: 83 | I16: =RC[-1]/RC[-2] -> 0.22015915119363394 | J16: Florence | L16: Italy | M16: Dependable Systems | N16: Conference | O16: http://2004.dsn.org/
A17: International Conference on Dependable Systems and Networks | B17: 2003 | C17: DSN 2003 | D17: DSN | E17: 2003-06-22T00:00:00.000 | F17: 2003-06-25T00:00:00.000 | G17: 225 | H17: 80 | I17: =RC[-1]/RC[-2] -> 0.35555555555555557 | J17: San Francisco | L17: USA | M17: Dependable Systems | N17: Conference | O17: http://2003.dsn.org/
A18: International Conference on Dependable Systems and Networks | B18: 2002 | C18: DSN 2002 | D18: DSN | E18: 2002-06-23T00:00:00.000 | F18: 2002-06-26T00:00:00.000 | G18: 213 | H18: 91 | I18: =RC[-1]/RC[-2] -> 0.42723004694835681 | J18: Washington | L18: USA | M18: Dependable Systems | N18: Conference | O18: http://2002.dsn.org/
A19: International Conference on Dependable Systems and Networks | B19: 2001 | C19: DSN 2001 | D19: DSN | E19: 2001-07-01T00:00:00.000 | F19: 2001-07-04T00:00:00.000 | H19: 54 | J19: Göteborg | L19: Sweden | M19: Dependable Systems | N19: Conference | O19: http://2001.dsn.org/
A20: International Conference on Dependable Systems and Networks | B20: 2000 | C20: DSN 2000 | D20: DSN | E20: 2000-06-25T00:00:00.000 | F20: 2000-06-28T00:00:00.000 | H20: 65 | J20: New York | L20: USA | M20: Dependable Systems | N20: Conference | O20: http://dblp2.uni-trier.de/db/conf/dsn/dsn2000.html

Sheet: PKDD
A1: Title | B1: Event[Start date] | C1: Event[Acronym] | D1: Event[Series] | E1: Event[Start date] | F1: Event[End date] | G1: Event[Submitted papers] | H1: Event[Accepted papers] | I1: Event[Acceptance Rate] | J1: Event[City] | K1: Event[Country] | L1: Event[Field] | M1: Event[Type] | N1: Event[Homepage]
A2: 22nd Principles and Practice of Knowledge Discovery in Databases | B2: 2018 | C2: ECML PKDD 2018 | D2: ECML PKDD | E2: 2018-09-10T00:00:00.000 | F2: 2018-09-14T00:00:00.000 | J2: Dublin | K2: Ireland | L2: Databases | M2: Conference | N2: www.ecmlpkdd2018.org/
A3: 21th Principles and Practice of Knowledge Discovery in Databases | B3: 2017 | C3: ECML PKDD 2017 | D3: ECML PKDD | E3: 2017-09-18T00:00:00.000 | F3: 2017-09-22T00:00:00.000 | G3: 364 | H3: 104 | I3: 0.13500000000000001 | J3: Skopje | K3: Macedonia | L3: Databases | M3: Conference | N3: ecmlpkdd2017.ijs.si/
A4: 20th Principles and Practice of Knowledge Discovery in Databases | B4: 2016 | C4: ECML PKDD 2016 | D4: ECML PKDD | E4: 2016-09-19T00:00:00.000 | F4: 2016-09-23T00:00:00.000 | G4: 460 | H4: 139 | I4: =RC[-1]/RC[-2] -> 0.30217391304347824 | J4: Riva del Garda. | K4: Italy | L4: Databases | M4: Conference | N4: www.ecmlpkdd2016.org/
A5: 19th Principles and Practice of Knowledge Discovery in Databases | B5: 2015 | C5: ECML PKDD 2015 | D5: ECML PKDD | E5: 2015-09-07T00:00:00.000 | F5: 2015-09-11T00:00:00.000 | G5: 565 | H5: 131 | I5: =RC[-1]/RC[-2] -> 0.23185840707964603 | J5: Porto | K5: Portugal | L5: Databases | M5: Conference | N5: www.ecmlpkdd2015.org/
A6: 18th Principles and Practice of Knowledge Discovery in Databases | B6: 2014 | C6: ECML PKDD 2014 | D6: ECML PKDD | E6: 2014-09-15T00:00:00.000 | F6: 2014-09-19T00:00:00.000 | G6: 550 | H6: 146 | I6: =RC[-1]/RC[-2] -> 0.26545454545454544 | J6: Nancy | K6: France | L6: Databases | M6: Conference | N6: www.ecmlpkdd2014.org/
A7: 17th Principles and Practice of Knowledge Discovery in Databases | B7: 2013 | C7: ECML PKDD 2013 | D7: ECML PKDD | E7: 2013-09-23T00:00:00.000 | F7: 2013-09-27T00:00:00.000 | G7: 447 | H7: 111 | I7: =RC[-1]/RC[-2] -> 0.24832214765100671 | J7: Prague | K7: Czech Republic | L7: Databases | M7: Conference | N7: www.ecmlpkdd2013.org/
A8: 16th Principles and Practice of Knowledge Discovery in Databases | B8: 2012 | C8: ECML PKDD 2012 | D8: ECML PKDD | E8: 2012-09-24T00:00:00.000 | F8: 2012-09-28T00:00:00.000 | G8: 443 | H8: 124 | I8: =RC[-1]/RC[-2] -> 0.27990970654627539 | J8: Bristol | K8: UK | L8: Databases | M8: Conference | N8: www.ecmlpkdd2012.net/
A9: 15th Principles and Practice of Knowledge Discovery in Databases | B9: 2011 | C9: ECML PKDD 2011 | D9: ECML PKDD | E9: 2011-09-05T00:00:00.000 | F9: 2011-09-09T00:00:00.000 | G9: 600 | H9: 142 | I9: =RC[-1]/RC[-2] -> 0.23666666666666666 | J9: Athens | K9: Greece | L9: Databases | M9: Conference | N9: www.ecmlpkdd2011.org/
A10: 14th Principles and Practice of Knowledge Discovery in Databases | B10: 2010 | C10: ECML PKDD 2010 | D10: ECML PKDD | E10: 2010-09-20T00:00:00.000 | F10: 2010-09-24T00:00:00.000 | G10: 658 | H10: 124 | I10: =RC[-1]/RC[-2] -> 0.18844984802431611 | J10: Barcelona | K10: Spain | L10: Databases | M10: Conference | N10: www.ecmlpkdd2010.org/
A11: 13th Principles and Practice of Knowledge Discovery in Databases | B11: 2009 | C11: ECML PKDD 2009 | D11: ECML PKDD | E11: 2009-09-07T00:00:00.000 | F11: 2009-09-11T00:00:00.000 | G11: 422 | H11: 106 | I11: =RC[-1]/RC[-2] -> 0.25118483412322273 | J11: Bled | K11: Slovenia | L11: Databases | M11: Conference | N11: www1.ecmlpkdd2009.net/
A12: 12th Principles and Practice of Knowledge Discovery in Databases | B12: 2008 | C12: ECML PKDD 2008 | D12: ECML PKDD | E12: 2008-09-15T00:00:00.000 | F12: 2008-09-19T00:00:00.000 | G12: 521 | H12: 100 | I12: =RC[-1]/RC[-2] -> 0.19193857965451055 | J12: Antwerp | K12: Belgium | L12: Databases | M12: Conference | N12: www.ecmlpkdd.org/2008/
A13: 11th Principles and Practice of Knowledge Discovery in Databases | B13: 2007 | C13: ECML PKDD 2007 | D13: ECML PKDD | E13: 2007-09-17T00:00:00.000 | F13: 2007-09-21T00:00:00.000 | G13: 592 | H13: 82 | I13: =RC[-1]/RC[-2] -> 0.13851351351351351 | J13: Warsaw | K13: Poland | L13: Databases | M13: Conference | N13: dblp.org/db/conf/pkdd/pkdd2007.html
A14: 10th Principles and Practice of Knowledge Discovery in Databases | B14: 2006 | C14: ECML PKDD 2006 | D14: ECML PKDD | E14: 2006-09-18T00:00:00.000 | F14: 2006-09-22T00:00:00.000 | G14: 564 | H14: 87 | I14: =RC[-1]/RC[-2] -> 0.15425531914893617 | J14: Berlin | K14: Germany | L14: Databases | M14: Conference | N14: www.ecmlpkdd.org/2006/
A15: 9th Principles and Practice of Knowledge Discovery in Databases | B15: 2005 | C15: ECML PKDD 2005 | D15: ECML PKDD | E15: 2005-10-03T00:00:00.000 | F15: 2005-10-07T00:00:00.000 | G15: 220 | H15: 35 | I15: =RC[-1]/RC[-2] -> 0.15909090909090909 | J15: Porto | K15: Portugal | L15: Databases | M15: Conference | N15: www.ecmlpkdd.org/2005/
A16: 8th Principles and Practice of Knowledge Discovery in Databases | B16: 2004 | C16: ECML PKDD 2004 | D16: ECML PKDD | E16: 2004-09-20T00:00:00.000 | F16: 2004-09-24T00:00:00.000 | G16: 269 | H16: 39 | I16: =RC[-1]/RC[-2] -> 0.1449814126394052 | J16: Pisa | K16: Italy | L16: Databases | M16: Conference | N16: www.ecmlpkdd.org/2004/
A17: 7th Principles and Practice of Knowledge Discovery in Databases | B17: 2003 | C17: ECML PKDD 2003 | D17: ECML PKDD | E17: 2003-09-22T00:00:00.000 | F17: 2003-09-26T00:00:00.000 | G17: 332 | H17: 40 | I17: =RC[-1]/RC[-2] -> 0.12048192771084337 | J17: Cavtat-Dubrovnik | K17: Croatia | L17: Databases | M17: Conference | N17: dblp.org/db/conf/pkdd/pkdd2003.html
A18: 6th Principles of Data Mining and Knowledge Discovery | B18: 2002 | C18: ECML PKDD 2002 | D18: ECML PKDD | E18: 2002-08-19T00:00:00.000 | F18: 2002-08-23T00:00:00.000 | G18: 70 | H18: 39 | I18: =RC[-1]/RC[-2] -> 0.55714285714285716 | J18: Helsinki | K18: Finland | L18: Databases | M18: Conference | N18: www.cs.helsinki.fi/events/ecmlpkdd/
A19: 5th Principles of Data Mining and Knowledge Discovery | B19: 2001 | C19: ECML PKDD 2001 | D19: ECML PKDD | E19: 2001-09-03T00:00:00.000 | F19: 2001-09-05T00:00:00.000 | G19: 140 | H19: 50 | I19: =RC[-1]/RC[-2] -> 0.35714285714285715 | J19: Freiburg | K19: Germany | L19: Databases | M19: Conference | N19: ttp://dblp.org/db/conf/pkdd/pkdd2001.html
A20: 4th Principles of Data Mining and Knowledge Discovery | B20: 2000 | C20: PKDD 2000 | D20: PKDD | E20: 2000-09-13T00:00:00.000 | F20: 2000-09-16T00:00:00.000 | G20: 100 | H20: 43 | I20: =RC[-1]/RC[-2] -> 0.43 | J20: Lyon | K20: France | L20: Databases | M20: Conference | N20: eric.univ-lyon2.fr/~pkdd2000/
A21: 3rd Principles of Data Mining and Knowledge Discovery | B21: 1999 | C21: PKDD 1999 | D21: PKDD | E21: 1999-09-15T00:00:00.000 | F21: 1999-09-18T00:00:00.000 | G21: 106 | H21: 82 | I21: =RC[-1]/RC[-2] -> 0.77358490566037741 | J21: Prague | K21: Czech Republic | L21: Databases | M21: Conference | N21: lisp.vse.cz/pkdd99/
A22: 2nd Principles of Data Mining and Knowledge Discovery | B22: 1998 | C22: PKDD 1998 | D22: PKDD | E22: 1998-09-23T00:00:00.000 | F22: 1998-09-26T00:00:00.000 | G22: 100 | H22: 46 | I22: =RC[-1]/RC[-2] -> 0.46 | J22: Nantes | K22: France | L22: Databases | M22: Conference | N22: dblp.uni-trier.de/db/conf/pkdd/pkdd98.html
A23: 1st Principles of Data Mining and Knowledge Discovery | B23: 1997 | C23: PKDD 1997 | D23: PKDD | E23: 1997-06-24T00:00:00.000 | F23: 1997-06-27T00:00:00.000 | G23: 73 | H23: 26 | I23: =RC[-1]/RC[-2] -> 0.35616438356164382 | J23: Trondheim | K23: Norway | L23: Databases | M23: Conference | N23: dblp.uni-trier.de/db/conf/pkdd/pkdd97.html

Sheet: ICSE
A1: Title | B1: Event[Start date] | C1: Event[Acronym] | D1: Event[Series] | E1: Event[Start date] | F1: Event[End date] | G1: Event[Submitted papers] | H1: Event[Accepted papers] | I1: Event[Submission Rate] | J1: Event[City] | K1: Event[State] | L1: Event[Country] | M1: Event[Field] | N1: Event[Type] | O1: Event[Homepage]
A2: 40th International Conference on Software Engineering | B2: 2018 | C2: ICSE 2018 | D2: ICSE | E2: 2018-05-27T00:00:00.000 | F2: 2018-06-03T00:00:00.000 | J2: Gothenburg | L2: Sweden | M2: Software Engineering | N2: Conference | O2: www.icse2018.org/
A3: 39th International Conference on Software Engineering | B3: 2017 | C3: ICSE 2017 | D3: ICSE | E3: 2017-05-20T00:00:00.000 | F3: 2017-05-28T00:00:00.000 | G3: 415 | H3: 68 | I3: =RC[-1]/RC[-2] -> 0.16385542168674699 | J3: Buenos Aires | L3: Argentina | M3: Software Engineering | N3: Conference | O3: icse2017.gatech.edu/
A4: 38th International Conference on Software Engineering | B4: 2016 | C4: ICSE 2016 | D4: ICSE | E4: 2016-05-14T00:00:00.000 | F4: 2016-05-22T00:00:00.000 | G4: 530 | H4: 101 | I4: =RC[-1]/RC[-2] -> 0.19056603773584907 | J4: Austin | K4: Texas | L4: USA | M4: Software Engineering | N4: Conference | O4: 2016.icse.cs.txstate.edu/
A5: 37th International Conference on Software Engineering | B5: 2015 | C5: ICSE 2015 | D5: ICSE | E5: 2015-05-16T00:00:00.000 | F5: 2015-05-24T00:00:00.000 | G5: 452 | H5: 84 | I5: =RC[-1]/RC[-2] -> 0.18584070796460178 | J5: Firenze | L5: Italy | M5: Software Engineering | N5: Conference | O5: 2015.icse-conferences.org/
A6: 36th International Conference on Software Engineering | B6: 2014 | C6: ICSE 2014 | D6: ICSE | E6: 2014-05-31T00:00:00.000 | F6: 2014-06-07T00:00:00.000 | G6: 496 | H6: 99 | I6: =RC[-1]/RC[-2] -> 0.19959677419354838 | J6: Hyderabad | L6: India | M6: Software Engineering | N6: Conference | O6: 2014.icse-conferences.org/
A7: 35th International Conference on Software Engineering | B7: 2013 | C7: ICSE 2013 | D7: ICSE | E7: 2013-05-18T00:00:00.000 | F7: 2013-05-26T00:00:00.000 | G7: 461 | H7: 85 | I7: =RC[-1]/RC[-2] -> 0.18438177874186551 | J7: San Francisco | K7: California | L7: USA | M7: Software Engineering | N7: Conference | O7: 2013.icse-conferences.org/
A8: 34th International Conference on Software Engineering | B8: 2012 | C8: ICSE 2012 | D8: ICSE | E8: 2012-06-02T00:00:00.000 | F8: 2012-06-09T00:00:00.000 | G8: 408 | H8: 87 | I8: =RC[-1]/RC[-2] -> 0.21323529411764705 | J8: Zurich | L8: Switzerland | M8: Software Engineering | N8: Conference | O8: files.ifi.uzh.ch/icseweb/
A9: 33rd International Conference on Software Engineering | B9: 2011 | C9: ICSE 2011 | D9: ICSE | E9: 2011-05-21T00:00:00.000 | F9: 2011-05-28T00:00:00.000 | G9: 441 | H9: 62 | I9: =RC[-1]/RC[-2] -> 0.14058956916099774 | J9: Honolulu | K9: Hawaii | L9: USA | M9: Software Engineering | N9: Conference | O9: 2011.icse-conferences.org/
A10: 32nd International Conference on Software Engineering | B10: 2010 | C10: ICSE 2010 | D10: ICSE | E10: 2010-05-02T00:00:00.000 | F10: 2010-05-08T00:00:00.000 | G10: 380 | H10: 52 | I10: =RC[-1]/RC[-2] -> 0.1368421052631579 | J10: Cape Town | L10: South Africa | M10: Software Engineering | N10: Conference | O10: www.sbs.co.za/icse2010/
A11: 31st International Conference on Software Engineering | B11: 2009 | C11: ICSE 2009 | D11: ICSE | E11: 2009-05-16T00:00:00.000 | F11: 2009-05-24T00:00:00.000 | G11: 405 | H11: 50 | I11: =RC[-1]/RC[-2] -> 0.12345679012345678 | J11: Vancouver | L11: Canada | M11: Software Engineering | N11: Conference | O11: www.cs.uoregon.edu/events/icse2009/home/
A12: 30th International Conference on Software Engineering | B12: 2008 | C12: ICSE 2008 | D12: ICSE | E12: 2008-05-10T00:00:00.000 | F12: 2008-05-18T00:00:00.000 | G12: 371 | H12: 56 | I12: =RC[-1]/RC[-2] -> 0.15094339622641509 | J12: Leipzig | L12: Germany | M12: Software Engineering | N12: Conference | O12: icse08.upb.de/
A13: 29th International Conference on Software Engineering | B13: 2007 | C13: ICSE 2007 | D13: ICSE | E13: 2007-05-19T00:00:00.000 | F13: 2007-05-07T00:00:00.000 | G13: 334 | H13: 49 | I13: =RC[-1]/RC[-2] -> 0.1467065868263473 | J13: Minneapolis | K13: Minnesota | L13: USA | M13: Software Engineering | N13: Conference | O13: web4.cs.ucl.ac.uk/icse07/
A14: 28th International Conference on Software Engineering | B14: 2006 | C14: ICSE 2006 | D14: ICSE | E14: 2006-05-20T00:00:00.000 | F14: 2006-05-28T00:00:00.000 | G14: 395 | H14: 36 | I14: =RC[-1]/RC[-2] -> 9.1139240506329114E-2 | J14: Shanghai | L14: China | M14: Software Engineering | N14: Conference | O14: isr.uci.edu/icse-06/
A15: 27th International Conference on Software Engineering | B15: 2005 | C15: ICSE 2005 | D15: ICSE | E15: 2005-05-15T00:00:00.000 | F15: 2005-05-21T00:00:00.000 | G15: 313 | H15: 44 | I15: =RC[-1]/RC[-2] -> 0.14057507987220447 | J15: St. Louis | K15: Missouri | L15: USA | M15: Software Engineering | N15: Conference | O15: www.icse-conferences.org/2005/Home/
A16: 26th International Conference on Software Engineering | B16: 2004 | C16: ICSE 2004 | D16: ICSE | E16: 2004-05-23T00:00:00.000 | F16: 2004-05-28T00:00:00.000 | G16: 436 | H16: 58 | I16: =RC[-1]/RC[-2] -> 0.13302752293577982 | J16: Edinburgh | K16: Scotland | L16: UK | M16: Software Engineering | N16: Conference | O16: www.icse-conferences.org/2004/index.html
A17: 25th International Conference on Software Engineering | B17: 2003 | C17: ICSE 2003 | D17: ICSE | E17: 2003-05-03T00:00:00.000 | F17: 2003-05-10T00:00:00.000 | G17: 324 | H17: 42 | I17: =RC[-1]/RC[-2] -> 0.12962962962962962 | J17: Portland | K17: Oregon | L17: USA | M17: Software Engineering | N17: Conference | O17: www.icse-conferences.org/2003/index.html
A18: 24th International Conference on Software Engineering | B18: 2002 | C18: ICSE 2002 | D18: ICSE | E18: 2002-05-19T00:00:00.000 | F18: 2002-05-25T00:00:00.000 | G18: 303 | H18: 48 | I18: =RC[-1]/RC[-2] -> 0.15841584158415842 | J18: Orlando | K18: Florida | L18: USA | M18: Software Engineering | N18: Conference | O18: www.icse-conferences.org/2002/index.html
A19: 23rd International Conference on Software Engineering | B19: 2001 | C19: ICSE 2001 | D19: ICSE | E19: 2001-05-12T00:00:00.000 | F19: 2001-05-19T00:00:00.000 | G19: 368 | H19: 47 | I19: =RC[-1]/RC[-2] -> 0.12771739130434784 | J19: Toronto | K19: Ontario | L19: Canada | M19: Software Engineering | N19: Conference | O19: www.icse-conferences.org/2001/index.html
A20: 22nd International Conference on Software Engineering | B20: 2000 | C20: ICSE 2000 | D20: ICSE | E20: 2000-06-04T00:00:00.000 | F20: 2000-06-11T00:00:00.000 | G20: 335 | H20: 49 | I20: =RC[-1]/RC[-2] -> 0.14626865671641792 | J20: Limerick | L20: Ireland | M20: Software Engineering | N20: Conference | O20: dblp2.uni-trier.de/db/conf/icse/
A21: 21st International Conference on Software Engineering | B21: 1999 | C21: ICSE 1999 | D21: ICSE | E21: 1999-05-16T00:00:00.000 | F21: 1999-05-22T00:00:00.000 | G21: 269 | H21: 50 | I21: =RC[-1]/RC[-2] -> 0.18587360594795538 | J21: Los Angeles | K21: California | L21: USA | M21: Software Engineering | N21: Conference | O21: dblp2.uni-trier.de/db/conf/icse/
A22: 20th International Conference on Software Engineering | B22: 1998 | C22: ICSE 1998 | D22: ICSE | E22: 1998-04-19T00:00:00.000 | F22: 1998-04-25T00:00:00.000 | G22: 209 | H22: 41 | I22: =RC[-1]/RC[-2] -> 0.19617224880382775 | J22: Kyoto | L22: Japan | M22: Software Engineering | N22: Conference | O22: icse98.aist-nara.ac.jp/
A23: 19th International Conference on Software Engineering | B23: 1997 | C23: ICSE 1997 | D23: ICSE | E23: 1997-05-17T00:00:00.000 | F23: 1997-05-23T00:00:00.000 | G23: 219 | H23: 50 | I23: =RC[-1]/RC[-2] -> 0.22831050228310501 | J23: Boston | L23: USA | M23: Software Engineering | N23: Conference | O23: www.icse-conferences.org/1997/
A24: 18th International Conference on Software Engineering | B24: 1996 | C24: ICSE 1996 | D24: ICSE | E24: 1996-03-25T00:00:00.000 | F24: 1996-03-30T00:00:00.000 | G24: 213 | H24: 52 | I24: =RC[-1]/RC[-2] -> 0.24413145539906103 | J24: Berlin | L24: Germany | M24: Software Engineering | N24: Conference | O24: dblp2.uni-trier.de/db/conf/icse/
A25: 17th International Conference on Software Engineering | B25: 1995 | C25: ICSE 1995 | D25: ICSE | E25: 1995-04-23T00:00:00.000 | F25: 1995-04-30T00:00:00.000 | G25: 155 | H25: 28 | I25: =RC[-1]/RC[-2] -> 0.18064516129032257 | J25: Seattle | K25: Washington | L25: USA | M25: Software Engineering | N25: Conference | O25: www.cs.washington.edu/research/se/icse17/
A26: 16th International Conference on Software Engineering | B26: 1994 | C26: ICSE 1994 | D26: ICSE | E26: 1994-05-16T00:00:00.000 | F26: 1994-05-21T00:00:00.000 | J26: Sorrento | L26: Italy | M26: Software Engineering | N26: Conference | O26: dblp.uni-trier.de/db/conf/icse/icse94.html
A27: 15th International Conference on Software Engineering | B27: 1993 | C27: ICSE 1993 | D27: ICSE | E27: 1993-05-17T00:00:00.000 | F27: 1993-05-21T00:00:00.000 | J27: Baltimore | K27: Maryland | L27: USA | M27: Software Engineering | N27: Conference | O27: dblp.uni-trier.de/db/conf/icse/icse93.html
A28: 14th International Conference on Software Engineering | B28: 1992 | C28: ICSE 1992 | D28: ICSE | E28: 1992-05-11T00:00:00.000 | F28: 1992-05-15T00:00:00.000 | J28: Melbourne | L28: Australia | M28: Software Engineering | N28: Conference | O28: dblp.uni-trier.de/db/conf/icse/icse92.html
A29: 13th International Conference on Software Engineering | B29: 1991 | C29: ICSE 1991 | D29: ICSE | E29: 1991-05-13T00:00:00.000 | F29: 1991-05-17T00:00:00.000 | J29: Austin | K29: Texas | L29: USA | M29: Software Engineering | N29: Conference | O29: dblp.uni-trier.de/db/conf/icse/icse91.html
A30: 12th International Conference on Software Engineering | B30: 1990 | C30: ICSE 1990 | D30: ICSE | E30: 1990-03-26T00:00:00.000 | F30: 1990-03-30T00:00:00.000 | J30: Nice | L30: France | M30: Software Engineering | N30: Conference | O30: dblp.uni-trier.de/db/conf/icse/icse90.html
A31: 11th International Conference on Software Engineering | B31: 1989 | C31: ICSE 1989 | D31: ICSE | E31: 1989-05-15T00:00:00.000 | F31: 1989-05-18T00:00:00.000 | J31: Pittsburg | L31: USA | M31: Software Engineering | N31: Conference | O31: dblp.uni-trier.de/db/conf/icse/icse89.html
A32: 10th International Conference on Software Engineering | B32: 1988 | C32: ICSE 1988 | D32: ICSE | E32: 1988-04-11T00:00:00.000 | F32: 1988-04-15T00:00:00.000 | J32: Singapore | L32: Singapore | M32: Software Engineering | N32: Conference | O32: dblp.uni-trier.de/db/conf/icse/icse88.html
A33: 9th International Conference on Software Engineering | B33: 1987 | C33: ICSE 1987 | D33: ICSE | E33: 1987-03-30T00:00:00.000 | F33: 1987-04-02T00:00:00.000 | J33: Monterey | K33: California | L33: USA | M33: Software Engineering | N33: Conference | O33: dblp.uni-trier.de/db/conf/icse/icse87.html
A34: 8th International Conference on Software Engineering | B34: 1985 | C34: ICSE 1985 | D34: ICSE | E34: 1985-08-28T00:00:00.000 | F34: 1985-08-30T00:00:00.000 | J34: London | L34: UK | M34: Software Engineering | N34: Conference | O34: dblp.uni-trier.de/db/conf/icse/icse85.html
A35: 7th International Conference on Software Engineering | B35: 1984 | C35: ICSE 1984 | D35: ICSE | E35: 1984-03-26T00:00:00.000 | F35: 1984-03-29T00:00:00.000 | J35: Orlando | K35: Florida | L35: USA | M35: Software Engineering | N35: Conference | O35: dblp.uni-trier.de/db/conf/icse/icse84.html
A36: 6th International Conference on Software Engineering | B36: 1982 | C36: ICSE 1982 | D36: ICSE | E36: 1982-09-13T00:00:00.000 | F36: 1982-09-16T00:00:00.000 | J36: Tokyo | L36: Japan | M36: Software Engineering | N36: Conference | O36: dblp.uni-trier.de/db/conf/icse/icse82.html
A37: 5th International Conference on Software Engineering | B37: 1981 | C37: ICSE 1981 | D37: ICSE | E37: 1981-03-09T00:00:00.000 | F37: 1981-03-12T00:00:00.000 | J37: San Diego | K37: California | L37: USA | M37: Software Engineering | N37: Conference | O37: dblp.uni-trier.de/db/conf/icse/icse81.html
A38: 4th International Conference on Software Engineering | B38: 1979 | C38: ICSE 1979 | D38: ICSE | E38: 1979-09-17T00:00:00.000 | F38: 1979-09-19T00:00:00.000 | J38: Munich | L38: Germany | M38: Software Engineering | N38: Conference | O38: dblp.uni-trier.de/db/conf/icse/icse79.html
A39: 3rd International Conference on Software Engineering | B39: 1978 | C39: ICSE 1978 | D39: ICSE | E39: 1978-05-10T00:00:00.000 | F39: 1978-05-12T00:00:00.000 | J39: Atlanta | K39: Georgia | L39: USA | M39: Software Engineering | N39: Conference | O39: dblp.uni-trier.de/db/conf/icse/icse78.html
A40: 2nd International Conference on Software Engineering | B40: 1976 | C40: ICSE 1976 | D40: ICSE | E40: 1976-10-13T00:00:00.000 | F40: 1976-10-15T00:00:00.000 | J40: San Francisco | K40: California | L40: USA | M40: Software Engineering | N40: Conference | O40: dblp.uni-trier.de/db/conf/icse/icse76.html
A41: 1st International Conference on Software Engineering | B41: 1975 | C41: ICSE 1975 | D41: ICSE | E41: 1975-09-11T00:00:00.000 | F41: 1975-09-12T00:00:00.000 | J41: Washington | L41: USA | M41: Software Engineering | N41: Conference | O41: dblp.uni-trier.de/db/conf/icse/icse75.html

Sheet: PLDI
A1: Title | B1: Event[Start date] | C1: Event[Acronym] | D1: Event[Series] | E1: Event[Start date] | F1: Event[End date] | G1: Event[Submitted papers] | H1: Event[Accepted papers] | I1: Event[Submission Rate] | J1: Event[City] | K1: Event[State] | L1: Event[Country] | M1: Event[Field] | N1: Event[Type] | O1: Event[Homepage]
A2: Conference on Programming Language Design and Implementation | B2: 2018 | C2: PLDI 2018 | D2: PLDI | E2: 2018-06-18T00:00:00.000 | F2: 2018-06-22T00:00:00.000 | J2: Philadelphia | L2: USA | M2: Programming Language Design | N2: Conference | O2: conf.researchr.org/home/pldi-2018
A3: Conference on Programming Language Design and Implementation | B3: 2017 | C3: PLDI 2017 | D3: PLDI | E3: 2017-06-18T00:00:00.000 | F3: 2017-06-23T00:00:00.000 | H3: 47 | J3: Barcelona | L3: Spain | M3: Programming Language Design | N3: Conference | O3: conf.researchr.org/home/pldi-2017
A4: Conference on Programming Language Design and Implementation | B4: 2016 | C4: PLDI 2016 | D4: PLDI | E4: 2016-06-13T00:00:00.000 | F4: 2016-06-17T00:00:00.000 | G4: 245 | H4: 49 | I4: =RC[-1]/RC[-2] -> 0.2 | J4: Santa Barbara | K4: California | L4: USA | M4: Programming Language Design | N4: Conference | O4: conf.researchr.org/home/pldi-2016
A5: Conference on Programming Language Design and Implementation | B5: 2015 | C5: PLDI 2015 | D5: PLDI | E5: 2015-06-13T00:00:00.000 | F5: 2015-06-17T00:00:00.000 | G5: 303 | H5: 58 | I5: =RC[-1]/RC[-2] -> 0.19141914191419143 | J5: Portland | K5: Oregon | L5: USA | M5: Programming Language Design | N5: Conference | O5: conf.researchr.org/home/pldi2015
A6: Conference on Programming Language Design and Implementation | B6: 2014 | C6: PLDI 2014 | D6: PLDI | E6: 2014-06-09T00:00:00.000 | F6: 2014-06-11T00:00:00.000 | G6: 287 | H6: 52 | I6: =RC[-1]/RC[-2] -> 0.18118466898954705 | J6: Edinburgh | L6: UK | M6: Programming Language Design | N6: Conference | O6: conferences.inf.ed.ac.uk/pldi2014/
A7: Conference on Programming Language Design and Implementation | B7: 2013 | C7: PLDI 2013 | D7: PLDI | E7: 2013-06-16T00:00:00.000 | F7: 2013-06-22T00:00:00.000 | G7: 267 | H7: 46 | I7: =RC[-1]/RC[-2] -> 0.17228464419475656 | J7: Seattle | K7: Washington | L7: USA | M7: Programming Language Design | N7: Conference | O7: pldi2013.ucombinator.org/
A8: Conference on Programming Language Design and Implementation | B8: 2012 | C8: PLDI 2012 | D8: PLDI | E8: 2012-06-11T00:00:00.000 | F8: 2012-06-16T00:00:00.000 | G8: 255 | H8: 48 | I8: =RC[-1]/RC[-2] -> 0.18823529411764706 | J8: Beijing | L8: China | M8: Programming Language Design | N8: Conference | O8: pldi12.cs.purdue.edu/
A9: Conference on Programming Language Design and Implementation | B9: 2011 | C9: PLDI 2011 | D9: PLDI | E9: 2011-06-04T00:00:00.000 | F9: 2011-06-08T00:00:00.000 | G9: 236 | H9: 55 | I9: =RC[-1]/RC[-2] -> 0.23305084745762711 | J9: San Jose | K9: California | L9: USA | M9: Programming Language Design | N9: Conference | O9: pldi11.cs.utah.edu/
A10: Conference on Programming Language Design and Implementation | B10: 2010 | C10: PLDI 2010 | D10: PLDI | E10: 2010-06-05T00:00:00.000 | F10: 2010-06-10T00:00:00.000 | G10: 206 | H10: 41 | I10: =RC[-1]/RC[-2] -> 0.19902912621359223 | J10: Toronto | K10: Ontario | L10: Canada | M10: Programming Language Design | N10: Conference | O10: cs.stanford.edu/pldi10/
A11: Conference on Programming Language Design and Implementation | B11: 2009 | C11: PLDI 2009 | D11: PLDI | E11: 2009-06-15T00:00:00.000 | F11: 2009-06-20T00:00:00.000 | G11: 194 | H11: 41 | I11: =RC[-1]/RC[-2] -> 0.21134020618556701 | J11: Dublin | L11: Ireland | M11: Programming Language Design | N11: Conference | O11: dblp2.uni-trier.de/db/conf/pldi/pldi2009.html
A12: Conference on Programming Language Design and Implementation | B12: 2008 | C12: PLDI 2008 | D12: PLDI | E12: 2008-06-07T00:00:00.000 | F12: 2008-06-13T00:00:00.000 | G12: 184 | H12: 34 | I12: =RC[-1]/RC[-2] -> 0.18478260869565216 | J12: Tucson | L12: USA | M12: Programming Language Design | N12: Conference | O12: pldi2008.cs.ucr.edu/
A13: Conference on Programming Language Design and Implementation | B13: 2007 | C13: PLDI 2007 | D13: PLDI | E13: 2007-06-10T00:00:00.000 | F13: 2007-06-13T00:00:00.000 | G13: 178 | H13: 45 | I13: =RC[-1]/RC[-2] -> 0.25280898876404495 | J13: San Diego | K13: California | L13: USA | M13: Programming Language Design | N13: Conference | O13: dblp2.uni-trier.de/db/conf/pldi/pldi2007.html
A14: Conference on Programming Language Design and Implementation | B14: 2006 | C14: PLDI 2006 | D14: PLDI | E14: 2006-06-11T00:00:00.000 | F14: 2006-06-14T00:00:00.000 | G14: 174 | H14: 36 | I14: =RC[-1]/RC[-2] -> 0.20689655172413793 | J14: Ottawa | K14: Ontario | L14: Canada | M14: Programming Language Design | N14: Conference | O14: research.microsoft.com/en-us/um/redmond/events/pldi06/
A15: Conference on Programming Language Design and Implementation | B15: 2005 | C15: PLDI 2005 | D15: PLDI | E15: 2005-06-12T00:00:00.000 | F15: 2005-06-15T00:00:00.000 | G15: 135 | H15: 28 | I15: =RC[-1]/RC[-2] -> 0.2074074074074074 | J15: Chicago | L15: USA | M15: Programming Language Design | N15: Conference | O15: research.ihost.com/pldi2005/
A16: Conference on Programming Language Design and Implementation | B16: 2004 | C16: PLDI 2004 | D16: PLDI | E16: 2004-06-09T00:00:00.000 | F16: 2004-06-11T00:00:00.000 | G16: 127 | H16: 25 | I16: =RC[-1]/RC[-2] -> 0.19685039370078741 | J16: Washington | L16: USA | M16: Programming Language Design | N16: Conference | O16: www.cs.umd.edu/~pugh/pldi04/
A17: Conference on Programming Language Design and Implementation | B17: 2003 | C17: PLDI 2003 | D17: PLDI | E17: 2003-06-09T00:00:00.000 | F17: 2003-06-11T00:00:00.000 | G17: 131 | H17: 28 | I17: =RC[-1]/RC[-2] -> 0.21374045801526717 | J17: San Diego | K17: California | L17: USA | M17: Programming Language Design | N17: Conference | O17: www.cs.ucr.edu/~gupta/PLDI2003/
A18: Conference on Programming Language Design and Implementation | B18: 2002 | C18: PLDI 2002 | D18: PLDI | E18: 2002-06-17T00:00:00.000 | F18: 2002-06-19T00:00:00.000 | G18: 169 | H18: 28 | I18: =RC[-1]/RC[-2] -> 0.16568047337278108 | J18: Berlin | L18: Germany | M18: Programming Language Design | N18: Conference | O18: www.sable.mcgill.ca/~hendren/PLDI2002/
A19: Conference on Programming Language Design and Implementation | B19: 2001 | C19: PLDI 2001 | D19: PLDI | E19: 2001-06-20T00:00:00.000 | F19: 2001-06-22T00:00:00.000 | G19: 144 | H19: 30 | I19: =RC[-1]/RC[-2] -> 0.20833333333333334 | J19: Snowbird | K19: Utah | L19: USA | M19: Programming Language Design | N19: Conference | O19: people.cs.pitt.edu/~soffa/pldi01/
A20: Conference on Programming Language Design and Implementation | B20: 2000 | C20: PLDI 2000 | D20: PLDI | E20: 2000-06-18T00:00:00.000 | F20: 2000-06-21T00:00:00.000 | G20: 173 | H20: 30 | I20: =RC[-1]/RC[-2] -> 0.17341040462427745 | J20: Vancouver | K20: British Columbia | L20: Canada | M20: Programming Language Design | N20: Conference | O20: suif.stanford.edu/~lam/pldi00/
A21: Conference on Programming Language Design and Implementation | B21: 1999 | C21: PLDI 1999 | D21: PLDI | E21: 1999-05-01T00:00:00.000 | F21: 1999-05-04T00:00:00.000 | G21: 130 | H21: 26 | I21: =RC[-1]/RC[-2] -> 0.2 | J21: Atlanta | K21: Georgia | L21: USA | M21: Programming Language Design | N21: Conference | O21: dblp2.uni-trier.de/db/conf/pldi/pldi99.html
A22: Conference on Programming Language Design and Implementation | B22: 1998 | C22: PLDI 1998 | D22: PLDI | E22: 1998-06-17T00:00:00.000 | F22: 1998-06-19T00:00:00.000 | G22: 136 | H22: 31 | I22: =RC[-1]/RC[-2] -> 0.22794117647058823 | J22: Montreal | L22: Canada | M22: Programming Language Design | N22: Conference | O22: dblp2.uni-trier.de/db/conf/pldi/pldi98.html
A23: Conference on Programming Language Design and Implementation | B23: 1997 | C23: PLDI 1997 | D23: PLDI | E23: 1997-06-15T00:00:00.000 | F23: 1997-06-19T00:00:00.000 | G23: 158 | H23: 31 | I23: =RC[-1]/RC[-2] -> 0.19620253164556961 | J23: Las Vegas | K23: Nevada | L23: USA | M23: Programming Language Design | N23: Conference | O23: www.cs.bu.edu/pub/pldi97/
A24: Conference on Programming Language Design and Implementation | B24: 1996 | C24: PLDI 1996 | D24: PLDI | E24: 1996-05-21T00:00:00.000 | F24: 1996-05-24T00:00:00.000 | G24: 112 | H24: 28 | I24: =RC[-1]/RC[-2] -> 0.25 | J24: Philadephia | K24: Pennsylvania | L24: USA | M24: Programming Language Design | N24: Conference | O24: dblp2.uni-trier.de/db/conf/pldi/pldi96.html
A25: Conference on Programming Language Design and Implementation | B25: 1995 | C25: PLDI 1995 | D25: PLDI | E25: 1995-06-18T00:00:00.000 | F25: 1995-06-21T00:00:00.000 | G25: 105 | H25: 28 | I25: =RC[-1]/RC[-2] -> 0.26666666666666666 | J25: La Jolla | K25: California | L25: USA | M25: Programming Language Design | N25: Conference | O25: dblp2.uni-trier.de/db/conf/pldi/pldi95.html
A26: Conference on Programming Language Design and Implementation | B26: 1994 | C26: PLDI 1994 | D26: PLDI | E26: 1994-06-20T00:00:00.000 | F26: 1994-06-24T00:00:00.000 | J26: Orlando | K26: Florida | L26: USA | M26: Programming Language Design | N26: Conference | O26: dblp2.uni-trier.de/db/conf/pldi/pldi94.html
A27: Conference on Programming Language Design and Implementation | B27: 1993 | C27: PLDI 1993 | D27: PLDI | E27: 1993-06-23T00:00:00.000 | F27: 1993-06-25T00:00:00.000 | J27: Albuquerque | K27: New Mexico | L27: USA | M27: Programming Language Design | N27: Conference | O27: dblp2.uni-trier.de/db/conf/pldi/pldi93.html
A28: Conference on Programming Language Design and Implementation | B28: 1992 | C28: PLDI 1992 | D28: PLDI | E28: 1992-06-17T00:00:00.000 | F28: 1992-06-19T00:00:00.000 | J28: San Francisco | K28: California | L28: USA | M28: Programming Language Design | N28: Conference | O28: dblp2.uni-trier.de/db/conf/pldi/pldi92.html
A29: Conference on Programming Language Design and Implementation | B29: 1991 | C29: PLDI 1991 | D29: PLDI | E29: 1991-06-26T00:00:00.000 | F29: 1991-06-28T00:00:00.000 | J29: Toronto | K29: Ontario | L29: Canada | M29: Programming Language Design | N29: Conference | O29: dblp2.uni-trier.de/db/conf/pldi/pldi91.html
A30: Conference on Programming Language Design and Implementation | B30: 1990 | C30: PLDI 1990 | D30: PLDI | E30: 1990-06-20T00:00:00.000 | F30: 1990-06-22T00:00:00.000 | J30: White Plains | K30: New York | L30: USA | M30: Programming Language Design | N30: Conference | O30: dblp2.uni-trier.de/db/conf/pldi/pldi90.html
A31: Conference on Programming Language Design and Implementation | B31: 1989 | C31: PLDI 1989 | D31: PLDI | E31: 1989-06-21T00:00:00.000 | F31: 1989-06-23T00:00:00.000 | J31: Portland | K31: Oregon | L31: USA | M31: Programming Language Design | N31: Conference | O31: dblp2.uni-trier.de/db/conf/pldi/pldi89.html
A32: Conference on Programming Language Design and Implementation | B32: 1988 | C32: PLDI 1988 | D32: PLDI | E32: 1988-06-22T00:00:00.000 | F32: 1988-06-24T00:00:00.000 | J32: Atlanta | K32: Georgia | L32: USA | M32: Programming Language Design | N32: Conference | O32: dblp2.uni-trier.de/db/conf/pldi/pldi88.html
A33: Symposium on Interpreters and Interpretive Techniques | B33: 1987 | C33: PLDI 1987 | D33: PLDI | E33: 1987-06-24T00:00:00.000 | F33: 1987-06-26T00:00:00.000 | J33: St. Paul | K33: Minnesota | L33: USA | M33: Programming Language Design | N33: Conference | O33: dblp2.uni-trier.de/db/conf/pldi/pldi87.html
A34: SIGPLAN Symposium on Compiler Construction | B34: 1986 | C34: SIGPLAN 1986 | D34: SIGPLAN | E34: 1986-06-25T00:00:00.000 | F34: 1986-06-27T00:00:00.000 | J34: Palo Alto | K34: California | L34: USA | M34: Programming Language Design | N34: Symposium
A35: SIGPLAN Symposium on Compiler Construction | B35: 1984 | C35: SIGPLAN 1985 | D35: SIGPLAN | E35: 1984-06-17T00:00:00.000 | F35: 1984-06-22T00:00:00.000 | J35: Montreal | L35: Canada | M35: Programming Language Design | N35: Symposium
A36: SIGPLAN Symposium on Compiler Construction | B36: 1982 | C36: SIGPLAN 1984 | D36: SIGPLAN | E36: 1982-06-23T00:00:00.000 | F36: 1982-06-25T00:00:00.000 | J36: Boston | K36: Massachusetts | L36: USA | M36: Programming Language Design | N36: Symposium
A37: SIGPLAN Symposium on Compiler Construction | B37: 1979 | C37: SIGPLAN 1983 | D37: SIGPLAN | E37: 1979-08-06T00:00:00.000 | F37: 1979-08-10T00:00:00.000 | J37: Denver | K37: Colorado | L37: USA | M37: Programming Language Design | N37: Symposium

Sheet: ASPLOS
A1: Title | B1: Event[Start date] | C1: Event[Acronym] | D1: Event[Series] | E1: Event[Start date] | F1: Event[End date] | G1: Event[Submitted papers] | H1: Event[Accepted papers] | I1: Event[Acceptance Rate] | J1: Event[City] | K1: Event[State] | L1: Event[Country] | M1: Event[Field] | N1: Event[Type] | O1: Event[Homepage]
A2: 23rd Architectural Support for Programming Languages and Operating Systems | B2: 2018 | C2: ASPLOS 2018 | D2: ASPLOS | E2: 2018-03-24T00:00:00.000 | F2: 2018-03-28T00:00:00.000 | J2: Williamsburg | L2: USA | M2: Software Engineering | N2: Conference | O2: www.asplos2018.org/
A3: 22nd Architectural Support for Programming Languages and Operating Systems | B3: 2017 | C3: ASPLOS 2017 | D3: ASPLOS | E3: 2017-04-08T00:00:00.000 | F3: 2017-04-12T00:00:00.000 | G3: 320 | H3: 53 | I3: =RC[-1]/RC[-2] -> 0.16562499999999999 | J3: Xi'an | L3: China | M3: Software Engineering | N3: Conference | O3: novel.ict.ac.cn/ASPLOS2017/
A4: 21st Architectural Support for Programming Languages and Operating Systems | B4: 2016 | C4: ASPLOS 2016 | D4: ASPLOS | E4: 2016-04-02T00:00:00.000 | F4: 2016-04-06T00:00:00.000 | G4: 232 | H4: 53 | I4: =RC[-1]/RC[-2] -> 0.22844827586206898 | J4: Atlanta | L4: USA | M4: Software Engineering | N4: Conference | O4: www.ece.cmu.edu/calcm/asplos2016/
A5: 20th Architectural Support for Programming Languages and Operating Systems | B5: 2015 | C5: ASPLOS 2015 | D5: ASPLOS | E5: 2015-03-14T00:00:00.000 | F5: 2015-03-18T00:00:00.000 | G5: 287 | H5: 48 | I5: =RC[-1]/RC[-2] -> 0.1672473867595819 | J5: Istanbul | L5: Turkey | M5: Software Engineering | N5: Conference | O5: asplos15.bilkent.edu.tr/
A6: 19th Architectural Support for Programming Languages and Operating Systems | B6: 2014 | C6: ASPLOS 2014 | D6: ASPLOS | E6: 2014-03-01T00:00:00.000 | F6: 2014-03-05T00:00:00.000 | G6: 217 | H6: 49 | I6: =RC[-1]/RC[-2] -> 0.22580645161290322 | J6: Salt Lake City | L6: USA | M6: Software Engineering | N6: Conference | O6: www.cs.utah.edu/asplos14/
A7: 18th Architectural Support for Programming Languages and Operating Systems | B7: 2013 | C7: ASPLOS 2013 | D7: ASPLOS | E7: 2013-03-16T00:00:00.000 | F7: 2013-03-20T00:00:00.000 | G7: 193 | H7: 44 | I7: =RC[-1]/RC[-2] -> 0.22797927461139897 | J7: Houston | L7: USA | M7: Software Engineering | N7: Conference | O7: asplos13.rice.edu/
A8: 17th Architectural Support for Programming Languages and Operating Systems | B8: 2012 | C8: ASPLOS 2012 | D8: ASPLOS | E8: 2012-03-03T00:00:00.000 | F8: 2012-03-07T00:00:00.000 | G8: 172 | H8: 37 | I8: =RC[-1]/RC[-2] -> 0.21511627906976744 | J8: London | L8: UK | M8: Software Engineering | N8: Conference
A9: 16th Architectural Support for Programming Languages and Operating Systems | B9: 2011 | C9: ASPLOS 2011 | D9: ASPLOS | E9: 2011-03-05T00:00:00.000 | F9: 2011-03-11T00:00:00.000 | G9: 152 | H9: 32 | I9: =RC[-1]/RC[-2] -> 0.21052631578947367 | J9: Newport Beach | L9: USA | M9: Software Engineering | N9: Conference | O9: asplos11.cs.ucr.edu/
A10: 15th Architectural Support for Programming Languages and Operating Systems | B10: 2010 | C10: ASPLOS 2010 | D10: ASPLOS | E10: 2010-03-13T00:00:00.000 | F10: 2010-03-17T00:00:00.000 | G10: 181 | H10: 32 | I10: =RC[-1]/RC[-2] -> 0.17679558011049723 | J10: Pittsburgh | K10: Pennsylvania | L10: USA | M10: Software Engineering | N10: Conference | O10: www.ece.cmu.edu/CALCM/asplos10/doku.php
A11: 14th Architectural Support for Programming Languages and Operating Systems | B11: 2009 | C11: ASPLOS 2009 | D11: ASPLOS | E11: 2009-03-07T00:00:00.000 | F11: 2009-03-11T00:00:00.000 | G11: 113 | H11: 29 | I11: =RC[-1]/RC[-2] -> 0.25663716814159293 | J11: Washington | L11: USA | M11: Software Engineering | N11: Conference | O11: www.cs.virginia.edu/asplos09/
A12: 13th Architectural Support for Programming Languages and Operating Systems | B12: 2008 | C12: ASPLOS 2008 | D12: ASPLOS | E12: 2008-03-01T00:00:00.000 | F12: 2008-03-05T00:00:00.000 | G12: 127 | H12: 31 | I12: =RC[-1]/RC[-2] -> 0.24409448818897639 | J12: Seattle | L12: USA | M12: Software Engineering | N12: Conference
A13: 12th Architectural Support for Programming Languages and Operating Systems | B13: 2006 | C13: ASPLOS 2006 | D13: ASPLOS | E13: 2006-10-21T00:00:00.000 | F13: 2006-10-25T00:00:00.000 | G13: 158 | H13: 38 | I13: =RC[-1]/RC[-2] -> 0.24050632911392406 | J13: San Jose | K13: California | L13: USA | M13: Software Engineering | N13: Conference
A14: 11th Architectural Support for Programming Languages and Operating Systems | B14: 2004 | C14: ASPLOS 2004 | D14: ASPLOS | E14: 2004-10-07T00:00:00.000 | F14: 2004-10-13T00:00:00.000 | G14: 169 | H14: 24 | I14: =RC[-1]/RC[-2] -> 0.14201183431952663 | J14: Boston | K14: Massachusetts | L14: USA | M14: Software Engineering | N14: Conference
A15: 10th Architectural Support for Programming Languages and Operating Systems | B15: 2002 | C15: ASPLOS 2002 | D15: ASPLOS | E15: 2002-10-05T00:00:00.000 | F15: 2002-10-09T00:00:00.000 | G15: 175 | H15: 24 | I15: =RC[-1]/RC[-2] -> 0.13714285714285715 | J15: San Jose | K15: California | L15: USA | M15: Software Engineering | N15: Conference | O15: research.cs.wisc.edu/asplos-X/
A16: 9th Architectural Support for Programming Languages and Operating Systems | B16: 2000 | C16: ASPLOS 2000 | D16: ASPLOS | E16: 2000-11-12T00:00:00.000 | F16: 2000-11-15T00:00:00.000 | G16: 114 | H16: 24 | I16: =RC[-1]/RC[-2] -> 0.21052631578947367 | J16: Cambridge | K16: Massachusetts | L16: USA | M16: Software Engineering | N16: Conference
A17: 8th Architectural Support for Programming Languages and Operating Systems | B17: 1998 | C17: ASPLOS 1998 | D17: ASPLOS | E17: 1998-10-03T00:00:00.000 | F17: 1998-10-07T00:00:00.000 | G17: 123 | H17: 28 | I17: =RC[-1]/RC[-2] -> 0.22764227642276422 | J17: San Jose | K17: California | L17: USA | M17: Software Engineering | N17: Conference
A18: 7th Architectural Support for Programming Languages and Operating Systems | B18: 1996 | C18: ASPLOS 1996 | D18: ASPLOS | E18: 1996-10-01T00:00:00.000 | F18: 1996-10-05T00:00:00.000 | G18: 109 | H18: 25 | I18: =RC[-1]/RC[-2] -> 0.22935779816513763 | J18: Cambridge | K18: Massachusetts | L18: USA | M18: Software Engineering | N18: Conference
A19: 6th Architectural Support for Programming Languages and Operating Systems | B19: 1994 | C19: ASPLOS 1994 | D19: ASPLOS | E19: 1994-10-04T00:00:00.000 | F19: 1994-10-07T00:00:00.000 | G19: 146 | H19: 29 | I19: =RC[-1]/RC[-2] -> 0.19863013698630136 | J19: San Jose | K19: California | L19: USA | M19: Software Engineering | N19: Conference
A20: 5th Architectural Support for Programming Languages and Operating Systems | B20: 1992 | C20: ASPLOS 1992 | D20: ASPLOS | E20: 1992-10-12T00:00:00.000 | F20: 1992-10-15T00:00:00.000 | G20: 150 | H20: 24 | I20: =RC[-1]/RC[-2] -> 0.16 | J20: Boston | K20: Massachusetts | L20: USA | M20: Software Engineering | N20: Conference
A21: 4th Architectural Support for Programming Languages and Operating Systems | B21: 1991 | C21: ASPLOS 1991 | D21: ASPLOS | E21: 1990-04-08T00:00:00.000 | F21: 1990-04-11T00:00:00.000 | G21: 92 | H21: 28 | I21: =RC[-1]/RC[-2] -> 0.30434782608695654 | J21: Santa Clara | K21: California | L21: USA | M21: Software Engineering | N21: Conference
A22: 3rd Architectural Support for Programming Languages and Operating Systems | B22: 1989 | C22: ASPLOS 1989 | D22: ASPLOS | E22: 1989-04-03T00:00:00.000 | F22: 1989-04-06T00:00:00.000 | G22: 114 | H22: 27 | I22: =RC[-1]/RC[-2] -> 0.23684210526315788 | J22: Boston | K22: Massachusetts | L22: USA | M22: Software Engineering | N22: Conference
A23: 2nd Architectural Support for Programming Languages and Operating Systems | B23: 1987 | C23: ASPLOS 1987 | D23: ASPLOS | E23: 1987-10-05T00:00:00.000 | F23: 1987-10-08T00:00:00.000 | G23: 65 | H23: 22 | I23: =RC[-1]/RC[-2] -> 0.33846153846153848 | J23: Palo Alto | K23: California | L23: USA | M23: Software Engineering | N23: Conference
A24: 1st Architectural Support for Programming Languages and Operating Systems | B24: 1982 | C24: ASPLOS 1982 | D24: ASPLOS | E24: 1982-03-01T00:00:00.000 | F24: 1982-03-03T00:00:00.000 | J24: Palo Alto | K24: California | L24: USA | M24: Software Engineering | N24: Conference

Sheet: ICDE
A1: Title | B1: Event[Acronym] | C1: Event[Series] | D1: Event[Start date] | E1: Event[End date] | F1: Event[Submitted papers] | G1: Event[Accepted papers] | H1: Event[Submission Rate] | I1: Event[Country] | J1: Event[Field] | K1: Event[Type] | L1: Event[Homepage]
A2: International Conference on Data Engineering | B2: ICDE | C2: ICDE2018 | D2: 2018-02-16T00:00:00.000 | E2: 2018-02-20T00:00:00.000 | I2: France | J2: Data Engineering | K2: Conference
A3: International Conference on Data Engineering | B3: ICDE | C3: ICDE2017 | D3: 2017-04-19T00:00:00.000 | E3: 2017-04-22T00:00:00.000 | F3: 525 | G3: 113 | H3: =RC[-1]/RC[-2] -> 0.21523809523809523 | I3: USA | J3: Data Engineering | K3: Conference
A4: International Conference on Data Engineering | B4: ICDE | C4: ICDE2016 | D4: 2016-05-16T00:00:00.000 | E4: 2016-05-20T00:00:00.000 | F4: 529 | G4: 134 | H4: =RC[-1]/RC[-2] -> 0.25330812854442342 | I4: Finland | J4: Data Engineering | K4: Conference
A5: International Conference on Data Engineering | B5: ICDE | C5: ICDE2015 | D5: 2015-04-13T00:00:00.000 | E5: 2015-04-17T00:00:00.000 | F5: 541 | G5: 147 | H5: =RC[-1]/RC[-2] -> 0.27171903881700554 | I5: South Korea | J5: Data Engineering | K5: Conference
A6: International Conference on Data Engineering | B6: ICDE | C6: ICDE2014 | D6: 2014-03-31T00:00:00.000 | E6: 2014-04-04T00:00:00.000 | F6: 544 | G6: 127 | H6: =RC[-1]/RC[-2] -> 0.23345588235294118 | I6: USA | J6: Data Engineering | K6: Conference
A7: International Conference on Data Engineering | B7: ICDE | C7: ICDE2013 | D7: 2013-04-08T00:00:00.000 | E7: 2013-04-12T00:00:00.000 | F7: 532 | G7: 130 | H7: =RC[-1]/RC[-2] -> 0.24436090225563908 | I7: Australia | J7: Data Engineering | K7: Conference
A8: International Conference on Data Engineering | B8: ICDE | C8: ICDE2012 | D8: 2012-04-01T00:00:00.000 | E8: 2012-04-05T00:00:00.000 | F8: 503 | G8: 137 | H8: =RC[-1]/RC[-2] -> 0.27236580516898606 | I8: USA | J8: Data Engineering | K8: Conference
A9: International Conference on Data Engineering | B9: ICDE | C9: ICDE2011 | D9: 2011-04-11T00:00:00.000 | E9: 2011-04-16T00:00:00.000 | F9: 584 | G9: 129 | H9: =RC[-1]/RC[-2] -> 0.2208904109589041 | I9: Germany | J9: Data Engineering | K9: Conference
A10: International Conference on Data Engineering | B10: ICDE | C10: ICDE2010 | D10: 2010-03-01T00:00:00.000 | E10: 2010-03-06T00:00:00.000 | F10: 600 | G10: 110 | H10: =RC[-1]/RC[-2] -> 0.18333333333333332 | I10: USA | J10: Data Engineering | K10: Conference
A11: International Conference on Data Engineering | B11: ICDE | C11: ICDE2009 | D11: 2009-03-29T00:00:00.000 | E11: 2009-04-04T00:00:00.000 | F11: 665 | G11: 148 | H11: =RC[-1]/RC[-2] -> 0.22255639097744362 | I11: China | J11: Data Engineering | K11: Conference
A12: International Conference on Data Engineering | B12: ICDE | C12: ICDE2008 | D12: 2008-04-07T00:00:00.000 | E12: 2008-04-12T00:00:00.000 | F12: 617 | G12: =RC[-1]*RC[1] -> 75.274000000000001 | H12: 0.122 | I12: Mexico | J12: Data Engineering | K12: Conference
A13: International Conference on Data Engineering | B13: ICDE | C13: ICDE2007 | D13: 2007-04-16T00:00:00.000 | E13: 2007-04-20T00:00:00.000 | F13: 659 | G13: =RC[-1]*RC[1] -> 121.91499999999999 | H13: 0.185 | I13: Turkey | J13: Data Engineering | K13: Conference
A14: International Conference on Data Engineering | B14: ICDE | C14: ICDE2006 | D14: 2006-04-03T00:00:00.000 | E14: 2006-04-07T00:00:00.000 | F14: 460 | G14: =RC[-1]*RC[1] -> 88.78 | H14: 0.193 | I14: USA | J14: Data Engineering | K14: Conference
A15: International Conference on Data Engineering | B15: ICDE | C15: ICDE2005 | D15: 2005-04-05T00:00:00.000 | E15: 2005-04-08T00:00:00.000 | F15: 521 | G15: =RC[-1]*RC[1] -> 67.209000000000003 | H15: 0.129 | I15: Japan | J15: Data Engineering | K15: Conference
A16: International Conference on Data Engineering | B16: ICDE | C16: ICDE2004 | D16: 2004-03-30T00:00:00.000 | E16: 2004-04-02T00:00:00.000 | F16: 441 | G16: =RC[-1]*RC[1] -> 63.063000000000009 | H16: 0.14300000000000002 | I16: USA | J16: Data Engineering | K16: Conference
A17: International Conference on Data Engineering | B17: ICDE | C17: ICDE2003 | D17: 2003-03-05T00:00:00.000 | E17: 2003-03-08T00:00:00.000 | F17: 378 | G17: =RC[-1]*RC[1] -> 51.03 | H17: 0.13500000000000001 | I17: India | J17: Data Engineering | K17: Conference
A18: International Conference on Data Engineering | B18: ICDE | C18: ICDE2002 | D18: 2002-02-26T00:00:00.000 | E18: 2002-03-01T00:00:00.000 | F18: 287 | G18: =RC[-1]*RC[1] -> 53.956000000000003 | H18: 0.188 | I18: USA | J18: Data Engineering | K18: Conference
A19: International Conference on Data Engineering | B19: ICDE | C19: ICDE2001 | D19: 2001-04-02T00:00:00.000 | E19: 2001-04-04T00:00:00.000 | F19: 300 | G19: =RC[-1]*RC[1] -> 50.099999999999994 | H19: 0.16699999999999998 | I19: Germany | J19: Data Engineering | K19: Conference
A20: International Conference on Data Engineering | B20: ICDE | C20: ICDE2000 | D20: 2000-02-28T00:00:00.000 | E20: 2000-03-03T00:00:00.000 | F20: 287 | G20: =RC[-1]*RC[1] -> 41.041000000000004 | H20: 0.14300000000000002 | I20: USA | J20: Data Engineering | K20: Conference
A21: International Conference on Data Engineering | B21: ICDE | C21: ICDE1999 | D21: 1999-03-23T00:00:00.000 | E21: 1999-03-26T00:00:00.000 | F21: 272 | G21: =RC[-1]*RC[1] -> 41.887999999999998 | H21: 0.154 | I21: Australia | J21: Data Engineering | K21: Conference
A22: International Conference on Data Engineering | B22: ICDE | C22: ICDE1998 | D22: 1998-02-23T00:00:00.000 | E22: 1998-02-27T00:00:00.000 | F22: 252 | G22: =RC[-1]*RC[1] -> 55.944000000000003 | H22: 0.222 | I22: USA | J22: Data Engineering | K22: Conference
A23: International Conference on Data Engineering | B23: ICDE | C23: ICDE1997 | D23: 1997-04-07T00:00:00.000 | E23: 1997-04-11T00:00:00.000 | F23: 240 | G23: =RC[-1]*RC[1] -> 45.12 | H23: 0.188 | I23: UK | J23: Data Engineering | K23: Conference
A24: International Conference on Data Engineering | B24: ICDE | C24: ICDE1996 | D24: 1996-02-26T00:00:00.000 | E24: 1996-03-01T00:00:00.000 | F24: 264 | G24: =RC[-1]*RC[1] -> 59.927999999999997 | H24: 0.22699999999999998 | I24: USA | J24: Data Engineering | K24: Conference
A25: International Conference on Data Engineering | B25: ICDE | C25: ICDE1995 | D25: 1995-03-06T00:00:00.000 | E25: 1995-03-10T00:00:00.000 | F25: 233 | G25: =RC[-1]*RC[1] -> 55.919999999999995 | H25: 0.24 | I25: Taiwan | J25: Data Engineering | K25: Conference
A26: International Conference on Data Engineering | B26: ICDE | C26: ICDE1994 | D26: 1994-02-14T00:00:00.000 | E26: 1994-02-18T00:00:00.000 | F26: 270 | G26: =RC[-1]*RC[1] -> 49.95 | H26: 0.185 | I26: Taiwan | J26: Data Engineering | K26: Conference
A27: International Conference on Data Engineering | B27: ICDE | C27: ICDE1993 | D27: 1993-02-19T00:00:00.000 | E27: 1993-02-23T00:00:00.000 | F27: 286 | G27: =RC[-1]*RC[1] -> 72.072000000000003 | H27: 0.252 | I27: Austria | J27: Data Engineering | K27: Conference
A28: International Conference on Data Engineering | B28: ICDE | C28: ICDE1992 | D28: 1992-02-02T00:00:00.000 | E28: 1992-02-03T00:00:00.000 | I28: USA | J28: Data Engineering | K28: Conference
A29: International Conference on Data Engineering | B29: ICDE | C29: ICDE1991 | D29: 1991-02-08T00:00:00.000 | E29: 1991-02-12T00:00:00.000 | I29: Japan | J29: Data Engineering | K29: Conference
A30: International Conference on Data Engineering | B30: ICDE | C30: ICDE1990 | D30: 1990-02-05T00:00:00.000 | E30: 1990-02-09T00:00:00.000 | I30: USA | J30: Data Engineering | K30: Conference
A31: International Conference on Data Engineering | B31: ICDE | C31: ICDE1989 | D31: 1989-02-06T00:00:00.000 | E31: 1989-02-10T00:00:00.000 | I31: USA | J31: Data Engineering | K31: Conference
A32: International Conference on Data Engineering | B32: ICDE | C32: ICDE1988 | D32: 1988-02-01T00:00:00.000 | E32: 1988-02-05T00:00:00.000 | I32: USA | J32: Data Engineering | K32: Conference
A33: International Conference on Data Engineering | B33: ICDE | C33: ICDE1987 | D33: 1987-02-03T00:00:00.000 | E33: 1987-02-05T00:00:00.000 | I33: USA | J33: Data Engineering | K33: Conference
A34: International Conference on Data Engineering | B34: ICDE | C34: ICDE1986 | D34: 1986-02-05T00:00:00.000 | E34: 1986-02-07T00:00:00.000 | I34: USA | J34: Data Engineering | K34: Conference
A35: International Conference on Data Engineering | B35: ICDE | C35: ICDE1984 | D35: 1984-04-24T00:00:00.000 | E35: 1984-04-27T00:00:00.000 | I35: USA | J35: Data Engineering | K35: Conference

Sheet: UIST
A1: Title | B1: Event[Start date] | C1: Event[Acronym] | D1: Event[Series] | E1: Event[Start date] | F1: Event[End date] | G1: Event[Submitted papers] | H1: Event[Accepted papers] | I1: Event[Acceptance Rate] | J1: Event[City] | K1: Event[State] | L1: Event[Country] | M1: Event[Field] | N1: Event[Type] | O1: Event[Homepage]
A2: 31st ACM Symposium on USer Interface Software and Technology | B2: 2018 | C2: UIST 2018 | D2: UIST | E2: 2018-10-14T00:00:00.000 | F2: 2018-10-17T00:00:00.000 | J2: Berlin | L2: Germany | M2: Computer Vision | N2: Symposium | O2: uist.acm.org/uist2018/
A3: 30th ACM Symposium on USer Interface Software and Technology | B3: 2017 | C3: UIST 2017 | D3: UIST | E3: 2017-10-22T00:00:00.000 | F3: 2017-10-25T00:00:00.000 | G3: 324 | H3: 73 | I3: =RC[-1]/RC[-2] -> 0.22530864197530864 | J3: Quebec City | L3: Canada | M3: Computer Vision | N3: Symposium | O3: uist.acm.org/uist2017/
A4: 29th ACM Symposium on USer Interface Software and Technology | B4: 2016 | C4: UIST 2016 | D4: UIST | E4: 2016-10-16T00:00:00.000 | F4: 2016-10-19T00:00:00.000 | G4: 384 | H4: 79 | I4: =RC[-1]/RC[-2] -> 0.20572916666666666 | J4: Tokyo | L4: Japan | M4: Computer Vision | N4: Symposium | O4: uist.acm.org/uist2016/
A5: 28th ACM Symposium on USer Interface Software and Technology | B5: 2015 | C5: UIST 2015 | D5: UIST | E5: 2015-11-08T00:00:00.000 | F5: 2015-11-11T00:00:00.000 | G5: 297 | H5: 70 | I5: =RC[-1]/RC[-2] -> 0.2356902356902357 | J5: Charlotte | L5: USA | M5: Computer Vision | N5: Symposium | O5: uist.acm.org/uist2015/
A6: 27th ACM Symposium on USer Interface Software and Technology | B6: 2014 | C6: UIST 2014 | D6: UIST | E6: 2014-10-05T00:00:00.000 | F6: 2014-10-08T00:00:00.000 | G6: 333 | H6: 74 | I6: =RC[-1]/RC[-2] -> 0.22222222222222221 | J6: Honolulo | L6: USA | M6: Computer Vision | N6: Symposium | O6: uist.acm.org/uist2014/
A7: 26th ACM Symposium on USer Interface Software and Technology | B7: 2013 | C7: UIST 2013 | D7: UIST | E7: 2013-10-08T00:00:00.000 | F7: 2013-10-11T00:00:00.000 | G7: 317 | H7: 62 | I7: =RC[-1]/RC[-2] -> 0.19558359621451105 | J7: St Andrews | K7: Scotland | L7: UK | M7: Computer Vision | N7: Symposium | O7: uist.acm.org/uist2013/
A8: 25th ACM Symposium on USer Interface Software and Technology | B8: 2012 | C8: UIST 2012 | D8: UIST | E8: 2012-10-07T00:00:00.000 | F8: 2012-10-10T00:00:00.000 | G8: 288 | H8: 62 | I8: =RC[-1]/RC[-2] -> 0.21527777777777779 | J8: Cambridge | L8: USA | M8: Computer Vision | N8: Symposium | O8: uist.acm.org/uist2012/
A9: 24th ACM Symposium on USer Interface Software and Technology | B9: 2011 | C9: UIST 2011 | D9: UIST | E9: 2011-10-16T00:00:00.000 | F9: 2011-10-19T00:00:00.000 | G9: 262 | H9: 67 | I9: =RC[-1]/RC[-2] -> 0.25572519083969464 | J9: Santa Barbara | L9: USA | M9: Computer Vision | N9: Symposium | O9: uist.acm.org/uist2011/
A10: 23rd ACM Symposium on USer Interface Software and Technology | B10: 2010 | C10: UIST 2010 | D10: UIST | E10: 2010-10-03T00:00:00.000 | F10: 2010-10-06T00:00:00.000 | G10: 207 | H10: 38 | I10: =RC[-1]/RC[-2] -> 0.18357487922705315 | J10: New York | L10: USA | M10: Computer Vision | N10: Symposium | O10: uist.acm.org/uist2010/
A11: 22nd ACM Symposium on USer Interface Software and Technology | B11: 2009 | C11: UIST 2009 | D11: UIST | E11: 2009-10-04T00:00:00.000 | F11: 2009-10-07T00:00:00.000 | G11: 183 | H11: 33 | I11: =RC[-1]/RC[-2] -> 0.18032786885245902 | J11: Victoria | L11: USA | M11: Computer Vision | N11: Symposium | O11: uist.acm.org/uist2009/
A12: 21st ACM Symposium on USer Interface Software and Technology | B12: 2008 | C12: UIST 2008 | D12: UIST | E12: 2008-10-19T00:00:00.000 | F12: 2008-10-20T00:00:00.000 | G12: 115 | H12: 25 | I12: =RC[-1]/RC[-2] -> 0.21739130434782608 | J12: Montery | L12: USA | M12: Computer Vision | N12: Symposium | O12: uist.acm.org/uist2008/
A13: 20th ACM Symposium on USer Interface Software and Technology | B13: 2007 | C13: UIST 2007 | D13: UIST | E13: 2007-10-07T00:00:00.000 | F13: 2007-10-10T00:00:00.000 | G13: 129 | H13: 24 | I13: =RC[-1]/RC[-2] -> 0.18604651162790697 | J13: Newport | L13: UK | M13: Computer Vision | N13: Symposium | O13: uist.acm.org/uist2007/
A14: 19th ACM Symposium on USer Interface Software and Technology | B14: 2006 | C14: UIST 2006 | D14: UIST | E14: 2006-10-15T00:00:00.000 | F14: 2006-10-18T00:00:00.000 | G14: 177 | H14: 40 | I14: =RC[-1]/RC[-2] -> 0.22598870056497175 | J14: Montreux | L14: Switzerland | M14: Computer Vision | N14: Symposium | O14: uist.acm.org/uist2006/
A15: 18th ACM Symposium on USer Interface Software and Technology | B15: 2005 | C15: UIST 2005 | D15: UIST | E15: 2005-10-23T00:00:00.000 | F15: 2005-10-26T00:00:00.000 | G15: 159 | H15: 31 | I15: =RC[-1]/RC[-2] -> 0.19496855345911951 | J15: Seattle | L15: USA | M15: Computer Vision | N15: Symposium | O15: uist.acm.org/uist2005/
A16: 17th ACM Symposium on USer Interface Software and Technology | B16: 2004 | C16: UIST 2004 | D16: UIST | E16: 2004-10-24T00:00:00.000 | F16: 2004-10-27T00:00:00.000 | G16: 170 | H16: 36 | I16: =RC[-1]/RC[-2] -> 0.21176470588235294 | J16: Santa Fe | L16: USA | M16: Computer Vision | N16: Symposium | O16: uist.acm.org/uist2004/
A17: 16th ACM Symposium on USer Interface Software and Technology | B17: 2003 | C17: UIST 2003 | D17: UIST | E17: 2003-11-02T00:00:00.000 | F17: 2003-11-05T00:00:00.000 | G17: 116 | H17: 25 | I17: =RC[-1]/RC[-2] -> 0.21551724137931033 | J17: Vancouver | L17: Canada | M17: Computer Vision | N17: Symposium | O17: uist.acm.org/uist2003/
A18: 15th ACM Symposium on USer Interface Software and Technology | B18: 2002 | C18: UIST 2002 | D18: UIST | E18: 2002-11-27T00:00:00.000 | F18: 2002-11-30T00:00:00.000 | G18: 129 | H18: 24 | I18: =RC[-1]/RC[-2] -> 0.18604651162790697 | J18: Paris | L18: France | M18: Computer Vision | N18: Symposium | O18: uist.acm.org/uist2002/
A19: 14th ACM Symposium on USer Interface Software and Technology | B19: 2001 | C19: UIST 2001 | D19: UIST | E19: 2001-11-11T00:00:00.000 | F19: 2001-11-14T00:00:00.000 | G19: 133 | H19: 25 | I19: =RC[-1]/RC[-2] -> 0.18796992481203006 | J19: Orlando | L19: USA | M19: Computer Vision | N19: Symposium | O19: uist.acm.org/uist2001/
A20: 13th ACM Symposium on USer Interface Software and Technology | B20: 2000 | C20: UIST 2000 | D20: UIST | E20: 2000-11-06T00:00:00.000 | F20: 2000-11-08T00:00:00.000 | G20: 119 | H20: 26 | I20: =RC[-1]/RC[-2] -> 0.21848739495798319 | J20: San Diego | L20: USA | M20: Computer Vision | N20: Symposium | O20: uist.acm.org/uist2000/
A21: 12th ACM Symposium on USer Interface Software and Technology | B21: 1999 | C21: UIST 1999 | D21: UIST | E21: 1999-11-07T00:00:00.000 | F21: 1999-11-10T00:00:00.000 | J21: Asheville | L21: USA | M21: Computer Vision | N21: Symposium | O21: uist.acm.org/uist1999/
A22: 11th ACM Symposium on USer Interface Software and Technology | B22: 1998 | C22: UIST 1998 | D22: UIST | E22: 1998-11-01T00:00:00.000 | F22: 1998-11-04T00:00:00.000 | J22: San Francisco | L22: USA | M22: Computer Vision | N22: Symposium | O22: uist.acm.org/uist1998/
A23: 10th ACM Symposium on USer Interface Software and Technology | B23: 1997 | C23: UIST 1997 | D23: UIST | E23: 1997-10-14T00:00:00.000 | F23: 1997-10-17T00:00:00.000 | J23: Banff | L23: Canada | M23: Computer Vision | N23: Symposium | O23: uist.acm.org/uist1997/
A24: 9th ACM Symposium on USer Interface Software and Technology | B24: 1996 | C24: UIST 1996 | D24: UIST | E24: 1996-11-06T00:00:00.000 | F24: 1996-11-08T00:00:00.000 | J24: Seattle | L24: USA | M24: Computer Vision | N24: Symposium | O24: uist.acm.org/uist1996/
A25: 8th ACM Symposium on USer Interface Software and Technology | B25: 1995 | C25: UIST 1995 | D25: UIST | E25: 1995-11-15T00:00:00.000 | F25: 1995-11-17T00:00:00.000 | J25: Pittsburgh | L25: USA | M25: Computer Vision | N25: Symposium | O25: uist.acm.org/uist1995/
A26: 7th ACM Symposium on USer Interface Software and Technology | B26: 1994 | C26: UIST 1994 | D26: UIST | E26: 1994-11-02T00:00:00.000 | F26: 1994-11-04T00:00:00.000 | J26: Marina del Rey | L26: USA | M26: Computer Vision | N26: Symposium | O26: uist.acm.org/uist1994/
A27: 6th ACM Symposium on USer Interface Software and Technology | B27: 1993 | C27: UIST 1993 | D27: UIST | E27: 1993-10-25T00:00:00.000 | F27: 1993-10-26T00:00:00.000 | J27: San Jose | L27: USA | M27: Computer Vision | N27: Symposium
A28: 5th ACM Symposium on USer Interface Software and Technology | B28: 1992 | C28: UIST 1992 | D28: UIST | E28: 1992-11-15T00:00:00.000 | F28: 1992-11-18T00:00:00.000 | J28: Monteray | L28: USA | M28: Computer Vision | N28: Symposium
A29: 4th ACM Symposium on USer Interface Software and Technology | B29: 1991 | C29: UIST 1991 | D29: UIST | E29: 1991-11-11T00:00:00.000 | F29: 1991-11-13T00:00:00.000 | J29: Hilton Head Island | L29: USA | M29: Computer Vision | N29: Symposium
A30: 3rd ACM Symposium on USer Interface Software and Technology | B30: 1990 | C30: UIST 1990 | D30: UIST | E30: 1990-10-03T00:00:00.000 | F30: 1990-10-05T00:00:00.000 | J30: Snowbird | L30: USA | M30: Computer Vision | N30: Symposium
A31: 2nd ACM Symposium on USer Interface Software and Technology | B31: 1989 | C31: UIST 1989 | D31: UIST | E31: 1989-11-13T00:00:00.000 | F31: 1989-11-15T00:00:00.000 | J31: Williamsburg | L31: USA | M31: Computer Vision | N31: Symposium
A32: 1st ACM Symposium on USer Interface Software and Technology | B32: 1988 | C32: UIST 1988 | D32: UIST | E32: 1988-10-17T00:00:00.000 | F32: 1988-10-19T00:00:00.000 | J32: Alberta | L32: Canada | M32: Computer Vision | N32: Symposium

Sheet: CCS
A1: Event[Title] | B1: Event[Start date] | C1: Event[Acronym] | D1: Event[Series] | E1: Event[Start date] | F1: Event[End date] | G1: Event[Submitted papers] | H1: Event[Accepted papers] | I1: Event[Submission Rate] | J1: Event[City] | K1: Event[State] | L1: Event[Country] | M1: Event[Field] | N1: Event[Type] | O1: Event[Homepage]
A2: Conference on Computer and Communications Security | B2: 2018 | C2: CCS 2018 | D2: CCS | E2: 2018-06-04T00:00:00.000 | F2: 2018-06-08T00:00:00.000 | J2: Songdo | L2: Korea | M2: Computer and Communications Security | N2: Conference | O2: http://asiaccs2018.org/
A3: Conference on Computer and Communications Security | B3: 2017 | C3: CCS 2017 | D3: CCS | E3: 2017-10-30T00:00:00.000 | F3: 2017-11-03T00:00:00.000 | G3: 836 | H3: 151 | I3: =RC[-1]/RC[-2] -> 0.18062200956937799 | J3: Dallas | L3: USA | M3: Computer and Communications Security | N3: Conference | O3: https://www.sigsac.org/ccs/CCS2017/
A4: Conference on Computer and Communications Security | B4: 2016 | C4: CCS 2016 | D4: CCS | E4: 2016-10-24T00:00:00.000 | F4: 2016-10-28T00:00:00.000 | G4: 831 | H4: 137 | I4: =RC[-1]/RC[-2] -> 0.16486161251504211 | J4: Hofburg Palace | K4: Vienna | L4: Austria | M4: Computer and Communications Security | N4: Conference | O4: https://www.sigsac.org/ccs/CCS2016/
A5: Conference on Computer and Communications Security | B5: 2015 | C5: CCS 2015 | D5: CCS | E5: 2015-10-12T00:00:00.000 | F5: 2015-10-16T00:00:00.000 | G5: 660 | H5: 128 | I5: =RC[-1]/RC[-2] -> 0.19393939393939394 | J5: Denver | K5: Colorado | L5: USA | M5: Computer and Communications Security | N5: Conference | O5: https://www.sigsac.org/ccs/CCS2015/
A6: Conference on Computer and Communications Security | B6: 2014 | C6: CCS 2014 | D6: CCS | E6: 2014-11-03T00:00:00.000 | F6: 2014-11-07T00:00:00.000 | G6: 585 | H6: 114 | I6: =RC[-1]/RC[-2] -> 0.19487179487179487 | J6: Scottsdale | K6: Arizona | L6: USA | M6: Computer and Communications Security | N6: Conference | O6: https://www.sigsac.org/ccs/CCS2014/
A7: Conference on Computer and Communications Security | B7: 2013 | C7: CCS 2013 | D7: CCS | E7: 2013-11-04T00:00:00.000 | F7: 2013-11-08T00:00:00.000 | G7: 530 | H7: 105 | I7: =RC[-1]/RC[-2] -> 0.19811320754716982 | J7: Berlin | L7: Germany | M7: Computer and Communications Security | N7: Conference | O7: https://www.sigsac.org/ccs/CCS2013/
A8: Conference on Computer and Communications Security | B8: 2012 | C8: CCS 2012 | D8: CCS | E8: 2012-10-16T00:00:00.000 | F8: 2012-10-18T00:00:00.000 | G8: 426 | H8: 81 | I8: =RC[-1]/RC[-2] -> 0.19014084507042253 | J8: Raleigh | K8: NC | L8: USA | M8: Computer and Communications Security | N8: Conference | O8: https://www.sigsac.org/ccs/CCS2012/
A9: Conference on Computer and Communications Security | B9: 2011 | C9: CCS 2011 | D9: CCS | E9: 2011-10-17T00:00:00.000 | F9: 2011-10-21T00:00:00.000 | G9: 429 | H9: 60 | I9: =RC[-1]/RC[-2] -> 0.13986013986013987 | J9: Chicago | K9: Illnois | L9: USA | M9: Computer and Communications Security | N9: Conference | O9: https://www.sigsac.org/ccs/CCS2011/
A10: Conference on Computer and Communications Security | B10: 2010 | C10: CCS 2010 | D10: CCS | E10: 2010-10-04T00:00:00.000 | F10: 2010-10-08T00:00:00.000 | G10: 325 | H10: 55 | I10: =RC[-1]/RC[-2] -> 0.16923076923076924 | J10: Chicago | K10: Illnois | L10: USA | M10: Computer and Communications Security | N10: Conference | O10: https://www.sigsac.org/ccs/CCS2010/
A11: Conference on Computer and Communications Security | B11: 2009 | C11: CCS 2009 | D11: CCS | E11: 2009-11-09T00:00:00.000 | F11: 2009-11-13T00:00:00.000 | G11: 317 | H11: 58 | I11: =RC[-1]/RC[-2] -> 0.18296529968454259 | J11: Chicago | K11: Illnois | L11: USA | M11: Computer and Communications Security | N11: Conference | O11: https://www.sigsac.org/ccs/CCS2009/
A12: Conference on Computer and Communications Security | B12: 2008 | C12: CCS 2008 | D12: CCS | E12: 2008-10-27T00:00:00.000 | F12: 2008-10-31T00:00:00.000 | G12: 274 | H12: 51 | I12: =RC[-1]/RC[-2] -> 0.18613138686131386 | J12: Alexandria | K12: Virginia | L12: USA | M12: Computer and Communications Security | N12: Conference | O12: https://www.sigsac.org/ccs/CCS2008/
A13: Conference on Computer and Communications Security | B13: 2007 | C13: CCS 2007 | D13: CCS | E13: 2007-10-29T00:00:00.000 | F13: 2007-11-02T00:00:00.000 | G13: 302 | H13: 55 | I13: =RC[-1]/RC[-2] -> 0.18211920529801323 | J13: Alexandria | K13: Virginia | L13: USA | M13: Computer and Communications Security | N13: Conference | O13: https://www.sigsac.org/ccs/CCS2007/
A14: Conference on Computer and Communications Security | B14: 2006 | C14: CCS 2006 | D14: CCS | E14: 2006-10-30T00:00:00.000 | F14: 2006-11-03T00:00:00.000 | G14: 256 | H14: 38 | I14: =RC[-1]/RC[-2] -> 0.1484375 | J14: Alexandria | K14: Virginia | L14: USA | M14: Computer and Communications Security | N14: Conference | O14: https://www.sigsac.org/ccs/CCS2006/
A15: Conference on Computer and Communications Security | B15: 2005 | C15: CCS 2005 | D15: CCS | E15: 2005-11-07T00:00:00.000 | F15: 2005-11-10T00:00:00.000 | G15: 250 | H15: 38 | I15: =RC[-1]/RC[-2] -> 0.152 | J15: Alexandria | K15: Virginia | L15: USA | M15: Computer and Communications Security | N15: Conference | O15: https://www.sigsac.org/ccs/CCS2005/
A16: Conference on Computer and Communications Security | B16: 2004 | C16: CCS 2004 | D16: CCS | E16: 2004-10-25T00:00:00.000 | F16: 2004-10-29T00:00:00.000 | G16: 224 | H16: 35 | I16: =RC[-1]/RC[-2] -> 0.15625 | J16: Washington | K16: DC | L16: USA | M16: Computer and Communications Security | N16: Conference | O16: https://www.sigsac.org/ccs/CCS2004/
A17: Conference on Computer and Communications Security | B17: 2003 | C17: CCS 2003 | D17: CCS | E17: 2003-10-27T00:00:00.000 | F17: 2003-10-30T00:00:00.000 | G17: 253 | H17: 35 | I17: =RC[-1]/RC[-2] -> 0.13833992094861661 | J17: Washington | K17: DC | L17: USA | M17: Computer and Communications Security | N17: Conference
A18: Conference on Computer and Communications Security | B18: 2002 | C18: CCS 2002 | D18: CCS | E18: 2002-11-18T00:00:00.000 | F18: 2002-11-22T00:00:00.000 | G18: 153 | H18: 27 | I18: =RC[-1]/RC[-2] -> 0.17647058823529413 | J18: Washington | K18: DC | L18: USA | M18: Computer and Communications Security | N18: Conference | O18: http://sigsac.org/ccs.html
A19: Conference on Computer and Communications Security | B19: 2001 | C19: CCS 2001 | D19: CCS | E19: 2001-11-05T00:00:00.000 | F19: 2001-11-08T00:00:00.000 | G19: 153 | H19: 27 | I19: =RC[-1]/RC[-2] -> 0.17647058823529413 | J19: Philadelphia | K19: PA | L19: USA | M19: Computer and Communications Security | N19: Conference | O19: http://sigsac.org/ccs.html
A20: Conference on Computer and Communications Security | B20: 2000 | C20: CCS 2000 | D20: CCS | E20: 2000-11-01T00:00:00.000 | F20: 2000-11-04T00:00:00.000 | G20: 132 | H20: 28 | I20: =RC[-1]/RC[-2] -> 0.21212121212121213 | J20: Athens | L20: Greece | M20: Computer and Communications Security | N20: Conference | O20: http://sigsac.org/ccs.html
A21: Conference on Computer and Communications Security | B21: 1999 | C21: CCS 1999 | D21: CCS | E21: 1999-11-01T00:00:00.000 | F21: 1999-11-04T00:00:00.000 | G21: 83 | H21: 16 | I21: =RC[-1]/RC[-2] -> 0.19277108433734941 | J21: Singapore | L21: Singapore | M21: Computer and Communications Security | N21: Conference | O21: http://sigsac.org/ccs.html
A22: Conference on Computer and Communications Security | B22: 1998 | C22: CCS 1998 | D22: CCS | E22: 1998-11-02T00:00:00.000 | F22: 1988-11-05T00:00:00.000 | G22: 85 | H22: 17 | I22: =RC[-1]/RC[-2] -> 0.2 | J22: San Francisco | K22: California | L22: USA | M22: Computer and Communications Security | N22: Conference | O22: http://sigsac.org/ccs.html
A23: Conference on Computer and Communications Security | B23: 1997 | C23: CCS 1997 | D23: CCS | E23: 1997-04-01T00:00:00.000 | F23: 1997-04-04T00:00:00.000 | G23: 64 | H23: 17 | I23: =RC[-1]/RC[-2] -> 0.265625 | J23: Zurich | L23: Switzerland | M23: Computer and Communications Security | N23: Conference | O23: http://sigsac.org/ccs.html
A24: Conference on Computer and Communications Security | B24: 1996 | C24: CCS 1996 | D24: CCS | E24: 1996-03-14T00:00:00.000 | F24: 1996-03-15T00:00:00.000 | G24: 59 | H24: 19 | I24: =RC[-1]/RC[-2] -> 0.32203389830508472 | J24: New Delhi | L24: India | M24: Computer and Communications Security | N24: Conference | O24: http://sigsac.org/ccs.html
A25: Conference on Computer and Communications Security | B25: 1995 | C25: CCS 1995 | D25: CCS | E25: 1995-11-07T00:00:00.000 | F25: 1995-11-11T00:00:00.000 | G25: 65 | H25: 38 | I25: =RC[-1]/RC[-2] -> 0.58461538461538465 | J25: Alexandria, | K25: VA | L25: USA | M25: Computer and Communications Security | N25: Conference
A26: Conference on Computer and Communications Security | B26: 1994 | C26: CCS 1994 | D26: CCS | E26: 1994-11-02T00:00:00.000 | F26: 1994-11-04T00:00:00.000 | G26: 70 | H26: 31 | I26: =RC[-1]/RC[-2] -> 0.44285714285714284 | J26: Fairfax | K26: VA | L26: USA | M26: Computer and Communications Security | N26: Conference | O26: http://sigsac.org/ccs.html
A27: Conference on Computer and Communications Security | B27: 1993 | C27: CCS 1993 | D27: CCS | E27: 1993-11-03T00:00:00.000 | F27: 1993-11-05T00:00:00.000 | G27: 60 | H27: 27 | I27: =RC[-1]/RC[-2] -> 0.45 | J27: Fairfax | K27: VA | L27: USA | M27: Computer and Communications Security | N27: Conference | O27: http://sigsac.org/ccs.html

Sheet: SP
A1: Title | B1: Event[Start date] | C1: Event[Acronym] | D1: Event[Series] | E1: Event[Start date] | F1: Event[End date] | G1: Event[Submitted papers] | H1: Event[Accepted papers] | I1: Event[Submission Rate] | J1: Event[City] | K1: Event[State] | L1: Event[Country] | M1: Event[Field] | N1: Event[Type] | O1: Event[Homepage]
A2: IEEE Symposium on Security and Privacy | B2: 2018 | C2: S&P 2018 | D2: S&P | E2: 2018-05-21T00:00:00.000 | F2: 2018-05-23T00:00:00.000 | J2: San Francisco | K2: California | L2: USA | M2: Security | N2: Symposium | O2: www.ieee-security.org/TC/SP2018/
A3: IEEE Symposium on Security and Privacy | B3: 2017 | C3: S&P 2017 | D3: S&P | E3: 2017-05-22T00:00:00.000 | F3: 2017-05-26T00:00:00.000 | G3: 463 | H3: 60 | I3: =RC[-1]/RC[-2] -> 0.12958963282937366 | J3: San Jose | K3: California | L3: USA | M3: Security | N3: Symposium | O3: www.ieee-security.org/TC/SP2017/
A4: IEEE Symposium on Security and Privacy | B4: 2016 | C4: S&P 2016 | D4: S&P | E4: 2016-05-22T00:00:00.000 | F4: 2016-05-26T00:00:00.000 | G4: 398 | H4: 55 | I4: =RC[-1]/RC[-2] -> 0.13819095477386933 | J4: San Jose | K4: California | L4: USA | M4: Security | N4: Symposium | O4: www.ieee-security.org/TC/SP2016/
A5: IEEE Symposium on Security and Privacy | B5: 2015 | C5: S&P 2015 | D5: S&P | E5: 2015-05-17T00:00:00.000 | F5: 2015-05-21T00:00:00.000 | G5: =RC[1]/RC[2] -> 422.22222222222217 | H5: 57 | I5: 0.13500000000000001 | J5: San Jose | K5: California | L5: USA | M5: Security | N5: Symposium | O5: www.ieee-security.org/TC/SP2015/
A6: IEEE Symposium on Security and Privacy | B6: 2014 | C6: S&P 2014 | D6: S&P | E6: 2014-05-18T00:00:00.000 | F6: 2014-05-21T00:00:00.000 | G6: 333 | H6: 44 | I6: =RC[-1]/RC[-2] -> 0.13213213213213212 | J6: Berkeley | K6: California | L6: USA | M6: Security | N6: Symposium | O6: www.ieee-security.org/TC/SP2014/
A7: IEEE Symposium on Security and Privacy | B7: 2013 | C7: S&P 2013 | D7: S&P | E7: 2013-05-19T00:00:00.000 | F7: 2013-05-22T00:00:00.000 | G7: 315 | H7: 38 | I7: =RC[-1]/RC[-2] -> 0.12063492063492064 | J7: Berkeley | K7: California | L7: USA | M7: Security | N7: Symposium | O7: www.ieee-security.org/TC/SP2013/
A8: IEEE Symposium on Security and Privacy | B8: 2012 | C8: S&P 2012 | D8: S&P | E8: 2012-05-21T00:00:00.000 | F8: 2012-05-23T00:00:00.000 | G8: 307 | H8: 40 | I8: =RC[-1]/RC[-2] -> 0.13029315960912052 | J8: San Francisco | K8: California | L8: USA | M8: Security | N8: Symposium | O8: www.ieee-security.org/TC/SP2012/
A9: IEEE Symposium on Security and Privacy | B9: 2011 | C9: S&P 2011 | D9: S&P | E9: 2011-05-22T00:00:00.000 | F9: 2011-05-25T00:00:00.000 | G9: 306 | H9: 34 | I9: =RC[-1]/RC[-2] -> 0.1111111111111111 | J9: Berkeley | K9: California | L9: USA | M9: Security | N9: Symposium | O9: www.ieee-security.org/TC/SP2011/
A10: IEEE Symposium on Security and Privacy | B10: 2010 | C10: S&P 2010 | D10: S&P | E10: 2010-05-16T00:00:00.000 | F10: 2010-05-19T00:00:00.000 | G10: 237 | H10: 20 | I10: =RC[-1]/RC[-2] -> 8.4388185654008435E-2 | J10: Oakland | K10: California | L10: USA | M10: Security | N10: Symposium | O10: www.ieee-security.org/TC/SP2010/
A11: IEEE Symposium on Security and Privacy | B11: 2009 | C11: S&P 2009 | D11: S&P | E11: 2009-05-17T00:00:00.000 | F11: 2009-05-20T00:00:00.000 | G11: 254 | H11: 26 | I11: =RC[-1]/RC[-2] -> 0.10236220472440945 | J11: Oakland | K11: California | L11: USA | M11: Security | N11: Symposium | O11: www.ieee-security.org/TC/SP2009/
A12: IEEE Symposium on Security and Privacy | B12: 2008 | C12: S&P 2008 | D12: S&P | E12: 2008-05-18T00:00:00.000 | F12: 2008-05-21T00:00:00.000 | G12: 249 | H12: 28 | I12: =RC[-1]/RC[-2] -> 0.11244979919678715 | J12: Oakland | K12: California | L12: USA | M12: Security | N12: Symposium | O12: www.ieee-security.org/TC/SP2008/
A13: IEEE Symposium on Security and Privacy | B13: 2007 | C13: S&P 2007 | D13: S&P | E13: 2007-05-20T00:00:00.000 | F13: 2007-05-23T00:00:00.000 | G13: 246 | H13: 29 | I13: =RC[-1]/RC[-2] -> 0.11788617886178862 | J13: Oakland | K13: California | L13: USA | M13: Security | N13: Symposium | O13: www.ieee-security.org/TC/SP2007/
A14: IEEE Symposium on Security and Privacy | B14: 2006 | C14: S&P 2006 | D14: S&P | E14: 2006-05-21T00:00:00.000 | F14: 2006-05-24T00:00:00.000 | G14: 251 | H14: 32 | I14: =RC[-1]/RC[-2] -> 0.12749003984063745 | J14: Berkeley | K14: California | L14: USA | M14: Security | N14: Symposium | O14: www.ieee-security.org/TC/SP2006/oakland06-home.html
A15: IEEE Symposium on Security and Privacy | B15: 2005 | C15: S&P 2005 | D15: S&P | E15: 2005-05-08T00:00:00.000 | F15: 2005-05-11T00:00:00.000 | G15: 192 | H15: 17 | I15: =RC[-1]/RC[-2] -> 8.8541666666666671E-2 | J15: Oakland | K15: California | L15: USA | M15: Security | N15: Symposium | O15: www.ieee-security.org/TC/SP2005/oakland05.html
A16: IEEE Symposium on Security and Privacy | B16: 2004 | C16: S&P 2004 | D16: S&P | E16: 2004-05-09T00:00:00.000 | F16: 2004-05-12T00:00:00.000 | G16: 186 | H16: 19 | I16: =RC[-1]/RC[-2] -> 0.10215053763440861 | J16: Berkeley | K16: California | L16: USA | M16: Security | N16: Symposium | O16: www.ieee-security.org/TC/SP2004/oakland04.html
A17: IEEE Symposium on Security and Privacy | B17: 2003 | C17: S&P 2003 | D17: S&P | E17: 2003-05-11T00:00:00.000 | F17: 2003-05-14T00:00:00.000 | G17: 131 | H17: 19 | I17: =RC[-1]/RC[-2] -> 0.14503816793893129 | J17: Berkeley | K17: California | L17: USA | M17: Security | N17: Symposium | O17: www.ieee-security.org/TC/SP2003/Copy-of-SP-2003-cfp.html
A18: IEEE Symposium on Security and Privacy | B18: 2002 | C18: S&P 2002 | D18: S&P | E18: 2002-05-12T00:00:00.000 | F18: 2002-05-15T00:00:00.000 | G18: 95 | H18: 21 | I18: =RC[-1]/RC[-2] -> 0.22105263157894736 | J18: Berkeley | K18: California | L18: USA | M18: Security | N18: Symposium | O18: www.ieee-security.org/TC/SP02/sp02index.html
A19: IEEE Symposium on Security and Privacy | B19: 2001 | C19: S&P 2001 | D19: S&P | E19: 2001-05-14T00:00:00.000 | F19: 2001-05-16T00:00:00.000 | G19: 107 | H19: 19 | I19: =RC[-1]/RC[-2] -> 0.17757009345794392 | J19: Oakland | K19: California | L19: USA | M19: Security | N19: Symposium
A20: IEEE Symposium on Security and Privacy | B20: 2000 | C20: S&P 2000 | D20: S&P | E20: 2000-05-14T00:00:00.000 | F20: 2000-05-17T00:00:00.000 | G20: 137 | H20: 18 | I20: =RC[-1]/RC[-2] -> 0.13138686131386862 | J20: Oakland | K20: California | L20: USA | M20: Security | N20: Symposium
A21: IEEE Symposium on Security and Privacy | B21: 1999 | C21: S&P 1999 | D21: S&P | E21: 1999-05-09T00:00:00.000 | F21: 1999-05-12T00:00:00.000 | G21: 61 | H21: 15 | I21: =RC[-1]/RC[-2] -> 0.24590163934426229 | J21: Oakland | K21: California | L21: USA | M21: Security | N21: Symposium
A22: IEEE Symposium on Security and Privacy | B22: 1998 | C22: S&P 1998 | D22: S&P | E22: 1998-05-03T00:00:00.000 | F22: 1998-05-06T00:00:00.000 | G22: 116 | H22: 19 | I22: =RC[-1]/RC[-2] -> 0.16379310344827586 | J22: Oakland | K22: California | L22: USA | M22: Security | N22: Symposium
A23: IEEE Symposium on Security and Privacy | B23: 1997 | C23: S&P 1997 | D23: S&P | E23: 1997-05-04T00:00:00.000 | F23: 1997-05-07T00:00:00.000 | G23: 110 | H23: 20 | I23: =RC[-1]/RC[-2] -> 0.18181818181818182 | J23: Oakland | K23: California | L23: USA | M23: Security | N23: Symposium
A24: IEEE Symposium on Security and Privacy | B24: 1996 | C24: S&P 1996 | D24: S&P | E24: 1996-05-06T00:00:00.000 | F24: 1996-05-08T00:00:00.000 | G24: 67 | H24: 20 | I24: =RC[-1]/RC[-2] -> 0.29850746268656714 | J24: Oakland | K24: California | L24: USA | M24: Security | N24: Symposium
A25: IEEE Symposium on Security and Privacy | B25: 1995 | C25: S&P 1995 | D25: S&P | E25: 1995-05-08T00:00:00.000 | F25: 1995-05-10T00:00:00.000 | G25: 72 | H25: 20 | I25: =RC[-1]/RC[-2] -> 0.27777777777777779 | J25: Oakland | K25: California | L25: USA | M25: Security | N25: Symposium
A26: IEEE Symposium on Security and Privacy | B26: 1994 | C26: S&P 1994 | D26: S&P | E26: 1994-05-16T00:00:00.000 | F26: 1994-05-18T00:00:00.000 | G26: 65 | H26: 19 | I26: =RC[-1]/RC[-2] -> 0.29230769230769232 | J26: Oakland | K26: California | L26: USA | M26: Security | N26: Symposium
A27: IEEE Symposium on Security and Privacy | B27: 1993 | C27: S&P 1993 | D27: S&P | E27: 1993-05-24T00:00:00.000 | F27: 1993-05-26T00:00:00.000 | G27: 70 | H27: 17 | I27: =RC[-1]/RC[-2] -> 0.24285714285714285 | J27: Oakland | K27: California | L27: USA | M27: Security | N27: Symposium
A28: IEEE Symposium on Security and Privacy | B28: 1992 | C28: S&P 1992 | D28: S&P | E28: 1992-05-04T00:00:00.000 | F28: 1992-05-06T00:00:00.000 | G28: 89 | H28: 21 | I28: =RC[-1]/RC[-2] -> 0.23595505617977527 | J28: Oakland | K28: California | L28: USA | M28: Security | N28: Symposium
A29: IEEE Symposium on Security and Privacy | B29: 1991 | C29: S&P 1991 | D29: S&P | E29: 1991-05-20T00:00:00.000 | F29: 1991-05-22T00:00:00.000 | G29: 92 | H29: 28 | I29: =RC[-1]/RC[-2] -> 0.30434782608695654 | J29: Oakland | K29: California | L29: USA | M29: Security | N29: Symposium
A30: IEEE Symposium on Security and Privacy | B30: 1990 | C30: S&P 1990 | D30: S&P | E30: 1990-05-07T00:00:00.000 | F30: 1990-05-09T00:00:00.000 | J30: Oakland | K30: California | L30: USA | M30: Security | N30: Symposium
A31: IEEE Symposium on Security and Privacy | B31: 1989 | C31: S&P 1989 | D31: S&P | E31: 1989-05-01T00:00:00.000 | F31: 1989-05-03T00:00:00.000 | J31: Oakland | K31: California | L31: USA | M31: Security | N31: Symposium
A32: IEEE Symposium on Security and Privacy | B32: 1988 | C32: S&P 1988 | D32: S&P | E32: 1988-04-18T00:00:00.000 | F32: 1988-04-21T00:00:00.000 | J32: Oakland | K32: California | L32: USA | M32: Security | N32: Symposium
A33: IEEE Symposium on Security and Privacy | B33: 1987 | C33: S&P 1987 | D33: S&P | E33: 1987-04-27T00:00:00.000 | F33: 1987-04-29T00:00:00.000 | J33: Oakland | K33: California | L33: USA | M33: Security | N33: Symposium
A34: IEEE Symposium on Security and Privacy | B34: 1986 | C34: S&P 1986 | D34: S&P | E34: 1986-05-07T00:00:00.000 | F34: 1986-05-09T00:00:00.000 | G34: 91 | H34: 25 | I34: =RC[-1]/RC[-2] -> 0.27472527472527475 | J34: Oakland | K34: California | L34: USA | M34: Security | N34: Symposium
A35: IEEE Symposium on Security and Privacy | B35: 1985 | C35: S&P 1985 | D35: S&P | E35: 1985-04-22T00:00:00.000 | F35: 1985-04-25T00:00:00.000 | G35: 63 | H35: 25 | I35: =RC[-1]/RC[-2] -> 0.3968253968253968 | J35: Oakland | K35: California | L35: USA | M35: Security | N35: Symposium
A36: IEEE Symposium on Security and Privacy | B36: 1984 | C36: S&P 1984 | D36: S&P | E36: 1984-04-29T00:00:00.000 | F36: 1984-05-02T00:00:00.000 | G36: 39 | H36: 25 | I36: =RC[-1]/RC[-2] -> 0.64102564102564108 | J36: Oakland | K36: California | L36: USA | M36: Security | N36: Symposium
A37: IEEE Symposium on Security and Privacy | B37: 1983 | C37: S&P 1983 | D37: S&P | E37: 1983-04-25T00:00:00.000 | F37: 1983-04-29T00:00:00.000 | G37: 34 | H37: 23 | I37: =RC[-1]/RC[-2] -> 0.67647058823529416 | J37: Oakland | K37: California | L37: USA | M37: Security | N37: Symposium
A38: IEEE Symposium on Security and Privacy | B38: 1982 | C38: S&P 1982 | D38: S&P | E38: 1982-04-26T00:00:00.000 | F38: 1982-04-28T00:00:00.000 | G38: 34 | H38: 19 | I38: =RC[-1]/RC[-2] -> 0.55882352941176472 | J38: Oakland | K38: California | L38: USA | M38: Security | N38: Symposium
A39: IEEE Symposium on Security and Privacy | B39: 1981 | C39: S&P 1981 | D39: S&P | E39: 1981-04-27T00:00:00.000 | F39: 1981-04-29T00:00:00.000 | H39: 18 | J39: Oakland | K39: California | L39: USA | M39: Security | N39: Symposium
A40: IEEE Symposium on Security and Privacy | B40: 1980 | C40: S&P 1980 | D40: S&P | E40: 1980-04-14T00:00:00.000 | F40: 1980-04-16T00:00:00.000 | H40: 19 | J40: Oakland | K40: California | L40: USA | M40: Security | N40: Symposium

Sheet: USENIX
A1: Title | B1: Event[Start date] | C1: Event[Acronym] | D1: Event[Series] | E1: Event[Start date] | F1: Event[End date] | G1: Event[Submitted papers] | H1: Event[Accepted papers] | I1: Event[Acceptance Rate] | J1: Event[City] | K1: Event[Country] | L1: Event[Field] | M1: Event[Type] | N1: Event[Homepage]
A2: 28th Usenix Security Symposium | B2: 2019 | C2: USENIX 2019 | D2: USENIX | J2: Santa Clara | K2: USA | L2: Computer Security | M2: Conference
A3: 27th Usenix Security Symposium | B3: 2018 | C3: USENIX 2018 | D3: USENIX | E3: 2018-08-15T00:00:00.000 | F3: 2018-08-17T00:00:00.000 | J3: Baltimore | K3: USA | L3: Computer Security | M3: Conference | N3: www.usenix.org/conference/usenixsecurity18
A4: 26th Usenix Security Symposium | B4: 2017 | C4: USENIX 2017 | D4: USENIX | E4: 2017-08-16T00:00:00.000 | F4: 2017-08-18T00:00:00.000 | G4: 572 | H4: 85 | I4: =RC[-1]/RC[-2] -> 0.14860139860139859 | J4: Vancouver | K4: Canada | L4: Computer Security | M4: Conference | N4: www.usenix.org/conference/usenixsecurity17
A5: 25th Usenix Security Symposium | B5: 2016 | C5: USENIX 2016 | D5: USENIX | E5: 2016-08-10T00:00:00.000 | F5: 2016-08-12T00:00:00.000 | G5: 468 | H5: 72 | I5: =RC[-1]/RC[-2] -> 0.15384615384615385 | J5: Austin | K5: USA | L5: Computer Security | M5: Conference | N5: www.usenix.org/conference/usenixsecurity16
A6: 24th Usenix Security Symposium | B6: 2015 | C6: USENIX 2015 | D6: USENIX | E6: 2015-08-12T00:00:00.000 | F6: 2015-08-14T00:00:00.000 | G6: 426 | H6: 198 | I6: =RC[-1]/RC[-2] -> 0.46478873239436619 | J6: Washington | K6: USA | L6: Computer Security | M6: Conference | N6: www.usenix.org/conference/usenixsecurity15
A7: 23rd Usenix Security Symposium | B7: 2014 | C7: USENIX 2014 | D7: USENIX | E7: 2014-08-20T00:00:00.000 | F7: 2014-08-22T00:00:00.000 | G7: 350 | H7: 67 | I7: =RC[-1]/RC[-2] -> 0.19142857142857142 | J7: San Diego | K7: USA | L7: Computer Security | M7: Conference | N7: www.usenix.org/conference/usenixsecurity14
A8: 22nd Usenix Security Symposium | B8: 2013 | C8: USENIX 2013 | D8: USENIX | E8: 2013-08-14T00:00:00.000 | F8: 2013-08-16T00:00:00.000 | G8: 277 | H8: 44 | I8: =RC[-1]/RC[-2] -> 0.1588447653429603 | J8: Washington | K8: USA | L8: Computer Security | M8: Conference | N8: www.usenix.org/conference/usenixsecurity13
A9: 21th Usenix Security Symposium | B9: 2012 | C9: USENIX 2012 | D9: USENIX | E9: 2012-08-08T00:00:00.000 | F9: 2012-08-10T00:00:00.000 | G9: 222 | H9: 42 | I9: =RC[-1]/RC[-2] -> 0.1891891891891892 | J9: Bellevue | K9: USA | L9: Computer Security | M9: Conference | N9: www.usenix.org/conference/usenixsecurity12
A10: 20th Usenix Security Symposium | B10: 2011 | C10: USENIX 2011 | D10: USENIX | E10: 2011-08-08T00:00:00.000 | F10: 2011-08-12T00:00:00.000 | G10: 206 | H10: 35 | I10: =RC[-1]/RC[-2] -> 0.16990291262135923 | J10: San Francisco | K10: USA | L10: Computer Security | M10: Conference | N10: www.usenix.org/legacy/events/sec11/
A11: 19th Usenix Security Symposium | B11: 2010 | C11: USENIX 2010 | D11: USENIX | E11: 2010-08-11T00:00:00.000 | F11: 2010-08-13T00:00:00.000 | G11: 207 | H11: 30 | I11: =RC[-1]/RC[-2] -> 0.14492753623188406 | J11: Washington | K11: USA | L11: Computer Security | M11: Conference | N11: www.usenix.org/legacy/events/sec10/
A12: 18th Usenix Security Symposium | B12: 2009 | C12: USENIX 2009 | D12: USENIX | E12: 2009-08-10T00:00:00.000 | F12: 2009-08-14T00:00:00.000 | G12: 176 | H12: 26 | I12: =RC[-1]/RC[-2] -> 0.14772727272727273 | J12: Montreal | K12: Canada | L12: Computer Security | M12: Conference | N12: www.usenix.org/legacy/events/sec09/
A13: 17th Usenix Security Symposium | B13: 2008 | C13: USENIX 2008 | D13: USENIX | E13: 2008-07-28T00:00:00.000 | F13: 2008-08-01T00:00:00.000 | G13: 174 | H13: 27 | I13: =RC[-1]/RC[-2] -> 0.15517241379310345 | J13: San Jose | K13: USA | L13: Computer Security | M13: Conference | N13: www.usenix.org/legacy/events/sec08/
A14: 16th Usenix Security Symposium | B14: 2007 | C14: USENIX 2007 | D14: USENIX | E14: 2007-08-06T00:00:00.000 | F14: 2007-08-10T00:00:00.000 | G14: 187 | H14: 23 | I14: =RC[-1]/RC[-2] -> 0.12299465240641712 | J14: Boston | K14: USA | L14: Computer Security | M14: Conference | N14: www.usenix.org/legacy/events/sec07/
A15: 15th Usenix Security Symposium | B15: 2006 | C15: USENIX 2006 | D15: USENIX | E15: 2006-07-31T00:00:00.000 | F15: 2006-08-04T00:00:00.000 | G15: 179 | H15: 22 | I15: =RC[-1]/RC[-2] -> 0.12290502793296089 | J15: Vancouver | K15: Canada | L15: Computer Security | M15: Conference | N15: www.usenix.org/legacy/events/sec06/
A16: 14th Usenix Security Symposium | B16: 2005 | C16: USENIX 2005 | D16: USENIX | E16: 2005-07-31T00:00:00.000 | F16: 2005-08-05T00:00:00.000 | G16: 149 | H16: 22 | I16: =RC[-1]/RC[-2] -> 0.1476510067114094 | K16: USA | L16: Computer Security | M16: Conference | N16: www.usenix.org/legacy/publications/library/proceedings/sec05/
A17: 13th Usenix Security Symposium | B17: 2004 | C17: USENIX 2004 | D17: USENIX | E17: 2004-08-09T00:00:00.000 | F17: 2004-08-13T00:00:00.000 | G17: 184 | H17: 22 | I17: =RC[-1]/RC[-2] -> 0.11956521739130435 | J17: San Diego | K17: USA | L17: Computer Security | M17: Conference | N17: www.usenix.org/legacy/publications/library/proceedings/sec04/
A18: 12th Usenix Security Symposium | B18: 2003 | C18: USENIX 2003 | D18: USENIX | E18: 2003-08-04T00:00:00.000 | F18: 2003-08-08T00:00:00.000 | G18: 128 | H18: 21 | I18: =RC[-1]/RC[-2] -> 0.1640625 | K18: USA | L18: Computer Security | M18: Conference | N18: www.usenix.org/legacy/publications/library/proceedings/sec03/
A19: 11th Usenix Security Symposium | B19: 2002 | C19: USENIX 2002 | D19: USENIX | E19: 2002-08-05T00:00:00.000 | F19: 2002-08-09T00:00:00.000 | G19: 130 | H19: 22 | I19: =RC[-1]/RC[-2] -> 0.16923076923076924 | K19: USA | L19: Computer Security | M19: Conference | N19: www.usenix.org/legacy/publications/library/proceedings/sec02/
A20: 10th Usenix Security Symposium | B20: 2001 | C20: USENIX 2001 | D20: USENIX | E20: 2001-08-13T00:00:00.000 | F20: 2001-08-17T00:00:00.000 | G20: 84 | H20: 25 | I20: =RC[-1]/RC[-2] -> 0.29761904761904762 | K20: USA | L20: Computer Security | M20: Conference | N20: www.usenix.org/legacy/publications/library/proceedings/sec01/
A21: 9th Usenix Security Symposium | B21: 2000 | C21: USENIX 2000 | D21: USENIX | E21: 2000-08-14T00:00:00.000 | F21: 2000-08-17T00:00:00.000 | G21: 80 | H21: 20 | I21: =RC[-1]/RC[-2] -> 0.25 | K21: USA | L21: Computer Security | M21: Conference | N21: www.usenix.org/legacy/publications/library/proceedings/sec2000/
A22: 8th Usenix Security Symposium | B22: 1999 | C22: USENIX 1999 | D22: USENIX | E22: 1999-08-23T00:00:00.000 | F22: 1999-08-26T00:00:00.000 | G22: 67 | H22: 18 | I22: =RC[-1]/RC[-2] -> 0.26865671641791045 | K22: USA | L22: Computer Security | M22: Conference | N22: www.usenix.org/legacy/publications/library/proceedings/sec99/
A23: 7th Usenix Security Symposium | B23: 1998 | C23: USENIX 1998 | D23: USENIX | E23: 1998-01-26T00:00:00.000 | F23: 1998-01-29T00:00:00.000 | G23: 65 | H23: 18 | I23: =RC[-1]/RC[-2] -> 0.27692307692307694 | K23: USA | L23: Computer Security | M23: Conference | N23: www.usenix.org/legacy/publications/library/proceedings/sec98/
A24: 6th Usenix Security Symposium | B24: 1996 | C24: USENIX 1996 | D24: USENIX | E24: 1996-07-22T00:00:00.000 | F24: 1996-07-25T00:00:00.000 | K24: USA | L24: Computer Security | M24: Conference | N24: www.usenix.org/legacy/publications/library/proceedings/sec96/
A25: 5th Usenix Security Symposium | B25: 1995 | C25: USENIX 1995 | D25: USENIX | E25: 1995-06-05T00:00:00.000 | F25: 1995-06-06T00:00:00.000 | K25: USA | L25: Computer Security | M25: Conference | N25: www.usenix.org/legacy/publications/library/proceedings/security95/
A26: 4th Usenix Security Symposium | B26: 1993 | C26: USENIX 1993 | D26: USENIX | E26: 1993-10-04T00:00:00.000 | F26: 1993-10-06T00:00:00.000 | K26: USA | L26: Computer Security | M26: Conference | N26: www.usenix.org/legacy/publications/library/proceedings/sec4/
A27: 3rd Usenix Security Symposium | B27: 1992 | C27: USENIX 1992 | D27: USENIX | E27: 1992-09-14T00:00:00.000 | F27: 1992-09-16T00:00:00.000 | J27: Berkeley | K27: USA | L27: Computer Security | M27: Conference
A28: 2nd Usenix Security Symposium | B28: 1991 | C28: USENIX 1991 | D28: USENIX | L28: Computer Security | M28: Conference
A29: 1st Usenix Security Symposium | B29: 1990 | C29: USENIX 1990 | D29: USENIX | L29: Computer Security | M29: Conference

Sheet: NDSS
A1: Title | B1: Event[Start date] | C1: Event[Acronym] | D1: Event[Series] | E1: Event[Start date] | F1: Event[End date] | G1: Event[Submitted papers] | H1: Event[Accepted papers] | I1: Event[Acceptance Rate] | J1: Event[City] | K1: Event[Country] | L1: Event[Field] | M1: Event[Type] | N1: Event[Homepage]
A2: 25th Annual Network and Distributed System Security Symposium | B2: 2018 | C2: NDSS 2018 | D2: NDSS | E2: 2018-02-18T00:00:00.000 | F2: 2018-02-21T00:00:00.000 | J2: San Diego | K2: USA | L2: Computer Security | M2: Symposium | N2: www.ndss-symposium.org/
A3: 24th Annual Network and Distributed System Security Symposium | B3: 2017 | C3: NDSS 2017 | D3: NDSS | E3: 2017-02-26T00:00:00.000 | F3: 2017-03-01T00:00:00.000 | G3: 423 | H3: 68 | I3: =RC[-1]/RC[-2] -> 0.16075650118203311 | J3: San Diego | K3: USA | L3: Computer Security | M3: Symposium | N3: www.ndss-symposium.org/ndss2017/
A4: 23rd Annual Network and Distributed System Security Symposium | B4: 2016 | C4: NDSS 2016 | D4: NDSS | E4: 2016-02-21T00:00:00.000 | F4: 2016-02-24T00:00:00.000 | G4: 389 | H4: 60 | I4: =RC[-1]/RC[-2] -> 0.15424164524421594 | J4: San Diego | K4: USA | L4: Computer Security | M4: Symposium | N4: www.ndss-symposium.org/ndss2016/
A5: 22nd Annual Network and Distributed System Security Symposium | B5: 2015 | C5: NDSS 2015 | D5: NDSS | E5: 2015-02-08T00:00:00.000 | F5: 2015-02-11T00:00:00.000 | G5: 302 | H5: 51 | I5: =RC[-1]/RC[-2] -> 0.16887417218543047 | J5: San Diego | K5: USA | L5: Computer Security | M5: Symposium | N5: www.ndss-symposium.org/ndss2015/
A6: 21th Annual Network and Distributed System Security Symposium | B6: 2014 | C6: NDSS 2014 | D6: NDSS | E6: 2014-02-23T00:00:00.000 | F6: 2014-02-26T00:00:00.000 | G6: 295 | H6: 55 | I6: =RC[-1]/RC[-2] -> 0.1864406779661017 | J6: San Diego | K6: USA | L6: Computer Security | M6: Symposium | N6: www.ndss-symposium.org/ndss2014/
A7: 20th Annual Network and Distributed System Security Symposium | B7: 2013 | C7: NDSS 2013 | D7: NDSS | E7: 2013-02-24T00:00:00.000 | F7: 2013-02-27T00:00:00.000 | G7: 250 | H7: 47 | I7: =RC[-1]/RC[-2] -> 0.188 | J7: San Diego | K7: USA | L7: Computer Security | M7: Symposium | N7: www.ndss-symposium.org/ndss2013/
A8: 19th Annual Network and Distributed System Security Symposium | B8: 2012 | C8: NDSS 2012 | D8: NDSS | E8: 2012-02-05T00:00:00.000 | F8: 2012-02-08T00:00:00.000 | G8: 258 | H8: 46 | I8: =RC[-1]/RC[-2] -> 0.17829457364341086 | J8: San Diego | K8: USA | L8: Computer Security | M8: Symposium | N8: www.ndss-symposium.org/ndss2012/
A9: 18th Network and Distributed System Security Symposium | B9: 2011 | C9: NDSS 2011 | D9: NDSS | E9: 2011-02-06T00:00:00.000 | F9: 2011-02-09T00:00:00.000 | G9: 139 | H9: 28 | I9: =RC[-1]/RC[-2] -> 0.20143884892086331 | J9: San Diego | K9: USA | L9: Computer Security | M9: Symposium | N9: www.ndss-symposium.org/ndss2011/
A10: 17th Network and Distributed System Security Symposium | B10: 2010 | C10: NDSS 2010 | D10: NDSS | E10: 2010-02-28T00:00:00.000 | F10: 2010-03-03T00:00:00.000 | G10: 156 | H10: 24 | I10: =RC[-1]/RC[-2] -> 0.15384615384615385 | J10: San Diego | K10: USA | L10: Computer Security | M10: Symposium | N10: www.ndss-symposium.org/ndss2010/
A11: 16th Network and Distributed System Security Symposium | B11: 2009 | C11: NDSS 2009 | D11: NDSS | E11: 2009-02-08T00:00:00.000 | F11: 2009-02-11T00:00:00.000 | G11: 171 | H11: 20 | I11: =RC[-1]/RC[-2] -> 0.11695906432748537 | J11: San Diego | K11: USA | L11: Computer Security | M11: Symposium | N11: www.ndss-symposium.org/ndss2009/
A12: 15th Network and Distributed System Security Symposium | B12: 2008 | C12: NDSS 2008 | D12: NDSS | E12: 2008-02-10T00:00:00.000 | F12: 2008-02-13T00:00:00.000 | G12: 121 | H12: 20 | I12: =RC[-1]/RC[-2] -> 0.16528925619834711 | J12: San Diego | K12: USA | L12: Computer Security | M12: Symposium | N12: www.ndss-symposium.org/ndss2008/
A13: 14th Network and Distributed System Security Symposium | B13: 2007 | C13: NDSS 2007 | D13: NDSS | E13: 2007-02-28T00:00:00.000 | F13: 2007-03-02T00:00:00.000 | G13: 125 | H13: 18 | I13: =RC[-1]/RC[-2] -> 0.14399999999999999 | J13: San Diego | K13: USA | L13: Computer Security | M13: Symposium | N13: www.ndss-symposium.org/ndss2007/
A14: 13th Network and Distributed System Security Symposium | B14: 2006 | C14: NDSS 2006 | D14: NDSS | E14: 2006-02-02T00:00:00.000 | F14: 2006-02-03T00:00:00.000 | G14: 127 | H14: 17 | I14: =RC[-1]/RC[-2] -> 0.13385826771653545 | J14: San Diego | K14: USA | L14: Computer Security | M14: Symposium | N14: www.ndss-symposium.org/ndss2006/
A15: 12th Network and Distributed System Security Symposium | B15: 2005 | C15: NDSS 2005 | D15: NDSS | E15: 2005-02-03T00:00:00.000 | F15: 2005-02-04T00:00:00.000 | G15: 124 | H15: 16 | I15: =RC[-1]/RC[-2] -> 0.12903225806451613 | J15: San Diego | K15: USA | L15: Computer Security | M15: Symposium | N15: www.ndss-symposium.org/ndss2005/
A16: 11th Network and Distributed System Security Symposium | B16: 2004 | C16: NDSS 2004 | D16: NDSS | E16: 2004-02-05T00:00:00.000 | F16: 2004-02-06T00:00:00.000 | G16: 98 | H16: 16 | I16: =RC[-1]/RC[-2] -> 0.16326530612244897 | J16: San Diego | K16: USA | L16: Computer Security | M16: Symposium | N16: www.ndss-symposium.org/ndss2004/
A17: 10th Network and Distributed System Security Symposium | B17: 2003 | C17: NDSS 2003 | D17: NDSS | E17: 2003-02-06T00:00:00.000 | F17: 2003-02-07T00:00:00.000 | G17: 82 | H17: 17 | I17: =RC[-1]/RC[-2] -> 0.2073170731707317 | J17: San Diego | K17: USA | L17: Computer Security | M17: Symposium | N17: www.ndss-symposium.org/ndss2003/
A18: 9th Network and Distributed System Security Symposium | B18: 2002 | C18: NDSS 2002 | D18: NDSS | E18: 2002-02-06T00:00:00.000 | F18: 2002-02-08T00:00:00.000 | G18: 79 | H18: 16 | I18: =RC[-1]/RC[-2] -> 0.20253164556962025 | J18: San Diego | K18: USA | L18: Computer Security | M18: Symposium | N18: www.ndss-symposium.org/ndss2002/
A19: 8th Network and Distributed System Security Symposium | B19: 2001 | C19: NDSS 2001 | D19: NDSS | E19: 2001-02-08T00:00:00.000 | F19: 2001-02-09T00:00:00.000 | G19: 66 | H19: 16 | I19: =RC[-1]/RC[-2] -> 0.24242424242424243 | J19: San Diego | K19: USA | L19: Computer Security | M19: Symposium | N19: www.ndss-symposium.org/ndss2001/
A20: 7th Network and Distributed System Security Symposium | B20: 2000 | C20: NDSS 2000 | D20: NDSS | E20: 2000-02-03T00:00:00.000 | F20: 2000-02-04T00:00:00.000 | G20: 51 | H20: 15 | I20: =RC[-1]/RC[-2] -> 0.29411764705882354 | J20: San Diego | K20: USA | L20: Computer Security | M20: Symposium | N20: www.ndss-symposium.org/ndss2000/
A21: 6th Network and Distributed System Security Symposium | B21: 1999 | C21: NDSS 1999 | D21: NDSS | E21: 1999-02-04T00:00:00.000 | F21: 1999-02-05T00:00:00.000 | J21: San Diego | K21: USA | L21: Computer Security | M21: Symposium | N21: www.ndss-symposium.org/ndss1999/
A22: 5th Network and Distributed System Security Symposium | B22: 1998 | C22: NDSS 1998 | D22: NDSS | E22: 1998-02-05T00:00:00.000 | F22: 1998-02-06T00:00:00.000 | G22: 45 | H22: 15 | I22: =RC[-1]/RC[-2] -> 0.33333333333333331 | J22: San Diego | K22: USA | L22: Computer Security | M22: Symposium | N22: www.ndss-symposium.org/ndss1998/
A23: 4th Network and Distributed System Security Symposium | B23: 1997 | C23: NDSS 1997 | D23: NDSS | E23: 1997-02-06T00:00:00.000 | F23: 1997-02-07T00:00:00.000 | J23: San Diego | K23: USA | L23: Computer Security | M23: Symposium | N23: www.ndss-symposium.org/ndss1997/
A24: 3rd Network and Distributed System Security Symposium | B24: 1996 | C24: NDSS 1996 | D24: NDSS | E24: 1996-02-22T00:00:00.000 | F24: 1996-02-23T00:00:00.000 | J24: San Diego | K24: USA | L24: Computer Security | M24: Symposium | N24: www.ndss-symposium.org/ndss1996/
A25: 2nd Network and Distributed System Security Symposium | B25: 1995 | C25: NDSS 1995 | D25: NDSS | E25: 1995-02-16T00:00:00.000 | F25: 1995-02-17T00:00:00.000 | J25: San Diego | K25: USA | L25: Computer Security | M25: Symposium | N25: www.ndss-symposium.org/ndss1995/
A26: 1st Network and Distributed System Security Symposium | B26: 1993 | C26: NDSS 1993 | D26: NDSS | G26: 20 | H26: 10 | I26: =RC[-1]/RC[-2] -> 0.5 | J26: San Diego | K26: USA | L26: Computer Security | M26: Symposium

Sheet: EuroCrypt
A1: Title | B1: Event[Start date] | C1: Event[Acronym] | D1: Event[Series] | E1: Event[Start date] | F1: Event[End date] | G1: Event[Submitted papers] | H1: Event[Accepted papers] | I1: Event[Submission Rate] | J1: Event[City] | K1: Event[State] | L1: Event[Country] | M1: Event[Field] | N1: Event[Type] | O1: Event[Homepage]
A2: International Conference on the Theory and Applications of Cryptographic Techniques | B2: 2018 | C2: EuroCrypt 2018 | D2: EuroCrypt | E2: 2018-04-29T00:00:00.000 | F2: 2018-05-03T00:00:00.000 | J2: Tel Aviv | L2: Isreal | M2: Cryptographic Techniques | N2: Conference | O2: eurocrypt.iacr.org/2018/
A3: International Conference on the Theory and Applications of Cryptographic Techniques | B3: 2017 | C3: EuroCrypt 2017 | D3: EuroCrypt | E3: 2017-04-30T00:00:00.000 | F3: 2017-05-04T00:00:00.000 | G3: 264 | H3: 67 | I3: =RC[-1]/RC[-2] -> 0.25378787878787878 | J3: Paris | L3: France | M3: Cryptographic Techniques | N3: Conference | O3: eurocrypt2017.di.ens.fr/
A4: International Conference on the Theory and Applications of Cryptographic Techniques | B4: 2016 | C4: EuroCrypt 2016 | D4: EuroCrypt | E4: 2016-05-08T00:00:00.000 | F4: 2016-05-12T00:00:00.000 | G4: 274 | H4: 62 | I4: =RC[-1]/RC[-2] -> 0.22627737226277372 | J4: Vienna | L4: Austria | M4: Cryptographic Techniques | N4: Conference | O4: ist.ac.at/eurocrypt2016/
A5: International Conference on the Theory and Applications of Cryptographic Techniques | B5: 2015 | C5: EuroCrypt 2015 | D5: EuroCrypt | E5: 2015-04-26T00:00:00.000 | F5: 2015-04-30T00:00:00.000 | G5: 194 | H5: 57 | I5: =RC[-1]/RC[-2] -> 0.29381443298969073 | J5: Sofia | L5: Bulgaria | M5: Cryptographic Techniques | N5: Conference | O5: www.cosic.esat.kuleuven.be/eurocrypt_2015/
A6: International Conference on the Theory and Applications of Cryptographic Techniques | B6: 2014 | C6: EuroCrypt 2014 | D6: EuroCrypt | E6: 2014-05-11T00:00:00.000 | F6: 2014-05-15T00:00:00.000 | G6: 197 | H6: 38 | I6: =RC[-1]/RC[-2] -> 0.19289340101522842 | J6: Copenhagen | L6: Denmark | M6: Cryptographic Techniques | N6: Conference | O6: ec14.compute.dtu.dk/
A7: International Conference on the Theory and Applications of Cryptographic Techniques | B7: 2013 | C7: EuroCrypt 2013 | D7: EuroCrypt | E7: 2013-05-26T00:00:00.000 | F7: 2013-05-30T00:00:00.000 | G7: 201 | H7: 41 | I7: =RC[-1]/RC[-2] -> 0.20398009950248755 | J7: Athens | L7: Greece | M7: Cryptographic Techniques | N7: Conference | O7: www.iacr.org/conferences/eurocrypt2013/
A8: International Conference on the Theory and Applications of Cryptographic Techniques | B8: 2012 | C8: EuroCrypt 2012 | D8: EuroCrypt | E8: 2012-04-15T00:00:00.000 | F8: 2012-04-19T00:00:00.000 | G8: 195 | H8: 41 | I8: =RC[-1]/RC[-2] -> 0.21025641025641026 | J8: Cambridge | L8: UK | M8: Cryptographic Techniques | N8: Conference | O8: www.cs.bris.ac.uk/eurocrypt2012/
A9: International Conference on the Theory and Applications of Cryptographic Techniques | B9: 2011 | C9: EuroCrypt 2011 | D9: EuroCrypt | E9: 2011-05-15T00:00:00.000 | F9: 2011-05-19T00:00:00.000 | G9: 167 | H9: 31 | I9: =RC[-1]/RC[-2] -> 0.18562874251497005 | J9: Tallinn | L9: Estonia | M9: Cryptographic Techniques | N9: Conference | O9: www.iacr.org/conferences/eurocrypt2011/
A10: International Conference on the Theory and Applications of Cryptographic Techniques | B10: 2010 | C10: EuroCrypt 2010 | D10: EuroCrypt | E10: 2010-05-30T00:00:00.000 | F10: 2010-06-03T00:00:00.000 | G10: 188 | H10: 35 | I10: =RC[-1]/RC[-2] -> 0.18617021276595744 | J10: French Riviera | L10: France | M10: Cryptographic Techniques | N10: Conference | O10: crypto.rd.francetelecom.com/events/eurocrypt2010/
A11: International Conference on the Theory and Applications of Cryptographic Techniques | B11: 2009 | C11: EuroCrypt 2009 | D11: EuroCrypt | E11: 2009-04-26T00:00:00.000 | F11: 2009-04-30T00:00:00.000 | G11: 148 | H11: 33 | I11: =RC[-1]/RC[-2] -> 0.22297297297297297 | J11: Cologne | L11: Germany | M11: Cryptographic Techniques | N11: Conference | O11: www.iacr.org/conferences/eurocrypt2009/
A12: International Conference on the Theory and Applications of Cryptographic Techniques | B12: 2008 | C12: EuroCrypt 2008 | D12: EuroCrypt | E12: 2008-04-13T00:00:00.000 | F12: 2008-04-17T00:00:00.000 | G12: 163 | H12: 31 | I12: =RC[-1]/RC[-2] -> 0.19018404907975461 | J12: Istanbul | L12: Turkey | M12: Cryptographic Techniques | N12: Conference | O12: www.iacr.org/conferences/eurocrypt2008/
A13: International Conference on the Theory and Applications of Cryptographic Techniques | B13: 2007 | C13: EuroCrypt 2007 | D13: EuroCrypt | E13: 2007-05-20T00:00:00.000 | F13: 2007-05-24T00:00:00.000 | G13: 173 | H13: 33 | I13: =RC[-1]/RC[-2] -> 0.19075144508670519 | J13: Barcelona | L13: Spain | M13: Cryptographic Techniques | N13: Conference | O13: www.iacr.org/conferences/eurocrypt2007/
A14: International Conference on the Theory and Applications of Cryptographic Techniques | B14: 2006 | C14: EuroCrypt 2006 | D14: EuroCrypt | E14: 2006-05-28T00:00:00.000 | F14: 2006-06-01T00:00:00.000 | G14: 198 | H14: 33 | I14: =RC[-1]/RC[-2] -> 0.16666666666666666 | J14: St. Petersburg | L14: Russia | M14: Cryptographic Techniques | N14: Conference | O14: www.iacr.org/conferences/eurocrypt2006/
A15: International Conference on the Theory and Applications of Cryptographic Techniques | B15: 2005 | C15: EuroCrypt 2005 | D15: EuroCrypt | E15: 2005-05-22T00:00:00.000 | F15: 2005-05-26T00:00:00.000 | G15: 190 | H15: 33 | I15: =RC[-1]/RC[-2] -> 0.1736842105263158 | J15: Aarhus | L15: Denmark | M15: Cryptographic Techniques | N15: Conference | O15: www.iacr.org/conferences/eurocrypt2005/
A16: International Conference on the Theory and Applications of Cryptographic Techniques | B16: 2004 | C16: EuroCrypt 2004 | D16: EuroCrypt | E16: 2004-05-02T00:00:00.000 | F16: 2004-05-06T00:00:00.000 | G16: 206 | H16: 36 | I16: =RC[-1]/RC[-2] -> 0.17475728155339806 | J16: Interlaken | L16: Switzerland | M16: Cryptographic Techniques | N16: Conference | O16: www.iacr.org/conferences/eurocrypt2004/
A17: International Conference on the Theory and Applications of Cryptographic Techniques | B17: 2003 | C17: EuroCrypt 2003 | D17: EuroCrypt | E17: 2003-05-04T00:00:00.000 | F17: 2003-05-08T00:00:00.000 | G17: 156 | H17: 37 | I17: =RC[-1]/RC[-2] -> 0.23717948717948717 | J17: Warsaw | L17: Poland | M17: Cryptographic Techniques | N17: Conference | O17: www.iacr.org/conferences/eurocrypt2003/
A18: International Conference on the Theory and Applications of Cryptographic Techniques | B18: 2002 | C18: EuroCrypt 2002 | D18: EuroCrypt | E18: 2002-04-28T00:00:00.000 | F18: 2002-05-02T00:00:00.000 | G18: 122 | H18: 33 | I18: =RC[-1]/RC[-2] -> 0.27049180327868855 | J18: Amsterdam | L18: Netherlands | M18: Cryptographic Techniques | N18: Conference | O18: www.ec2002.tue.nl/
A19: International Conference on the Theory and Applications of Cryptographic Techniques | B19: 2001 | C19: EuroCrypt 2001 | D19: EuroCrypt | E19: 2001-05-06T00:00:00.000 | F19: 2001-05-10T00:00:00.000 | G19: 155 | H19: 32 | I19: =RC[-1]/RC[-2] -> 0.20645161290322581 | J19: Innsbruck | L19: Austria | M19: Cryptographic Techniques | N19: Conference | O19: www.iacr.org/archive/eurocrypt2001/eurocrypt-2001.html
A20: International Conference on the Theory and Applications of Cryptographic Techniques | B20: 2000 | C20: EuroCrypt 2000 | D20: EuroCrypt | E20: 2000-05-14T00:00:00.000 | F20: 2000-05-18T00:00:00.000 | G20: 150 | H20: 39 | I20: =RC[-1]/RC[-2] -> 0.26 | J20: Bruges | L20: Belgium | M20: Cryptographic Techniques | N20: Conference | O20: www.iacr.org/conferences/eurocrypt2000/
A21: International Conference on the Theory and Applications of Cryptographic Techniques | B21: 1999 | C21: EuroCrypt 1999 | D21: EuroCrypt | E21: 1999-05-02T00:00:00.000 | F21: 1999-05-06T00:00:00.000 | G21: 122 | H21: 32 | I21: =RC[-1]/RC[-2] -> 0.26229508196721313 | J21: Prague | L21: Czech Republic | M21: Cryptographic Techniques | N21: Conference | O21: www.iacr.org/conferences/ec99/
A22: International Conference on the Theory and Applications of Cryptographic Techniques | B22: 1998 | C22: EuroCrypt 1998 | D22: EuroCrypt | E22: 1998-05-31T00:00:00.000 | F22: 1998-06-04T00:00:00.000 | G22: 161 | H22: 44 | I22: =RC[-1]/RC[-2] -> 0.27329192546583853 | J22: Espoo | L22: Finland | M22: Cryptographic Techniques | N22: Conference | O22: www.iacr.org/conferences/ec98/
A23: International Conference on the Theory and Applications of Cryptographic Techniques | B23: 1997 | C23: EuroCrypt 1997 | D23: EuroCrypt | E23: 1997-05-11T00:00:00.000 | F23: 1997-05-15T00:00:00.000 | G23: 104 | H23: 34 | I23: =RC[-1]/RC[-2] -> 0.32692307692307693 | J23: Konstanz | L23: Germany | M23: Cryptographic Techniques | N23: Conference | O23: www.iacr.org/conferences/ec97/
A24: International Conference on the Theory and Applications of Cryptographic Techniques | B24: 1996 | C24: EuroCrypt 1996 | D24: EuroCrypt | E24: 1996-05-12T00:00:00.000 | F24: 1996-05-16T00:00:00.000 | G24: 126 | H24: 34 | I24: =RC[-1]/RC[-2] -> 0.26984126984126983 | J24: Saragossa | L24: Spain | M24: Cryptographic Techniques | N24: Conference | O24: www.iacr.org/conferences/ec96/
A25: International Conference on the Theory and Applications of Cryptographic Techniques | B25: 1995 | C25: EuroCrypt 1995 | D25: EuroCrypt | E25: 1995-05-21T00:00:00.000 | F25: 1995-05-25T00:00:00.000 | G25: 113 | H25: 33 | I25: =RC[-1]/RC[-2] -> 0.29203539823008851 | J25: Saint-Malo | L25: France | M25: Cryptographic Techniques | N25: Conference | O25: www.iacr.org/conferences/ec95/
A26: Workshop on the Theory and Application of Cryptographic Techniques, | B26: 1994 | C26: EuroCrypt 1994 | D26: EuroCrypt | E26: 1994-05-09T00:00:00.000 | F26: 1994-05-12T00:00:00.000 | G26: 137 | H26: 36 | I26: =RC[-1]/RC[-2] -> 0.26277372262773724 | J26: Perugia | L26: Italy | M26: Cryptographic Techniques | N26: Conference | O26: www.iacr.org/cryptodb/data/conf.php?year=1994&venue=eurocrypt
A27: Workshop on the Theory and Application of Cryptographic Techniques, | B27: 1993 | C27: EuroCrypt 1993 | D27: EuroCrypt | E27: 1993-05-23T00:00:00.000 | F27: 1993-05-27T00:00:00.000 | G27: 117 | H27: 27 | I27: =RC[-1]/RC[-2] -> 0.23076923076923078 | J27: Lofthus | L27: Norway | M27: Cryptographic Techniques | N27: Conference | O27: www.iacr.org/cryptodb/data/conf.php?year=1993&venue=eurocrypt
A28: Workshop on the Theory and Application of Cryptographic Techniques, | B28: 1992 | C28: EuroCrypt 1992 | D28: EuroCrypt | E28: 1992-05-24T00:00:00.000 | F28: 1992-05-28T00:00:00.000 | H28: 45 | J28: Balatonfüred | L28: Hungary | M28: Cryptographic Techniques | N28: Conference | O28: www.iacr.org/cryptodb/data/conf.php?year=1992&venue=eurocrypt
A29: Workshop on the Theory and Application of Cryptographic Techniques, | B29: 1991 | C29: EuroCrypt 1991 | D29: EuroCrypt | E29: 1991-04-08T00:00:00.000 | F29: 1991-04-11T00:00:00.000 | H29: 54 | J29: Brighton | L29: UK | M29: Cryptographic Techniques | N29: Conference | O29: www.iacr.org/cryptodb/data/conf.php?year=1991&venue=eurocrypt
A30: Workshop on the Theory and Application of Cryptographic Techniques, | B30: 1990 | C30: EuroCrypt 1990 | D30: EuroCrypt | E30: 1990-05-21T00:00:00.000 | F30: 1990-05-24T00:00:00.000 | G30: 85 | H30: 42 | I30: =RC[-1]/RC[-2] -> 0.49411764705882355 | J30: Aarhus | L30: Denmark | M30: Cryptographic Techniques | N30: Conference | O30: www.iacr.org/cryptodb/data/conf.php?year=1990&venue=eurocrypt
A31: Workshop on the Theory and Application of Cryptographic Techniques, | B31: 1989 | C31: EuroCrypt 1989 | D31: EuroCrypt | E31: 1989-04-10T00:00:00.000 | F31: 1989-04-13T00:00:00.000 | H31: 72 | J31: Houthalen | L31: Belgium | M31: Cryptographic Techniques | N31: Conference | O31: www.iacr.org/cryptodb/data/conf.php?year=1989&venue=eurocrypt
A32: Workshop on the Theory and Application of Cryptographic Techniques, | B32: 1988 | C32: EuroCrypt 1988 | D32: EuroCrypt | E32: 1988-05-25T00:00:00.000 | F32: 1988-05-27T00:00:00.000 | H32: 40 | J32: Davos | L32: Switzerland | M32: Cryptographic Techniques | N32: Conference | O32: www.iacr.org/cryptodb/data/conf.php?year=1988&venue=eurocrypt
A33: Workshop on the Theory and Application of Cryptographic Techniques, | B33: 1987 | C33: EuroCrypt 1987 | D33: EuroCrypt | E33: 1987-04-13T00:00:00.000 | F33: 1987-04-15T00:00:00.000 | J33: Amsterdam | L33: Netherlands | M33: Cryptographic Techniques | N33: Conference | O33: www.iacr.org/cryptodb/data/conf.php?year=1987&venue=eurocrypt
A34: Workshop on the Theory and Application of Cryptographic Techniques, | B34: 1986 | C34: EuroCrypt 1986 | D34: EuroCrypt | E34: 1986-05-20T00:00:00.000 | F34: 1986-05-22T00:00:00.000 | J34: Linköping | L34: Sweden | M34: Cryptographic Techniques | N34: Conference | O34: www.iacr.org/cryptodb/data/conf.php?year=1986&venue=eurocrypt
A35: Workshop on the Theory and Application of Cryptographic Techniques, | B35: 1985 | C35: EuroCrypt 1985 | D35: EuroCrypt | E35: 1985-04-09T00:00:00.000 | F35: 1985-04-11T00:00:00.000 | J35: Linz | L35: Austria | M35: Cryptographic Techniques | N35: Conference | O35: www.iacr.org/cryptodb/data/conf.php?year=1985&venue=eurocrypt
A36: Workshop on the Theory and Application of Cryptographic Techniques, | B36: 1984 | C36: EuroCrypt 1984 | D36: EuroCrypt | E36: 1984-04-09T00:00:00.000 | F36: 1984-04-11T00:00:00.000 | J36: Paris | L36: France | M36: Cryptographic Techniques | N36: Conference | O36: www.iacr.org/cryptodb/data/conf.php?year=1984&venue=eurocrypt
A37: Workshop on the Theory and Application of Cryptographic Techniques, | B37: 1983 | C37: EuroCrypt 1983 | D37: EuroCrypt | J37: Udine | L37: Italy | M37: Cryptographic Techniques | N37: Conference
A38: Workshop on Cryptography | B38: 1982 | C38: EuroCrypt 1982 | D38: EuroCrypt | E38: 1982-03-29T00:00:00.000 | F38: 1982-04-02T00:00:00.000 | J38: Burg Feuerstein | L38: Germany | M38: Cryptographic Techniques | N38: Conference | O38: www.iacr.org/cryptodb/data/conf.php?year=1982&venue=eurocrypt